transaction_id,account_number,customer_id,trade_date,settlement_date,symbol,security_name,transaction_type,quantity,price_per_share,total_amount,currency,commission,tax,account_type,broker_id,market,timestamp,client_notes,risk_rating
TXN000001,ACC-770487,CUST_115,13-01-2024,01/14/2024,JPM,JPMorgan Chase & Co,BUY,17,163.620,"-2,781.53",USD,6.49,0.00,Retirement,BRK002,NYSE,2024-01-13T09:35:12Z,Year-end selling,Med
TXN000002,ACC-717889,CUST_285,04/01/2024,01-05-2024,JNJ,Johnson & Johnson,SELL,173,$169.14,"$29,261.96",USD,10.11,303.88,Corporate,BRK005,NYSE,2024-01-04T09:46:29Z,Dividend reinvestment,
TXN000003,ACC-969693,CUST_644,12-Nov-2024,11-13-2024,GLD,SPDR Gold Shares,BUY,41,$210.9227,-8647.83,USD,47.77,0.00,Individual,BRK004,NYSE ARCA,2024-11-12T16:40:53Z,Tax loss harvesting,
TXN000004,ACC-835911,CUST_960,12/15/2024,,SLV,iShares Silver Trust,DIVIDEND,796,$1.30,"$1,034.46",USD,28.11,0.00,Corporate,BRK005,NYSE ARCA,2024-12-15T14:53:49Z,Profit taking,Very High
TXN000005,ACC-169403,CUST_217,17-Oct-2024,,NVDA,NVIDIA Corporation,DIVIDEND,955,4.581283,"$4,375.13",USD,27.94,0.00,Corporate,BRK002,NASDAQ,2024-10-17T13:47:37Z,Market timing,Very High
TXN000006,ACC-245051,CUST_522,09/09/2024,10/09/2024,KO,The Coca-Cola Company,BUY,217,$62.92,"$-13,653.81",USD,34.82,0.00,Trust,BRK004,NYSE,2024-09-09T13:35:55Z,Quarterly rebalancing,HIGH
TXN000007,ACC-456699,CUST_115,2024.05.30,,META,Meta Platforms Inc,SELL,369,308.314,$113767.80,USD,18.17,873.71,Individual,BRK003,NASDAQ,2024-05-30T12:09:23Z,Risk management,Med
TXN000008,ACC-728038,CUST_332,2024-09-07,09-09-2024,TSLA,Tesla Inc,SELL,450,186.95,"$84,127.96",USD,33.37,0.00,Trust,BRK001,NASDAQ,2024-09-07T11:08:42Z,Risk management,Med
TXN000009,ACC-736059,CUST_434,04-18-2024,21-Apr-2024,JNJ,Johnson & Johnson,SELL,265,$158.76,42071.93,USD,27.57,250.77,Individual,BRK005,NYSE,2024-04-18T12:37:14Z,,Med
TXN000010,ACC-170674,CUST_928,17-Jan-2024,,MSFT,Microsoft Corporation,DIVIDEND,735,$2.48,$1821.72,USD,31.96,0.00,Joint,BRK005,NASDAQ,2024-01-17T12:50:30Z,Profit taking,HIGH
TXN000011,ACC-471507,CUST_434,29 July 2024,,NFLX,Netflix Inc,DIVIDEND,719,4.92241,3539.21,USD,9.92,0.00,Trust,BRK003,NASDAQ,2024-07-29T12:12:12Z,Rebalancing,Medium
TXN000012,ACC-361941,CUST_896,08 February 2024,,PEP,PepsiCo Inc,DIVIDEND,717,4.996484,$3582.48,USD,46.80,0.00,Individual,BRK002,NASDAQ,2024-02-08T15:31:30Z,,High
TXN000013,ACC-102260,CUST_400,15 May 2024,18 May 2024,WFC,Wells Fargo & Co,SELL,152,38.096,5790.58,USD,15.89,,Joint,BRK001,NYSE,2024-05-15T09:03:37Z,,MEDIUM
TXN000014,ACC-632496,CUST_83,04/05/2024,2024.04.06,SLV,iShares Silver Trust,BUY,456,$21.1989,"$-9,666.68",USD,33.48,0.00,Joint,BRK005,NYSE ARCA,2024-04-05T10:26:42Z,Risk management,Low
TXN000015,ACC-850981,CUST_322,02-05-2024,04 May 2024,VTI,Vanguard Total Stock Market ETF,BUY,385,$215.8089,$-83086.41,USD,51.79,0.00,Individual,BRK004,NYSE ARCA,2024-05-02T10:34:13Z,Rebalancing,Medium
TXN000016,ACC-487477,CUST_292,21 March 2024,,DIS,The Walt Disney Company,DIVIDEND,676,4.92,"$3,326.52",USD,45.35,0.00,Joint,BRK001,NYSE,2024-03-21T13:59:42Z,,Med
TXN000017,ACC-212235,CUST_761,10/10/2024,13-Oct-2024,BAC,Bank of America Corp,SELL,325,$29.0719,9448.38,USD,47.65,82.83,Individual,BRK001,NYSE,2024-10-10T13:02:00Z,Rebalancing,low
TXN000018,ACC-877236,CUST_453,2024.10.09,12/10/2024,BOND_10Y,US Treasury 10 Year,BUY,428,$100.46,"$-42,995.13",USD,23.46,0.00,Joint,BRK002,BOND,2024-10-09T11:02:19Z,Estate planning,low
TXN000019,ACC-361650,CUST_683,22-Feb-2024,,KO,The Coca-Cola Company,DIVIDEND,466,4.871801,2270.26,USD,42.47,0.00,Retirement,BRK002,NYSE,2024-02-22T15:01:11Z,Tax loss harvesting,High
TXN000020,ACC-925622,CUST_719,2024.02.25,02-26-2024,NFLX,Netflix Inc,BUY,236,$472.49,"$-111,507.17",USD,22.48,0.00,Retirement,BRK002,NASDAQ,2024-02-25T12:25:21Z,,Low
TXN000021,ACC-634150,CUST_410,13-Dec-2024,15/12/2024,AAPL,Apple Inc,BUY,136,179.029487,-24348.01,USD,6.91,0.00,Joint,BRK004,NASDAQ,2024-12-13T14:27:38Z,Short-term trade,MEDIUM
TXN000022,ACC-843215,CUST_447,01-01-2024,,QQQ,Invesco QQQ Trust,SELL,170,416.42,70792.04,USD,36.16,486.30,Corporate,BRK005,NASDAQ,2024-01-01T15:20:25Z,Risk management,
TXN000023,ACC-540869,CUST_681,13/07/2024,,SLV,iShares Silver Trust,DIVIDEND,611,4.185253,2557.19,USD,20.19,0.00,Retirement,BRK004,NYSE ARCA,2024-07-13T16:28:28Z,Risk management,MEDIUM
TXN000024,ACC-397571,CUST_528,05-Dec-2024,12-06-2024,MSFT,Microsoft Corporation,BUY,24,317.682475,"-7,624.38",USD,17.24,0.00,Trust,BRK005,NASDAQ,2024-12-05T16:26:56Z,Profit taking,Medium
TXN000025,ACC-254739,CUST_672,2024-12-18,19/12/2024,CRM,Salesforce Inc,BUY,357,264.329,"$-94,365.38",USD,30.90,0.00,Individual,BRK005,NYSE,2024-12-18T10:29:08Z,Quarterly rebalancing,Very High
TXN000026,ACC-564071,CUST_628,2024.09.15,,DIS,The Walt Disney Company,DIVIDEND,212,$3.74,$793.71,USD,28.73,0.00,Corporate,BRK002,NYSE,2024-09-15T16:40:15Z,,
TXN000027,ACC-452161,CUST_328,10/03/2024,06/10/2024,AMZN,Amazon.com Inc,BUY,33,168.257,$-5552.47,USD,25.74,0.00,Corporate,BRK005,NASDAQ,2024-10-03T15:03:13Z,Dividend reinvestment,HIGH
TXN000028,ACC-902784,CUST_590,13 July 2024,2024.07.15,AAPL,Apple Inc,SELL,377,176.911028,66695.46,USD,32.31,554.11,Retirement,BRK003,NASDAQ,2024-07-13T16:01:24Z,Quarterly rebalancing,low
TXN000029,ACC-981334,CUST_479,2024-03-06,2024-03-09,ORCL,Oracle Corporation,SELL,220,$102.5184,"22,554.05",USD,11.78,129.78,Trust,BRK003,NYSE,2024-03-06T16:20:21Z,Dividend reinvestment,Very High
TXN000030,ACC-364525,CUST_855,11 February 2024,,AAPL,Apple Inc,DIVIDEND,408,1.20,489.06,USD,8.43,0.00,Individual,BRK001,NASDAQ,2024-02-11T12:53:01Z,Profit taking,Very High
TXN000031,ACC-691364,CUST_971,21 April 2024,04/22/2024,JNJ,Johnson & Johnson,SELL,84,165.56,$13906.69,USD,53.24,74.89,Corporate,BRK005,NYSE,2024-04-21T15:45:12Z,,low
TXN000032,ACC-831059,CUST_792,06/03/2024,,PEP,PepsiCo Inc,DIVIDEND,405,2.710452,"$1,097.73",USD,38.08,0.00,Individual,BRK005,NASDAQ,2024-06-03T09:54:26Z,Short-term trade,MEDIUM
TXN000033,ACC-968962,CUST_471,28/12/2024,31-12-2024,BTC-USD,Bitcoin USD,BUY,9.196257,$56556.9324,"-520,112.08",USD,43.73,0.00,Trust,BRK004,CRYPTO,2024-12-28T14:54:15Z,Short-term trade,
TXN000034,ACC-587282,CUST_584,2024.11.08,10/11/2024,SPY,SPDR S&P 500 ETF,BUY,182,448.754993,"-81,673.41",USD,44.89,0.00,Corporate,BRK003,NYSE ARCA,2024-11-08T09:33:12Z,,
TXN000035,ACC-351997,CUST_708,31 August 2024,2024.09.01,ETH-USD,Ethereum USD,BUY,3.062754,3383.574311,"$-10,363.06",USD,34.08,0.00,Trust,BRK005,CRYPTO,2024-08-31T14:27:47Z,Tax loss harvesting,Med
TXN000036,ACC-341736,CUST_124,08-Apr-2024,,TSLA,Tesla Inc,DIVIDEND,830,3.48,"$2,889.90",USD,14.58,0.00,Trust,BRK003,NASDAQ,2024-04-08T13:06:53Z,,Med
TXN000037,ACC-114835,CUST_726,30/09/2024,03-10-2024,BAC,Bank of America Corp,BUY,65,$38.95,"$-2,531.64",USD,36.89,0.00,Trust,BRK001,NYSE,2024-09-30T13:30:30Z,Rebalancing,Low
TXN000038,ACC-600935,CUST_117,2024.02.03,2024-02-06,EUR/USD,Euro US Dollar,BUY,435272,1.061,-461658.58,USD,33.14,0.00,Corporate,BRK001,FOREX,2024-02-03T10:35:48Z,Market timing,Very High
TXN000039,ACC-498855,CUST_462,14-08-2024,,NFLX,Netflix Inc,DIVIDEND,362,2.89,$1044.83,USD,8.01,0.00,Individual,BRK002,NASDAQ,2024-08-14T13:42:05Z,,Very High
TXN000040,ACC-528361,CUST_462,18 December 2024,21-12-2024,WFC,Wells Fargo & Co,BUY,233,49.06,"$-11,430.92",USD,8.56,0.00,Retirement,BRK003,NYSE,2024-12-18T15:07:34Z,,Very High
TXN000041,ACC-174878,CUST_62,25-03-2024,,SLV,iShares Silver Trust,DIVIDEND,993,$1.5142,"$1,503.59",USD,11.22,,Corporate,BRK004,NYSE ARCA,2024-03-25T16:28:05Z,Dividend reinvestment,
TXN000042,ACC-340044,CUST_985,2024-12-11,,KO,The Coca-Cola Company,DIVIDEND,640,0.297135,$190.17,USD,42.81,0.00,Trust,BRK005,NYSE,2024-12-11T13:11:37Z,,HIGH
TXN000043,ACC-528184,CUST_342,06/13/2024,16 June 2024,NFLX,Netflix Inc,BUY,484,393.232669,$-190324.61,USD,25.02,0.00,Joint,BRK001,NASDAQ,2024-06-13T10:20:16Z,Estate planning,HIGH
TXN000044,ACC-668950,CUST_474,2024-07-30,,NVDA,NVIDIA Corporation,DIVIDEND,824,2.542616,$2095.12,USD,27.10,,Individual,BRK002,NASDAQ,2024-07-30T11:59:18Z,Year-end selling,
TXN000045,ACC-760626,CUST_624,02/05/2024,,WFC,Wells Fargo & Co,DIVIDEND,467,$0.5567,259.99,USD,54.61,0.00,Individual,BRK004,NYSE,2024-05-02T11:31:59Z,Risk management,Medium
TXN000046,ACC-595158,CUST_250,21/08/2024,24/08/2024,VTI,Vanguard Total Stock Market ETF,BUY,142,$243.2013,"-34,534.59",USD,43.63,0.00,Trust,BRK003,NYSE ARCA,2024-08-21T13:52:00Z,,Med
TXN000047,ACC-568238,CUST_552,04-Sep-2024,,SPY,SPDR S&P 500 ETF,DIVIDEND,436,2.331189,"1,016.40",USD,21.09,0.00,Retirement,BRK002,NYSE ARCA,2024-09-04T12:54:49Z,Tax loss harvesting,low
TXN000048,ACC-795928,CUST_812,29/11/2024,02-Dec-2024,EUR/USD,Euro US Dollar,BUY,468327,1.11,$-520254.64,USD,47.25,0.00,Individual,BRK005,FOREX,2024-11-29T09:46:09Z,Quarterly rebalancing,HIGH
TXN000049,ACC-377896,CUST_347,2024.11.15,2024.11.18,XOM,Exxon Mobil Corp,BUY,321,118.85,$-38151.97,USD,40.94,0.00,Trust,BRK005,NYSE,2024-11-15T10:15:40Z,Dollar cost averaging,Low
TXN000050,ACC-203225,CUST_779,11/20/2024,2024-11-21,ETH-USD,Ethereum USD,BUY,0.562136,2648.75,$-1488.96,USD,22.92,0.00,Trust,BRK002,CRYPTO,2024-11-20T15:36:43Z,Rebalancing,Very High
TXN000051,ACC-501126,CUST_635,12-15-2024,,EUR/USD,Euro US Dollar,DIVIDEND,522,$3.2257,"1,683.83",USD,27.98,0.00,Individual,BRK004,FOREX,2024-12-15T11:04:28Z,Market timing,
TXN000052,ACC-579027,CUST_866,06-03-2024,05-Jun-2024,VTI,Vanguard Total Stock Market ETF,SELL,359,228.74,"$82,117.87",USD,19.76,1221.38,Corporate,BRK001,NYSE ARCA,2024-06-03T16:53:57Z,Estate planning,Low
TXN000053,ACC-329642,CUST_652,07-04-2024,,CVX,Chevron Corporation,DIVIDEND,747,$4.2079,"$3,143.27",USD,36.41,0.00,Individual,BRK003,NYSE,2024-04-07T09:37:23Z,Short-term trade,HIGH
TXN000054,ACC-284171,CUST_206,08-Mar-2024,,GBP/USD,British Pound US Dollar,DIVIDEND,900,0.91,815.64,USD,50.70,0.00,Trust,BRK003,FOREX,2024-03-08T10:29:04Z,,MEDIUM
TXN000055,ACC-943671,CUST_571,07/06/2024,,PEP,PepsiCo Inc,SELL,233,$170.7314,39780.43,USD,23.43,355.34,Trust,BRK003,NASDAQ,2024-07-06T12:30:01Z,Risk management,Medium
TXN000056,ACC-779112,CUST_65,21 November 2024,,ORCL,Oracle Corporation,DIVIDEND,468,0.671712,314.36,USD,7.27,0.00,Individual,BRK003,NYSE,2024-11-21T10:06:15Z,Rebalancing,HIGH
TXN000057,ACC-879238,CUST_714,2024.10.03,,GLD,SPDR Gold Shares,DIVIDEND,956,2.132934,2039.09,USD,9.95,0.00,Trust,BRK005,NYSE ARCA,2024-10-03T13:02:44Z,Portfolio diversification,low
TXN000058,ACC-204180,CUST_703,07-Jul-2024,08 July 2024,GOOGL,Alphabet Inc Class A,SELL,109,125.500,13679.54,USD,37.09,72.78,Corporate,BRK002,NASDAQ,2024-07-07T12:04:53Z,Profit taking,High
TXN000059,ACC-952547,CUST_891,29-Apr-2024,2024-05-02,KO,The Coca-Cola Company,BUY,75,$57.77,"$-4,332.96",USD,54.38,0.00,Joint,BRK003,NYSE,2024-04-29T10:42:55Z,,High
TXN000060,ACC-349489,CUST_603,2024-06-14,,META,Meta Platforms Inc,SELL,270,311.258,$84039.58,USD,10.68,0.00,Trust,BRK003,NASDAQ,2024-06-14T10:28:32Z,,Med
TXN000061,ACC-790909,CUST_534,03 June 2024,,XOM,Exxon Mobil Corp,BUY,206,$106.97,-22036.76,USD,26.31,0.00,Individual,BRK004,NYSE,2024-06-03T10:57:05Z,Rebalancing,HIGH
TXN000062,ACC-763829,CUST_600,07-Oct-2024,,VTI,Vanguard Total Stock Market ETF,DIVIDEND,514,$2.5772,"1,324.68",USD,26.51,0.00,Individual,BRK005,NYSE ARCA,2024-10-07T15:28:56Z,,Very High
TXN000063,ACC-865054,CUST_98,2024.06.09,,SPY,SPDR S&P 500 ETF,DIVIDEND,206,3.47,$713.88,USD,28.71,0.00,Individual,BRK001,NYSE ARCA,2024-06-09T15:06:47Z,Estate planning,Medium
TXN000064,ACC-688866,CUST_576,06/17/2024,2024-06-19,BTC-USD,Bitcoin USD,SELL,6.004501,$68893.9519,413673.77,USD,22.58,3388.44,Trust,BRK002,CRYPTO,2024-06-17T14:54:35Z,Estate planning,Medium
TXN000065,ACC-946432,CUST_440,2024-10-14,,SLV,iShares Silver Trust,DIVIDEND,323,0.241871,$78.12,USD,18.66,0.00,Corporate,BRK003,NYSE ARCA,2024-10-14T09:11:55Z,,MEDIUM
TXN000066,ACC-763928,CUST_996,01/16/2024,,PFE,Pfizer Inc,DIVIDEND,479,$2.32,"$1,112.65",USD,12.87,0.00,Corporate,BRK003,NYSE,2024-01-16T09:09:10Z,Long-term investment,Medium
TXN000067,ACC-544611,CUST_498,06 November 2024,11/09/2024,BTC-USD,Bitcoin USD,SELL,1.109787,$47081.0499,52249.93,USD,38.91,674.23,Corporate,BRK001,CRYPTO,2024-11-06T15:38:03Z,,Very High
TXN000068,ACC-904624,CUST_141,10-05-2024,,SPY,SPDR S&P 500 ETF,BUY,90,474.701412,$-42723.13,USD,11.46,0.00,Joint,BRK002,NYSE ARCA,2024-05-10T14:04:25Z,Long-term investment,Med
TXN000069,ACC-181644,CUST_883,2024.06.09,11-06-2024,GLD,SPDR Gold Shares,SELL,11,184.607,"2,030.68",USD,53.31,39.02,Trust,BRK003,NYSE ARCA,2024-06-09T15:54:06Z,,Medium
TXN000070,ACC-649414,CUST_81,21-07-2024,07/22/2024,PFE,Pfizer Inc,SELL,59,30.105,1776.19,USD,31.53,29.56,Corporate,BRK002,NYSE,2024-07-21T10:09:16Z,,Very High
TXN000071,ACC-897143,CUST_778,12/01/2024,,META,Meta Platforms Inc,DIVIDEND,822,2.862304,"$2,352.81",USD,33.97,0.00,Joint,BRK005,NASDAQ,2024-12-01T14:09:28Z,,MEDIUM
TXN000072,ACC-720148,CUST_58,06/29/2024,30-Jun-2024,WFC,Wells Fargo & Co,SELL,40,$51.63,"2,065.36",USD,37.23,13.12,Joint,BRK005,NYSE,2024-06-29T16:37:35Z,Year-end selling,low
TXN000073,ACC-949153,CUST_586,11-29-2024,,SPY,SPDR S&P 500 ETF,DIVIDEND,204,4.793,977.74,USD,27.53,0.00,Corporate,BRK001,NYSE ARCA,2024-11-29T11:02:15Z,Portfolio diversification,Med
TXN000074,ACC-396635,CUST_397,28-Jul-2024,,CVX,Chevron Corporation,DIVIDEND,696,3.27,"$2,277.17",USD,8.30,,Individual,BRK005,NYSE,2024-07-28T13:16:46Z,Market timing,low
TXN000075,ACC-795847,CUST_145,28-06-2024,,XOM,Exxon Mobil Corp,DIVIDEND,182,3.016,$548.86,USD,51.90,0.00,Corporate,BRK005,NYSE,2024-06-28T14:52:08Z,,low
TXN000076,ACC-543973,CUST_521,2024-07-04,05-Jul-2024,QQQ,Invesco QQQ Trust,SELL,249,444.77,"110,746.94",USD,14.60,811.13,Corporate,BRK001,NASDAQ,2024-07-04T09:42:21Z,Market timing,Med
TXN000077,ACC-261745,CUST_167,02/04/2024,,PFE,Pfizer Inc,SELL,369,28.64,"$10,569.26",USD,16.88,98.02,Trust,BRK002,NYSE,2024-04-02T12:19:51Z,,Med
TXN000078,ACC-811256,CUST_970,19 October 2024,2024.10.22,ETH-USD,Ethereum USD,SELL,8.169096,$3932.5363,$32125.26,USD,45.06,281.10,Trust,BRK003,CRYPTO,2024-10-19T10:45:54Z,Short-term trade,Med
TXN000079,ACC-900185,CUST_165,19 May 2024,,CRM,Salesforce Inc,DIVIDEND,497,0.549396,$273.05,USD,50.53,0.00,Trust,BRK003,NYSE,2024-05-19T15:03:25Z,Profit taking,Low
TXN000080,ACC-129556,CUST_327,20-Feb-2024,22 February 2024,PEP,PepsiCo Inc,BUY,72,173.92,"-12,522.34",USD,42.94,0.00,Trust,BRK004,NASDAQ,2024-02-20T10:01:16Z,,Low
TXN000081,ACC-402096,CUST_244,06/03/2024,06 June 2024,GOOGL,Alphabet Inc Class A,BUY,429,$123.77,"$-53,096.66",USD,50.26,0.00,Joint,BRK005,NASDAQ,2024-06-03T12:45:09Z,,Low
TXN000082,ACC-536802,CUST_192,12/06/2024,,GBP/USD,British Pound US Dollar,SELL,275985,$1.30,"$359,499.70",USD,44.32,1907.15,Trust,BRK001,FOREX,2024-12-06T14:16:47Z,,low
TXN000083,ACC-352838,CUST_751,12/02/2024,,KO,The Coca-Cola Company,DIVIDEND,390,0.753707,$293.95,USD,22.61,0.00,Corporate,BRK002,NYSE,2024-12-02T16:40:11Z,Short-term trade,HIGH
TXN000084,ACC-145934,CUST_811,2024-04-12,15 April 2024,SPY,SPDR S&P 500 ETF,SELL,386,425.331377,"164,177.91",USD,37.35,2944.05,Individual,BRK003,NYSE ARCA,2024-04-12T10:51:23Z,Dividend reinvestment,
TXN000085,ACC-455505,CUST_998,05 April 2024,08-04-2024,JNJ,Johnson & Johnson,SELL,373,$166.0230,"61,926.56",USD,26.22,1233.98,Retirement,BRK005,NYSE,2024-04-05T14:06:05Z,Dollar cost averaging,
TXN000086,ACC-731894,CUST_735,06/08/2024,07-Aug-2024,JNJ,Johnson & Johnson,SELL,223,162.29703,$36192.24,USD,18.73,695.56,Individual,BRK004,NYSE,2024-08-06T11:01:09Z,Quarterly rebalancing,MEDIUM
TXN000087,ACC-232361,CUST_69,30-Apr-2024,01/05/2024,QQQ,Invesco QQQ Trust,SELL,486,$417.91,$203102.42,USD,23.55,1249.75,Retirement,BRK005,NASDAQ,2024-04-30T15:20:41Z,,MEDIUM
TXN000088,ACC-871411,CUST_191,2024.09.12,,ORCL,Oracle Corporation,DIVIDEND,843,1.38,"1,159.48",USD,27.31,0.00,Joint,BRK003,NYSE,2024-09-12T12:07:08Z,Portfolio diversification,HIGH
TXN000089,ACC-949884,CUST_699,12-Jun-2024,14-06-2024,JNJ,Johnson & Johnson,BUY,365,167.027241,$-60964.94,USD,40.48,0.00,Retirement,BRK003,NYSE,2024-06-12T12:07:12Z,Profit taking,Med
TXN000090,ACC-700076,CUST_378,27/08/2024,,SLV,iShares Silver Trust,BUY,368,23.9816,"$-8,825.23",USD,40.94,0.00,Joint,BRK004,NYSE ARCA,2024-08-27T10:08:20Z,Portfolio diversification,low
TXN000091,ACC-969325,CUST_799,09/10/2024,10/10/2024,KO,The Coca-Cola Company,BUY,156,60.181,"$-9,388.24",USD,13.23,0.00,Corporate,BRK002,NYSE,2024-10-09T13:54:05Z,,MEDIUM
TXN000092,ACC-417534,CUST_630,09/30/2024,,GBP/USD,British Pound US Dollar,DIVIDEND,644,0.856,$550.98,USD,37.94,0.00,Joint,BRK003,FOREX,2024-09-30T09:05:02Z,Estate planning,Low
TXN000093,ACC-904214,CUST_586,2024-08-01,,EUR/USD,Euro US Dollar,DIVIDEND,707,4.787586,"3,384.82",USD,29.15,0.00,Trust,BRK003,FOREX,2024-08-01T10:44:03Z,,HIGH
TXN000094,ACC-456717,CUST_622,14-Mar-2024,,NFLX,Netflix Inc,DIVIDEND,931,1.792316,1668.65,USD,24.94,0.00,Corporate,BRK005,NASDAQ,2024-03-14T10:20:15Z,Dollar cost averaging,Med
TXN000095,ACC-153063,CUST_298,2024.07.15,18-Jul-2024,JPM,JPMorgan Chase & Co,BUY,82,147.593364,"-12,102.66",USD,29.91,0.00,Joint,BRK004,NYSE,2024-07-15T13:31:01Z,,HIGH
TXN000096,ACC-325595,CUST_598,2024-06-29,02 July 2024,GOOGL,Alphabet Inc Class A,SELL,5,$137.1449,$685.72,USD,47.36,12.51,Corporate,BRK004,NASDAQ,2024-06-29T09:25:03Z,Profit taking,MEDIUM
TXN000097,ACC-177103,CUST_396,15 September 2024,,KO,The Coca-Cola Company,DIVIDEND,688,3.434,"2,362.56",USD,10.94,0.00,Individual,BRK004,NYSE,2024-09-15T14:35:23Z,Profit taking,MEDIUM
TXN000098,ACC-147504,CUST_40,11-Mar-2024,12/03/2024,PEP,PepsiCo Inc,SELL,314,$166.56,"$52,299.63",USD,20.93,745.14,Corporate,BRK005,NASDAQ,2024-03-11T16:45:36Z,,MEDIUM
TXN000099,ACC-447329,CUST_690,2024.02.26,2024-02-29,GLD,SPDR Gold Shares,SELL,136,203.876385,27727.19,USD,53.35,461.45,Joint,BRK002,NYSE ARCA,2024-02-26T16:10:33Z,Market timing,Low
TXN000100,ACC-961574,CUST_698,2024-05-04,,GLD,SPDR Gold Shares,DIVIDEND,69,2.26,156.02,USD,25.94,0.00,Trust,BRK002,NYSE ARCA,2024-05-04T16:55:54Z,Long-term investment,low
TXN000101,ACC-794395,CUST_490,2024.09.26,29-Sep-2024,SPY,SPDR S&P 500 ETF,BUY,347,$454.6273,"$-157,755.68",USD,43.60,0.00,Corporate,BRK005,NYSE ARCA,2024-09-26T12:15:17Z,Profit taking,HIGH
TXN000102,ACC-823769,CUST_722,07-Sep-2024,10-09-2024,EUR/USD,Euro US Dollar,SELL,310667,1.070145,"$332,458.82",USD,38.83,6550.24,Corporate,BRK002,FOREX,2024-09-07T09:18:45Z,,
TXN000103,ACC-883641,CUST_491,04-19-2024,,DIS,The Walt Disney Company,DIVIDEND,625,3.51,$2194.52,USD,11.86,0.00,Joint,BRK005,NYSE,2024-04-19T12:03:42Z,Profit taking,Very High
TXN000104,ACC-446337,CUST_735,08/29/2024,,CVX,Chevron Corporation,BUY,476,$156.51,-74499.03,USD,12.90,0.00,Trust,BRK004,NYSE,2024-08-29T13:20:18Z,Estate planning,Very High
TXN000105,ACC-858243,CUST_871,20/01/2024,2024.01.21,BTC-USD,Bitcoin USD,BUY,1.86393,$62578.6220,"$-116,642.17",USD,42.45,0.00,Corporate,BRK001,CRYPTO,2024-01-20T13:36:38Z,,Low
TXN000106,ACC-772464,CUST_557,25 September 2024,27-09-2024,CRM,Salesforce Inc,BUY,58,215.42,-12494.64,USD,21.53,0.00,Trust,BRK003,NYSE,2024-09-25T09:47:21Z,Market timing,High
TXN000107,ACC-769752,CUST_919,2024.07.26,07/29/2024,GBP/USD,British Pound US Dollar,SELL,83721,$1.27,"$106,198.26",USD,28.87,541.87,Trust,BRK002,FOREX,2024-07-26T13:21:19Z,Market timing,HIGH
TXN000108,ACC-785436,CUST_369,12-20-2024,,GOOGL,Alphabet Inc Class A,DIVIDEND,364,0.88,321.27,USD,39.30,0.00,Corporate,BRK001,NASDAQ,2024-12-20T14:39:14Z,,
TXN000109,ACC-884056,CUST_621,2024.07.10,,JNJ,Johnson & Johnson,DIVIDEND,825,$2.73,$2255.42,USD,38.20,0.00,Retirement,BRK002,NYSE,2024-07-10T16:33:45Z,Market timing,Medium
TXN000110,ACC-630041,CUST_208,20/10/2024,10/22/2024,META,Meta Platforms Inc,SELL,368,$302.04,"111,152.30",USD,34.16,0.00,Joint,BRK004,NASDAQ,2024-10-20T16:08:32Z,Market timing,Low
TXN000111,ACC-423139,CUST_741,2024.01.12,01/15/2024,BAC,Bank of America Corp,BUY,177,25.91,"-4,585.33",USD,40.02,0.00,Joint,BRK001,NYSE,2024-01-12T16:02:18Z,Estate planning,Medium
TXN000112,ACC-501058,CUST_460,2024.07.12,,MSFT,Microsoft Corporation,DIVIDEND,945,$2.74,$2591.73,USD,37.68,0.00,Corporate,BRK001,NASDAQ,2024-07-12T15:33:08Z,Profit taking,High
TXN000113,ACC-585494,CUST_690,2024.10.05,06 October 2024,BOND_10Y,US Treasury 10 Year,SELL,142,$98.46,"13,981.55",USD,14.42,230.45,Individual,BRK004,BOND,2024-10-05T12:13:04Z,,Low
TXN000114,ACC-726822,CUST_689,2024-12-26,,JPM,JPMorgan Chase & Co,DIVIDEND,499,$1.2483,$622.88,USD,15.86,0.00,Individual,BRK002,NYSE,2024-12-26T13:14:52Z,Market timing,Med
TXN000115,ACC-250219,CUST_677,09-23-2024,26/09/2024,BTC-USD,Bitcoin USD,SELL,4.272579,56909.76,"243,151.42",USD,29.78,4649.98,Trust,BRK005,CRYPTO,2024-09-23T15:26:09Z,,MEDIUM
TXN000116,ACC-352673,CUST_870,25-04-2024,,NFLX,Netflix Inc,DIVIDEND,524,$4.5822,$2401.09,USD,33.12,0.00,Trust,BRK005,NASDAQ,2024-04-25T11:24:15Z,,Med
TXN000117,ACC-988283,CUST_380,02-17-2024,2024-02-20,GOOGL,Alphabet Inc Class A,SELL,97,172.42,$16724.47,USD,45.23,252.07,Retirement,BRK004,NASDAQ,2024-02-17T14:19:58Z,,Very High
TXN000118,ACC-883159,CUST_773,09-02-2024,,JNJ,Johnson & Johnson,DIVIDEND,456,4.58412,$2090.36,USD,32.60,0.00,Corporate,BRK004,NYSE,2024-09-02T14:19:16Z,Portfolio diversification,HIGH
TXN000119,ACC-857505,CUST_481,06-12-2024,06-15-2024,QQQ,Invesco QQQ Trust,SELL,9,424.13,"3,817.13",USD,18.04,52.25,Trust,BRK003,NASDAQ,2024-06-12T12:21:14Z,,High
TXN000120,ACC-677390,CUST_671,16-Dec-2024,19 December 2024,BAC,Bank of America Corp,SELL,376,$34.22,$12865.43,USD,44.75,203.33,Trust,BRK002,NYSE,2024-12-16T09:33:02Z,Short-term trade,Med
TXN000121,ACC-532424,CUST_141,11-18-2024,,MSFT,Microsoft Corporation,DIVIDEND,273,$2.58,$703.82,USD,23.66,0.00,Joint,BRK005,NASDAQ,2024-11-18T16:01:00Z,Dividend reinvestment,HIGH
TXN000122,ACC-388086,CUST_549,2024-05-26,,GBP/USD,British Pound US Dollar,DIVIDEND,875,$4.7046,"$4,116.51",USD,13.96,0.00,Individual,BRK005,FOREX,2024-05-26T12:12:39Z,,High
TXN000123,ACC-182857,CUST_383,26 July 2024,27-07-2024,GLD,SPDR Gold Shares,BUY,435,$207.36,-90202.32,USD,9.03,,Individual,BRK001,NYSE ARCA,2024-07-26T15:24:35Z,Quarterly rebalancing,low
TXN000124,ACC-986392,CUST_445,26-Nov-2024,11-27-2024,GLD,SPDR Gold Shares,BUY,445,188.457,$-83863.22,USD,39.61,0.00,Joint,BRK004,NYSE ARCA,2024-11-26T09:59:04Z,Dollar cost averaging,
TXN000125,ACC-991737,CUST_323,01-09-2024,2024.01.12,GLD,SPDR Gold Shares,BUY,154,$217.15,"$-33,441.87",USD,13.12,,Retirement,BRK005,NYSE ARCA,2024-01-09T14:24:48Z,Estate planning,low
TXN000126,ACC-558320,CUST_238,08-Feb-2024,,SLV,iShares Silver Trust,DIVIDEND,456,4.85,"2,210.56",USD,21.32,,Corporate,BRK004,NYSE ARCA,2024-02-08T12:22:35Z,Dividend reinvestment,HIGH
TXN000127,ACC-748665,CUST_303,05/06/2024,09/05/2024,MSFT,Microsoft Corporation,SELL,163,388.758635,"63,367.66",USD,23.04,0.00,Corporate,BRK004,NASDAQ,2024-05-06T13:06:08Z,,MEDIUM
TXN000128,ACC-637333,CUST_418,2024-02-22,25-Feb-2024,MSFT,Microsoft Corporation,SELL,7,$403.6462,"$2,825.52",USD,19.59,17.72,Joint,BRK002,NASDAQ,2024-02-22T11:43:24Z,,Med
TXN000129,ACC-381444,CUST_505,03/15/2024,17 March 2024,META,Meta Platforms Inc,SELL,185,$317.4000,"58,719.00",USD,17.58,844.12,Joint,BRK005,NASDAQ,2024-03-15T16:06:08Z,Dividend reinvestment,Very High
TXN000130,ACC-943135,CUST_883,17 June 2024,20/06/2024,SPY,SPDR S&P 500 ETF,SELL,309,430.043528,"$132,883.45",USD,52.36,1290.66,Trust,BRK003,NYSE ARCA,2024-06-17T16:36:50Z,,
TXN000131,ACC-956156,CUST_805,20-Jul-2024,,TSLA,Tesla Inc,DIVIDEND,608,0.981643,596.84,USD,43.38,0.00,Individual,BRK004,NASDAQ,2024-07-20T16:51:18Z,Short-term trade,Very High
TXN000132,ACC-417543,CUST_248,09/05/2024,10 May 2024,JNJ,Johnson & Johnson,SELL,246,$169.81,$41774.25,USD,34.11,787.55,Trust,BRK005,NYSE,2024-05-09T14:44:57Z,Market timing,Low
TXN000133,ACC-906306,CUST_255,02-Dec-2024,,META,Meta Platforms Inc,DIVIDEND,626,4.920,3079.72,USD,38.87,0.00,Trust,BRK003,NASDAQ,2024-12-02T10:00:06Z,,low
TXN000134,ACC-510133,CUST_475,13/12/2024,2024.12.15,QQQ,Invesco QQQ Trust,BUY,44,442.054754,"$-19,450.41",USD,10.80,0.00,Retirement,BRK003,NASDAQ,2024-12-13T14:29:50Z,,
TXN000135,ACC-559450,CUST_740,22 December 2024,12/25/2024,SPY,SPDR S&P 500 ETF,BUY,176,402.258512,-70797.50,USD,37.40,0.00,Retirement,BRK002,NYSE ARCA,2024-12-22T11:35:10Z,Dividend reinvestment,Med
TXN000136,ACC-760351,CUST_189,2024.04.05,06 April 2024,VTI,Vanguard Total Stock Market ETF,BUY,200,229.61,"$-45,922.03",USD,5.22,0.00,Retirement,BRK002,NYSE ARCA,2024-04-05T10:36:06Z,Risk management,
TXN000137,ACC-579776,CUST_117,14 May 2024,,GBP/USD,British Pound US Dollar,DIVIDEND,447,3.095,$1383.65,USD,34.35,0.00,Corporate,BRK003,FOREX,2024-05-14T11:52:43Z,Dollar cost averaging,HIGH
TXN000138,ACC-428399,CUST_121,02-05-2024,2024.05.03,TSLA,Tesla Inc,BUY,71,230.19,"$-16,343.40",USD,33.74,0.00,Trust,BRK002,NASDAQ,2024-05-02T11:35:10Z,Rebalancing,HIGH
TXN000139,ACC-749498,CUST_55,2024-07-02,04 July 2024,EUR/USD,Euro US Dollar,BUY,267805,$1.0786,$-288865.03,USD,25.78,0.00,Trust,BRK004,FOREX,2024-07-02T10:36:01Z,Profit taking,High
TXN000140,ACC-663723,CUST_296,27 March 2024,,GLD,SPDR Gold Shares,DIVIDEND,557,2.793658,1556.07,USD,10.66,0.00,Individual,BRK003,NYSE ARCA,2024-03-27T14:34:52Z,Estate planning,Med
TXN000141,ACC-207391,CUST_754,11-30-2024,12/02/2024,WFC,Wells Fargo & Co,BUY,61,43.78,-2670.67,USD,43.78,0.00,Retirement,BRK002,NYSE,2024-11-30T15:10:39Z,,MEDIUM
TXN000142,ACC-697766,CUST_360,29-09-2024,,SLV,iShares Silver Trust,DIVIDEND,770,1.53,1181.11,USD,33.64,0.00,Joint,BRK001,NYSE ARCA,2024-09-29T15:58:03Z,,High
TXN000143,ACC-845951,CUST_330,2024.05.06,2024.05.08,EUR/USD,Euro US Dollar,BUY,49592,1.076262,"$-53,373.99",USD,36.68,0.00,Individual,BRK004,FOREX,2024-05-06T13:44:59Z,Portfolio diversification,Med
TXN000144,ACC-911739,CUST_868,17 February 2024,,XOM,Exxon Mobil Corp,DIVIDEND,920,0.410,377.49,USD,31.72,0.00,Retirement,BRK004,NYSE,2024-02-17T16:17:20Z,Tax loss harvesting,Very High
TXN000145,ACC-608913,CUST_808,2024-06-24,2024-06-26,GOOGL,Alphabet Inc Class A,BUY,440,$127.4542,-56079.86,USD,12.90,0.00,Trust,BRK001,NASDAQ,2024-06-24T12:44:58Z,,low
TXN000146,ACC-387330,CUST_96,01-Dec-2024,04/12/2024,BAC,Bank of America Corp,BUY,321,26.036,-8357.47,USD,20.28,0.00,Retirement,BRK004,NYSE,2024-12-01T10:00:13Z,Rebalancing,Medium
TXN000147,ACC-566686,CUST_10,05-Jan-2024,07/01/2024,DIS,The Walt Disney Company,BUY,118,99.33,-11721.06,USD,24.15,,Individual,BRK001,NYSE,2024-01-05T14:56:19Z,,MEDIUM
TXN000148,ACC-690653,CUST_9,08/11/2024,11/11/2024,ETH-USD,Ethereum USD,SELL,6.161144,$3839.7882,$23657.49,USD,27.12,436.45,Retirement,BRK001,CRYPTO,2024-11-08T14:27:20Z,Profit taking,low
TXN000149,ACC-360221,CUST_567,03-11-2024,,KO,The Coca-Cola Company,DIVIDEND,917,$3.33,3050.11,USD,20.08,0.00,Joint,BRK005,NYSE,2024-11-03T12:47:25Z,,Med
TXN000150,ACC-218220,CUST_247,09/12/2024,14/09/2024,GBP/USD,British Pound US Dollar,BUY,449863,$1.29,$-579731.17,USD,33.42,0.00,Corporate,BRK005,FOREX,2024-09-12T16:49:04Z,,High
TXN000151,ACC-141761,CUST_945,2024.01.31,2024.02.03,GBP/USD,British Pound US Dollar,SELL,220909,1.29,"$285,493.41",USD,9.12,4065.63,Corporate,BRK001,FOREX,2024-01-31T10:32:58Z,,
TXN000152,ACC-509711,CUST_601,11/20/2024,,WFC,Wells Fargo & Co,DIVIDEND,916,1.27,$1162.70,USD,17.22,,Trust,BRK001,NYSE,2024-11-20T09:19:42Z,Year-end selling,HIGH
TXN000153,ACC-243876,CUST_719,06/01/2024,09-01-2024,EUR/USD,Euro US Dollar,SELL,76548,1.062,$81270.05,USD,42.49,1299.84,Individual,BRK001,FOREX,2024-01-06T15:17:33Z,,MEDIUM
TXN000154,ACC-620248,CUST_467,18-Sep-2024,19-Sep-2024,GOOGL,Alphabet Inc Class A,SELL,396,$129.44,"51,257.69",USD,10.15,812.01,Retirement,BRK005,NASDAQ,2024-09-18T09:54:55Z,,Low
TXN000155,ACC-481657,CUST_393,17/03/2024,2024.03.20,ORCL,Oracle Corporation,BUY,128,106.74,-13662.14,USD,25.81,0.00,Corporate,BRK003,NYSE,2024-03-17T14:07:32Z,Long-term investment,Medium
TXN000156,ACC-148159,CUST_977,07/24/2024,26-Jul-2024,CRM,Salesforce Inc,SELL,234,206.91,48417.14,USD,5.40,651.55,Corporate,BRK005,NYSE,2024-07-24T16:23:37Z,Estate planning,Very High
TXN000157,ACC-257880,CUST_7,2024-07-28,,JPM,JPMorgan Chase & Co,DIVIDEND,909,3.497958,"3,179.64",USD,5.48,0.00,Corporate,BRK001,NYSE,2024-07-28T13:06:13Z,Profit taking,low
TXN000158,ACC-249289,CUST_729,05/23/2024,2024.05.26,GOOGL,Alphabet Inc Class A,BUY,191,162.051,$-30951.71,USD,27.92,0.00,Individual,BRK005,NASDAQ,2024-05-23T11:40:52Z,Market timing,Medium
TXN000159,ACC-237057,CUST_243,29-05-2024,31-May-2024,NFLX,Netflix Inc,SELL,140,$397.71,"$55,679.21",USD,16.68,392.08,Joint,BRK001,NASDAQ,2024-05-29T10:10:28Z,Dividend reinvestment,High
TXN000160,ACC-907756,CUST_213,19-08-2024,20/08/2024,ETH-USD,Ethereum USD,SELL,3.042846,$3615.1938,"$11,000.48",USD,40.24,90.48,Corporate,BRK002,CRYPTO,2024-08-19T12:22:25Z,Quarterly rebalancing,Medium
TXN000161,ACC-959926,CUST_179,2024.01.16,01-19-2024,NFLX,Netflix Inc,SELL,53,$364.21,"$19,303.07",USD,45.19,99.98,Retirement,BRK002,NASDAQ,2024-01-16T15:23:43Z,Quarterly rebalancing,Very High
TXN000162,ACC-952227,CUST_77,01/12/2024,,NVDA,NVIDIA Corporation,DIVIDEND,181,0.550695,99.68,USD,47.36,,Corporate,BRK001,NASDAQ,2024-01-12T16:03:10Z,Dividend reinvestment,Low
TXN000163,ACC-816400,CUST_437,29-Mar-2024,31/03/2024,NVDA,NVIDIA Corporation,BUY,318,417.32,"-132,709.26",USD,35.85,0.00,Corporate,BRK004,NASDAQ,2024-03-29T16:03:05Z,,low
TXN000164,ACC-935922,CUST_539,2024-05-07,,VTI,Vanguard Total Stock Market ETF,DIVIDEND,607,3.929,2384.92,USD,22.20,,Joint,BRK005,NYSE ARCA,2024-05-07T15:17:11Z,,MEDIUM
TXN000165,ACC-950069,CUST_798,2024-05-23,05-26-2024,PEP,PepsiCo Inc,SELL,52,179.48,9332.94,USD,17.39,121.38,Individual,BRK002,NASDAQ,2024-05-23T14:59:53Z,Rebalancing,low
TXN000166,ACC-721301,CUST_326,23-Dec-2024,,ORCL,Oracle Corporation,DIVIDEND,767,$1.82,$1398.43,USD,33.38,,Retirement,BRK005,NYSE,2024-12-23T16:34:19Z,,Very High
TXN000167,ACC-730889,CUST_225,11 January 2024,12/01/2024,AAPL,Apple Inc,SELL,91,$167.0380,"15,200.45",USD,50.94,149.78,Individual,BRK002,NASDAQ,2024-01-11T10:54:33Z,Short-term trade,High
TXN000168,ACC-714483,CUST_104,21-06-2024,2024.06.24,SPY,SPDR S&P 500 ETF,BUY,492,479.184252,"$-235,758.65",USD,29.36,0.00,Corporate,BRK002,NYSE ARCA,2024-06-21T14:14:42Z,Rebalancing,Med
TXN000169,ACC-408823,CUST_131,2024-03-31,,JNJ,Johnson & Johnson,DIVIDEND,839,$4.83,4051.87,USD,6.62,0.00,Joint,BRK003,NYSE,2024-03-31T10:59:31Z,,Very High
TXN000170,ACC-435039,CUST_172,11/21/2024,,DIS,The Walt Disney Company,DIVIDEND,796,$4.44,$3537.90,USD,27.33,0.00,Corporate,BRK002,NYSE,2024-11-21T10:22:16Z,Year-end selling,Very High
TXN000171,ACC-868170,CUST_430,2024.03.26,03/28/2024,EUR/USD,Euro US Dollar,SELL,423521,$1.11,"$469,268.25",USD,48.20,7183.28,Retirement,BRK004,FOREX,2024-03-26T09:18:01Z,Short-term trade,Medium
TXN000172,ACC-278368,CUST_910,11/07/2024,12-Jul-2024,PFE,Pfizer Inc,BUY,315,30.94,-9746.20,USD,49.66,0.00,Individual,BRK004,NYSE,2024-07-11T15:10:03Z,,High
TXN000173,ACC-681028,CUST_740,03-10-2024,2024-10-04,CVX,Chevron Corporation,SELL,282,151.79,"$42,803.95",USD,46.99,445.69,Trust,BRK001,NYSE,2024-10-03T16:12:06Z,,
TXN000174,ACC-185916,CUST_485,29-02-2024,03-03-2024,PEP,PepsiCo Inc,SELL,279,$161.8227,$45148.54,USD,24.38,484.07,Retirement,BRK004,NASDAQ,2024-02-29T13:28:29Z,,Low
TXN000175,ACC-258471,CUST_771,12/22/2024,,MSFT,Microsoft Corporation,DIVIDEND,604,2.128535,1285.63,USD,42.82,0.00,Retirement,BRK005,NASDAQ,2024-12-22T15:52:33Z,Risk management,Low
TXN000176,ACC-182790,CUST_405,18/01/2024,01-19-2024,TSLA,Tesla Inc,SELL,65,$277.02,$18005.99,USD,7.13,0.00,Trust,BRK002,NASDAQ,2024-01-18T13:20:58Z,Estate planning,High
TXN000177,ACC-516656,CUST_566,15-06-2024,2024.06.16,GBP/USD,British Pound US Dollar,SELL,88455,$1.2613,"111,564.04",USD,12.41,1826.93,Individual,BRK001,FOREX,2024-06-15T13:55:34Z,Dividend reinvestment,Medium
TXN000178,ACC-786594,CUST_498,19 October 2024,2024.10.20,GOOGL,Alphabet Inc Class A,BUY,456,$122.3270,"$-55,781.09",USD,48.95,0.00,Retirement,BRK001,NASDAQ,2024-10-19T13:57:23Z,,HIGH
TXN000179,ACC-615500,CUST_879,12/22/2024,25 December 2024,NFLX,Netflix Inc,BUY,165,466.104635,"$-76,907.26",USD,18.47,0.00,Trust,BRK005,NASDAQ,2024-12-22T12:28:13Z,Dividend reinvestment,Medium
TXN000180,ACC-640299,CUST_811,03/22/2024,,WFC,Wells Fargo & Co,DIVIDEND,188,$3.92,737.81,USD,31.21,,Joint,BRK001,NYSE,2024-03-22T12:56:53Z,,High
TXN000181,ACC-153015,CUST_941,07-03-2024,2024.07.06,BAC,Bank of America Corp,SELL,64,$37.71,"$2,413.32",USD,39.06,29.76,Trust,BRK002,NYSE,2024-07-03T14:22:10Z,Dollar cost averaging,HIGH
TXN000182,ACC-128783,CUST_396,26/01/2024,,NFLX,Netflix Inc,DIVIDEND,269,$4.30,"1,156.66",USD,37.37,0.00,Retirement,BRK003,NASDAQ,2024-01-26T09:55:49Z,Quarterly rebalancing,low
TXN000183,ACC-778818,CUST_178,2024-11-03,05-11-2024,JPM,JPMorgan Chase & Co,SELL,193,$156.9523,"$30,291.79",USD,47.58,250.61,Corporate,BRK005,NYSE,2024-11-03T10:00:32Z,,low
TXN000184,ACC-412974,CUST_701,25 February 2024,28-Feb-2024,MSFT,Microsoft Corporation,SELL,134,403.379,"54,052.78",USD,37.81,798.47,Retirement,BRK002,NASDAQ,2024-02-25T12:57:03Z,Estate planning,Med
TXN000185,ACC-792616,CUST_328,14/12/2024,16-12-2024,PFE,Pfizer Inc,BUY,208,34.069,"-7,086.38",USD,24.41,0.00,Individual,BRK005,NYSE,2024-12-14T14:46:45Z,,Very High
TXN000186,ACC-804505,CUST_368,16-09-2024,19/09/2024,NFLX,Netflix Inc,BUY,242,394.07,"$-95,364.36",USD,11.40,0.00,Corporate,BRK005,NASDAQ,2024-09-16T14:41:05Z,,High
TXN000187,ACC-447411,CUST_381,13-05-2024,05/16/2024,ETH-USD,Ethereum USD,BUY,1.946244,2944.44,"$-5,730.60",USD,10.99,0.00,Trust,BRK005,CRYPTO,2024-05-13T15:03:55Z,Rebalancing,
TXN000188,ACC-697062,CUST_915,22/08/2024,,SPY,SPDR S&P 500 ETF,DIVIDEND,132,2.49,328.57,USD,36.55,0.00,Retirement,BRK003,NYSE ARCA,2024-08-22T09:28:17Z,,Low
TXN000189,ACC-900660,CUST_799,15/02/2024,2024.02.17,SLV,iShares Silver Trust,SELL,197,29.65,5841.70,USD,5.23,93.23,Individual,BRK003,NYSE ARCA,2024-02-15T12:01:43Z,,Med
TXN000190,ACC-827213,CUST_899,25-06-2024,28-06-2024,AMZN,Amazon.com Inc,BUY,422,$146.6808,"-61,899.30",USD,7.29,0.00,Corporate,BRK004,NASDAQ,2024-06-25T14:27:56Z,Rebalancing,Med
TXN000191,ACC-297579,CUST_169,2024-07-25,07-26-2024,JPM,JPMorgan Chase & Co,BUY,302,169.363,$-51147.65,USD,30.23,0.00,Individual,BRK003,NYSE,2024-07-25T15:56:40Z,,Low
TXN000192,ACC-150290,CUST_678,2024-02-25,,GOOGL,Alphabet Inc Class A,DIVIDEND,504,1.963,$989.47,USD,32.36,0.00,Trust,BRK002,NASDAQ,2024-02-25T09:19:26Z,Quarterly rebalancing,Very High
TXN000193,ACC-834764,CUST_141,08/02/2024,,GBP/USD,British Pound US Dollar,DIVIDEND,339,0.658662,$223.29,USD,10.31,0.00,Retirement,BRK005,FOREX,2024-08-02T13:53:33Z,Tax loss harvesting,Very High
TXN000194,ACC-674765,CUST_509,16 April 2024,,SPY,SPDR S&P 500 ETF,BUY,465,$467.16,"$-217,230.94",USD,10.52,0.00,Joint,BRK004,NYSE ARCA,2024-04-16T10:49:32Z,,High
TXN000195,ACC-578938,CUST_304,15 May 2024,16-05-2024,GOOGL,Alphabet Inc Class A,BUY,347,$141.6129,"$-49,139.67",USD,20.64,0.00,Individual,BRK001,NASDAQ,2024-05-15T09:54:08Z,Rebalancing,Low
TXN000196,ACC-752011,CUST_275,17-Feb-2024,2024.02.19,DIS,The Walt Disney Company,SELL,140,113.87,$15941.70,USD,46.79,194.07,Trust,BRK002,NYSE,2024-02-17T11:44:46Z,,Medium
TXN000197,ACC-536236,CUST_934,29 October 2024,,PEP,PepsiCo Inc,DIVIDEND,235,3.095483,727.44,USD,43.96,,Joint,BRK001,NASDAQ,2024-10-29T16:58:31Z,,High
TXN000198,ACC-374320,CUST_671,2024-06-09,,JNJ,Johnson & Johnson,DIVIDEND,811,$2.9256,"2,372.65",USD,33.25,0.00,Corporate,BRK005,NYSE,2024-06-09T10:27:42Z,Portfolio diversification,Med
TXN000199,ACC-966582,CUST_572,2024-11-09,,AAPL,Apple Inc,DIVIDEND,567,4.259,2415.05,USD,47.59,0.00,Retirement,BRK001,NASDAQ,2024-11-09T14:15:21Z,Long-term investment,HIGH
TXN000200,ACC-497030,CUST_413,04/30/2024,05/02/2024,ETH-USD,Ethereum USD,SELL,4.471234,$3713.18,"$16,602.49",USD,10.94,245.73,Individual,BRK004,CRYPTO,2024-04-30T09:35:35Z,,low
TXN000201,ACC-633030,CUST_576,15 April 2024,16 April 2024,SPY,SPDR S&P 500 ETF,SELL,393,$433.1973,"$170,246.52",USD,35.99,2529.44,Trust,BRK001,NYSE ARCA,2024-04-15T12:00:21Z,Quarterly rebalancing,Medium
TXN000202,ACC-836201,CUST_109,24/01/2024,2024.01.27,EUR/USD,Euro US Dollar,BUY,330262,$1.0575,$-349247.87,USD,14.80,0.00,Individual,BRK004,FOREX,2024-01-24T16:52:50Z,,Very High
TXN000203,ACC-148759,CUST_949,11/20/2024,23/11/2024,KO,The Coca-Cola Company,SELL,3,64.64,$193.92,USD,31.52,0.00,Trust,BRK005,NYSE,2024-11-20T11:44:37Z,,HIGH
TXN000204,ACC-729718,CUST_621,2024.06.13,,BTC-USD,Bitcoin USD,DIVIDEND,830,1.316,"$1,092.59",USD,24.89,0.00,Corporate,BRK003,CRYPTO,2024-06-13T11:08:26Z,Year-end selling,HIGH
TXN000205,ACC-674416,CUST_882,06-09-2024,11-Jun-2024,NVDA,NVIDIA Corporation,BUY,68,860.595882,"-58,520.52",USD,54.07,0.00,Retirement,BRK005,NASDAQ,2024-06-09T14:45:07Z,Risk management,Med
TXN000206,ACC-982260,CUST_547,2024.05.26,2024.05.27,PEP,PepsiCo Inc,BUY,344,$162.9065,-56039.85,USD,7.83,0.00,Corporate,BRK002,NASDAQ,2024-05-26T13:09:53Z,,
TXN000207,ACC-133875,CUST_368,08/19/2024,,SLV,iShares Silver Trust,DIVIDEND,935,1.199106,"1,121.16",USD,37.36,0.00,Trust,BRK002,NYSE ARCA,2024-08-19T13:44:42Z,,Med
TXN000208,ACC-926394,CUST_1000,16-Dec-2024,,BOND_10Y,US Treasury 10 Year,BUY,318,97.513411,-31009.26,USD,48.44,0.00,Trust,BRK002,BOND,2024-12-16T12:49:46Z,Dollar cost averaging,MEDIUM
TXN000209,ACC-178086,CUST_192,03/29/2024,01-04-2024,VTI,Vanguard Total Stock Market ETF,BUY,300,$206.50,"$-61,951.00",USD,47.30,0.00,Individual,BRK003,NYSE ARCA,2024-03-29T11:02:09Z,Market timing,HIGH
TXN000210,ACC-700495,CUST_564,07/02/2024,,PEP,PepsiCo Inc,DIVIDEND,275,4.79,"$1,317.04",USD,31.03,0.00,Joint,BRK002,NASDAQ,2024-07-02T15:05:22Z,,low
TXN000211,ACC-407835,CUST_224,12 November 2024,,BOND_10Y,US Treasury 10 Year,DIVIDEND,734,$1.80,"1,317.85",USD,17.02,0.00,Joint,BRK005,BOND,2024-11-12T09:43:56Z,Estate planning,Very High
TXN000212,ACC-859143,CUST_290,13-Jan-2024,,GBP/USD,British Pound US Dollar,DIVIDEND,94,$1.55,145.94,USD,37.58,0.00,Corporate,BRK005,FOREX,2024-01-13T10:10:49Z,Long-term investment,Medium
TXN000213,ACC-911159,CUST_219,2024.12.16,2024.12.19,DIS,The Walt Disney Company,BUY,482,104.40,"$-50,319.27",USD,8.61,0.00,Retirement,BRK001,NYSE,2024-12-16T14:02:05Z,,HIGH
TXN000214,ACC-702891,CUST_842,26-04-2024,2024.04.28,BTC-USD,Bitcoin USD,SELL,3.895629,$46074.1486,$179487.80,USD,10.92,0.00,Joint,BRK001,CRYPTO,2024-04-26T10:22:59Z,Dollar cost averaging,Low
TXN000215,ACC-558936,CUST_391,2024-07-21,2024.07.22,EUR/USD,Euro US Dollar,BUY,455365,$1.11,$-503530.75,USD,32.29,0.00,Retirement,BRK003,FOREX,2024-07-21T09:35:55Z,Short-term trade,MEDIUM
TXN000216,ACC-513224,CUST_551,10/07/2024,10-Oct-2024,WFC,Wells Fargo & Co,BUY,464,$39.23,-18204.92,USD,37.30,0.00,Joint,BRK002,NYSE,2024-10-07T11:14:39Z,Profit taking,High
TXN000217,ACC-694849,CUST_873,28 January 2024,,XOM,Exxon Mobil Corp,DIVIDEND,737,$0.4301,$316.97,USD,9.91,0.00,Joint,BRK004,NYSE,2024-01-28T14:08:42Z,Short-term trade,MEDIUM
TXN000218,ACC-433222,CUST_498,18-Aug-2024,,SLV,iShares Silver Trust,DIVIDEND,648,0.846735,$548.68,USD,33.34,0.00,Corporate,BRK004,NYSE ARCA,2024-08-18T09:20:15Z,Year-end selling,High
TXN000219,ACC-240829,CUST_696,18 June 2024,20 June 2024,ETH-USD,Ethereum USD,SELL,1.758526,$3103.34,$5457.31,USD,35.33,97.58,Retirement,BRK005,CRYPTO,2024-06-18T13:46:56Z,Year-end selling,Very High
TXN000220,ACC-990856,CUST_520,2024-11-19,,DIS,The Walt Disney Company,DIVIDEND,837,2.991178,2503.62,USD,50.32,0.00,Joint,BRK003,NYSE,2024-11-19T16:41:49Z,,Med
TXN000221,ACC-718241,CUST_751,28/05/2024,,ETH-USD,Ethereum USD,DIVIDEND,456,1.883,858.62,USD,5.53,0.00,Retirement,BRK005,CRYPTO,2024-05-28T11:28:10Z,,High
TXN000222,ACC-606990,CUST_962,2024-07-02,04-Jul-2024,JPM,JPMorgan Chase & Co,SELL,343,149.361,"$51,230.74",USD,15.34,533.76,Trust,BRK004,NYSE,2024-07-02T09:41:20Z,,Low
TXN000223,ACC-975427,CUST_760,14/05/2024,,VTI,Vanguard Total Stock Market ETF,DIVIDEND,651,$3.3013,"2,149.18",USD,46.77,0.00,Joint,BRK003,NYSE ARCA,2024-05-14T12:33:25Z,,low
TXN000224,ACC-733561,CUST_7,13/09/2024,16-09-2024,ETH-USD,Ethereum USD,BUY,1.86987,2423.034208,-4530.76,USD,23.11,0.00,Individual,BRK002,CRYPTO,2024-09-13T14:46:07Z,Portfolio diversification,low
TXN000225,ACC-778700,CUST_854,2024-07-29,01/08/2024,JPM,JPMorgan Chase & Co,BUY,263,145.388962,$-38237.30,USD,6.96,0.00,Joint,BRK002,NYSE,2024-07-29T11:16:59Z,,Low
TXN000226,ACC-863336,CUST_678,05/25/2024,27 May 2024,NVDA,NVIDIA Corporation,SELL,426,485.283,$206730.72,USD,25.54,2840.42,Retirement,BRK005,NASDAQ,2024-05-25T13:10:46Z,Portfolio diversification,Med
TXN000227,ACC-340977,CUST_388,16/07/2024,2024.07.19,TSLA,Tesla Inc,BUY,311,279.182,$-86825.51,USD,9.81,0.00,Trust,BRK005,NASDAQ,2024-07-16T10:05:30Z,Market timing,Low
TXN000228,ACC-912510,CUST_695,2024.11.28,2024.11.29,GBP/USD,British Pound US Dollar,SELL,430636,$1.27,"$548,177.50",USD,29.11,5623.08,Joint,BRK001,FOREX,2024-11-28T11:16:30Z,,low
TXN000229,ACC-727354,CUST_898,2024.10.05,,BAC,Bank of America Corp,BUY,4,39.872914,$-159.49,USD,33.90,0.00,Individual,BRK005,NYSE,2024-10-05T15:41:13Z,Tax loss harvesting,Low
TXN000230,ACC-546768,CUST_668,26-10-2024,,BAC,Bank of America Corp,DIVIDEND,424,$3.0982,"$1,313.64",USD,54.59,0.00,Trust,BRK002,NYSE,2024-10-26T16:11:23Z,Portfolio diversification,low
TXN000231,ACC-911801,CUST_723,22/07/2024,,NFLX,Netflix Inc,DIVIDEND,285,$2.29,652.17,USD,39.97,0.00,Retirement,BRK001,NASDAQ,2024-07-22T15:50:21Z,Market timing,Very High
TXN000232,ACC-766764,CUST_6,16/02/2024,,EUR/USD,Euro US Dollar,DIVIDEND,115,1.389,$159.75,USD,23.54,0.00,Joint,BRK001,FOREX,2024-02-16T15:39:41Z,Year-end selling,low
TXN000233,ACC-960072,CUST_180,23 November 2024,26-11-2024,ETH-USD,Ethereum USD,BUY,7.83981,$2389.49,"$-18,733.17",USD,30.53,0.00,Retirement,BRK005,CRYPTO,2024-11-23T09:23:15Z,Rebalancing,High
TXN000234,ACC-470281,CUST_686,2024.07.21,07/24/2024,GLD,SPDR Gold Shares,BUY,282,216.77,"-61,128.32",USD,19.22,0.00,Joint,BRK005,NYSE ARCA,2024-07-21T14:52:17Z,,MEDIUM
TXN000235,ACC-702833,CUST_5,13/05/2024,,BTC-USD,Bitcoin USD,DIVIDEND,124,2.565529,318.13,USD,22.00,0.00,Individual,BRK005,CRYPTO,2024-05-13T13:44:28Z,Market timing,
TXN000236,ACC-913274,CUST_470,14 December 2024,,CRM,Salesforce Inc,DIVIDEND,543,$0.6697,363.66,USD,8.38,0.00,Retirement,BRK002,NYSE,2024-12-14T15:22:33Z,Year-end selling,MEDIUM
TXN000237,ACC-518309,CUST_690,06/24/2024,06-26-2024,BOND_10Y,US Treasury 10 Year,BUY,138,103.94,-14344.16,USD,14.14,0.00,Retirement,BRK004,BOND,2024-06-24T12:47:15Z,Profit taking,Very High
TXN000238,ACC-976960,CUST_634,01/07/2024,02 July 2024,KO,The Coca-Cola Company,BUY,392,$61.1383,"-23,966.20",USD,47.85,0.00,Individual,BRK004,NYSE,2024-07-01T14:31:57Z,Market timing,MEDIUM
TXN000239,ACC-901387,CUST_938,18-09-2024,2024-09-19,VTI,Vanguard Total Stock Market ETF,BUY,217,226.286772,$-49104.23,USD,28.92,0.00,Joint,BRK001,NYSE ARCA,2024-09-18T14:25:55Z,Rebalancing,Med
TXN000240,ACC-582418,CUST_324,2024-12-18,,AAPL,Apple Inc,DIVIDEND,644,$0.5937,$382.32,USD,23.08,0.00,Corporate,BRK002,NASDAQ,2024-12-18T13:15:17Z,Market timing,Med
TXN000241,ACC-544536,CUST_216,02-Aug-2024,03/08/2024,QQQ,Invesco QQQ Trust,SELL,352,447.93,"157,670.39",USD,16.43,0.00,Corporate,BRK002,NASDAQ,2024-08-02T15:54:24Z,,Med
TXN000242,ACC-285186,CUST_432,12/09/2024,,CRM,Salesforce Inc,DIVIDEND,787,1.65,"$1,296.24",USD,29.33,0.00,Corporate,BRK005,NYSE,2024-09-12T15:06:44Z,,Low
TXN000243,ACC-760458,CUST_99,18-Aug-2024,21-08-2024,BAC,Bank of America Corp,SELL,211,31.883,"6,727.27",USD,11.06,130.82,Retirement,BRK005,NYSE,2024-08-18T11:49:18Z,Quarterly rebalancing,Med
TXN000244,ACC-912378,CUST_755,08/16/2024,,VTI,Vanguard Total Stock Market ETF,DIVIDEND,696,$4.7873,"$3,331.97",USD,48.41,0.00,Corporate,BRK004,NYSE ARCA,2024-08-16T10:05:10Z,Tax loss harvesting,low
TXN000245,ACC-734792,CUST_661,21-07-2024,23 July 2024,CRM,Salesforce Inc,SELL,95,233.119125,$22146.32,USD,47.71,188.67,Corporate,BRK001,NYSE,2024-07-21T11:25:06Z,,Very High
TXN000246,ACC-127645,CUST_790,07/22/2024,2024.07.23,TSLA,Tesla Inc,SELL,127,217.124478,"27,574.81",USD,41.88,190.16,Joint,BRK002,NASDAQ,2024-07-22T09:42:22Z,Tax loss harvesting,Low
TXN000247,ACC-666843,CUST_958,19 May 2024,,AMZN,Amazon.com Inc,DIVIDEND,655,$3.03,"1,983.45",USD,36.55,0.00,Joint,BRK004,NASDAQ,2024-05-19T13:58:22Z,Profit taking,Med
TXN000248,ACC-532227,CUST_267,20-03-2024,21-Mar-2024,AAPL,Apple Inc,BUY,274,164.34,$-45028.64,USD,5.42,0.00,Trust,BRK004,NASDAQ,2024-03-20T09:49:27Z,Market timing,
TXN000249,ACC-297731,CUST_422,2024.10.14,2024.10.17,VTI,Vanguard Total Stock Market ETF,BUY,113,$241.4213,"-27,280.61",USD,18.15,0.00,Trust,BRK002,NYSE ARCA,2024-10-14T13:18:41Z,Estate planning,Med
TXN000250,ACC-171789,CUST_187,10-03-2024,,TSLA,Tesla Inc,DIVIDEND,513,$1.43,$735.36,USD,36.14,0.00,Retirement,BRK003,NASDAQ,2024-03-10T11:03:34Z,,Low
TXN000251,ACC-849937,CUST_449,01-05-2024,,MSFT,Microsoft Corporation,BUY,216,$326.06,"$-70,429.52",USD,20.58,0.00,Trust,BRK003,NASDAQ,2024-01-05T09:21:05Z,Rebalancing,HIGH
TXN000252,ACC-174852,CUST_557,28/08/2024,08/29/2024,NVDA,NVIDIA Corporation,SELL,366,887.299251,"$324,751.53",USD,17.45,3781.54,Individual,BRK002,NASDAQ,2024-08-28T10:33:42Z,Portfolio diversification,HIGH
TXN000253,ACC-438756,CUST_163,2024-11-18,,PFE,Pfizer Inc,DIVIDEND,309,2.46,$759.53,USD,19.94,0.00,Corporate,BRK001,NYSE,2024-11-18T10:15:40Z,Long-term investment,Very High
TXN000254,ACC-515035,CUST_809,2024-05-04,,GOOGL,Alphabet Inc Class A,DIVIDEND,536,$3.47,$1861.63,USD,12.75,0.00,Individual,BRK002,NASDAQ,2024-05-04T16:05:43Z,Estate planning,High
TXN000255,ACC-261395,CUST_719,10/01/2024,04-Oct-2024,AMZN,Amazon.com Inc,SELL,225,172.221,"$38,749.73",USD,41.66,0.00,Trust,BRK003,NASDAQ,2024-10-01T13:57:02Z,Portfolio diversification,High
TXN000256,ACC-613898,CUST_195,17/10/2024,19-10-2024,BOND_10Y,US Treasury 10 Year,SELL,307,103.677,"31,828.72",USD,50.72,192.03,Retirement,BRK004,BOND,2024-10-17T13:34:23Z,Estate planning,
TXN000257,ACC-869295,CUST_190,10-Jan-2024,,KO,The Coca-Cola Company,DIVIDEND,788,$0.4104,$323.38,USD,53.36,0.00,Trust,BRK002,NYSE,2024-01-10T16:49:35Z,,Med
TXN000258,ACC-437666,CUST_114,02/19/2024,02-20-2024,GOOGL,Alphabet Inc Class A,BUY,99,$126.42,$-12515.91,USD,9.94,0.00,Joint,BRK004,NASDAQ,2024-02-19T13:03:23Z,,HIGH
TXN000259,ACC-318877,CUST_672,09/08/2024,,ETH-USD,Ethereum USD,DIVIDEND,621,3.74,$2324.43,USD,49.52,0.00,Corporate,BRK001,CRYPTO,2024-09-08T09:46:04Z,Short-term trade,
TXN000260,ACC-342239,CUST_545,07-16-2024,,NVDA,NVIDIA Corporation,DIVIDEND,633,$3.16,2002.87,USD,13.94,0.00,Joint,BRK004,NASDAQ,2024-07-16T14:43:29Z,Dividend reinvestment,Medium
TXN000261,ACC-676680,CUST_412,15-Sep-2024,18 September 2024,CVX,Chevron Corporation,BUY,463,168.006,-77786.59,USD,20.76,0.00,Corporate,BRK003,NYSE,2024-09-15T15:52:46Z,Profit taking,low
TXN000262,ACC-676967,CUST_949,10-May-2024,2024-05-11,ETH-USD,Ethereum USD,SELL,5.958033,$3965.9129,23629.04,USD,30.88,225.13,Corporate,BRK002,CRYPTO,2024-05-10T14:01:49Z,Year-end selling,Very High
TXN000263,ACC-198867,CUST_39,23-Aug-2024,08-26-2024,AMZN,Amazon.com Inc,BUY,416,149.319766,$-62117.02,USD,20.02,0.00,Joint,BRK004,NASDAQ,2024-08-23T10:46:20Z,Rebalancing,Very High
TXN000264,ACC-414985,CUST_39,2024.10.22,24-Oct-2024,MSFT,Microsoft Corporation,BUY,223,405.575,-90443.25,USD,25.83,0.00,Individual,BRK002,NASDAQ,2024-10-22T15:03:19Z,Tax loss harvesting,Low
TXN000265,ACC-831663,CUST_227,2024-03-19,,CVX,Chevron Corporation,DIVIDEND,506,$3.7889,$1917.19,USD,33.76,0.00,Individual,BRK002,NYSE,2024-03-19T13:50:25Z,,low
TXN000266,ACC-881519,CUST_51,2024.10.07,09/10/2024,BAC,Bank of America Corp,BUY,247,40.240658,"$-9,939.44",USD,32.96,0.00,Trust,BRK004,NYSE,2024-10-07T12:15:04Z,,Very High
TXN000267,ACC-703998,CUST_92,2024.02.27,29-Feb-2024,BTC-USD,Bitcoin USD,SELL,0.243044,$55785.7002,13558.39,USD,20.24,193.12,Trust,BRK005,CRYPTO,2024-02-27T16:02:59Z,Profit taking,High
TXN000268,ACC-894541,CUST_746,02/13/2024,16/02/2024,PFE,Pfizer Inc,BUY,420,33.688,-14148.76,USD,19.38,0.00,Corporate,BRK001,NYSE,2024-02-13T16:30:01Z,Year-end selling,
TXN000269,ACC-648684,CUST_769,12 May 2024,,SLV,iShares Silver Trust,DIVIDEND,761,3.524,"$2,681.69",USD,5.92,,Joint,BRK005,NYSE ARCA,2024-05-12T13:10:03Z,,Low
TXN000270,ACC-786563,CUST_968,01/05/2024,,VTI,Vanguard Total Stock Market ETF,DIVIDEND,922,$4.57,"$4,216.36",USD,23.01,0.00,Individual,BRK001,NYSE ARCA,2024-01-05T15:14:24Z,Year-end selling,
TXN000271,ACC-726111,CUST_545,15/02/2024,,NVDA,NVIDIA Corporation,DIVIDEND,624,$4.6391,"$2,894.81",USD,6.07,0.00,Retirement,BRK005,NASDAQ,2024-02-15T14:31:25Z,Long-term investment,
TXN000272,ACC-417012,CUST_242,13-09-2024,2024-09-15,PEP,PepsiCo Inc,BUY,486,178.883,-86937.01,USD,19.01,0.00,Retirement,BRK003,NASDAQ,2024-09-13T11:05:46Z,Quarterly rebalancing,low
TXN000273,ACC-700727,CUST_157,06-08-2024,,ORCL,Oracle Corporation,DIVIDEND,605,0.75,451.14,USD,37.62,0.00,Joint,BRK005,NYSE,2024-08-06T11:19:44Z,Risk management,Very High
TXN000274,ACC-907455,CUST_149,01/12/2024,12/04/2024,SPY,SPDR S&P 500 ETF,BUY,430,$418.4135,-179917.81,USD,48.98,0.00,Individual,BRK003,NYSE ARCA,2024-12-01T15:19:28Z,,low
TXN000275,ACC-211957,CUST_135,2024-04-04,,KO,The Coca-Cola Company,DIVIDEND,670,2.879,"1,928.60",USD,16.55,0.00,Retirement,BRK002,NYSE,2024-04-04T14:05:44Z,Rebalancing,Low
TXN000276,ACC-492124,CUST_189,17 July 2024,2024-07-18,EUR/USD,Euro US Dollar,BUY,17871,1.079,"-19,275.68",USD,51.27,0.00,Trust,BRK002,FOREX,2024-07-17T12:04:11Z,Portfolio diversification,Very High
TXN000277,ACC-579770,CUST_909,2024.05.06,08-May-2024,VTI,Vanguard Total Stock Market ETF,BUY,481,$219.71,-105679.32,USD,42.12,0.00,Joint,BRK005,NYSE ARCA,2024-05-06T09:33:06Z,,Med
TXN000278,ACC-514828,CUST_753,2024.01.21,,GBP/USD,British Pound US Dollar,DIVIDEND,244,1.527,372.53,USD,24.90,0.00,Corporate,BRK003,FOREX,2024-01-21T11:27:18Z,Long-term investment,HIGH
TXN000279,ACC-777486,CUST_463,02/16/2024,,META,Meta Platforms Inc,DIVIDEND,762,2.777395,$2116.37,USD,24.65,0.00,Corporate,BRK004,NASDAQ,2024-02-16T11:29:37Z,Profit taking,Low
TXN000280,ACC-825318,CUST_665,30/12/2024,,JNJ,Johnson & Johnson,DIVIDEND,166,3.56,$591.04,USD,36.70,0.00,Individual,BRK005,NYSE,2024-12-30T11:24:35Z,Estate planning,low
TXN000281,ACC-791567,CUST_884,17/03/2024,2024-03-20,NFLX,Netflix Inc,BUY,159,412.937,"$-65,657.02",USD,41.51,,Trust,BRK003,NASDAQ,2024-03-17T10:57:08Z,Long-term investment,High
TXN000282,ACC-621800,CUST_876,2024-09-12,15 September 2024,SLV,iShares Silver Trust,SELL,227,$24.5374,$5569.99,USD,8.97,48.30,Joint,BRK003,NYSE ARCA,2024-09-12T12:03:11Z,,Med
TXN000283,ACC-252436,CUST_875,17-01-2024,,SPY,SPDR S&P 500 ETF,BUY,92,$441.70,"$-40,636.00",USD,13.07,0.00,Corporate,BRK005,NYSE ARCA,2024-01-17T11:29:47Z,Long-term investment,Med
TXN000284,ACC-497346,CUST_840,2024.02.04,,DIS,The Walt Disney Company,DIVIDEND,532,$0.76,$403.93,USD,39.73,0.00,Corporate,BRK003,NYSE,2024-02-04T15:33:13Z,Market timing,Med
TXN000285,ACC-759531,CUST_542,14 February 2024,,PFE,Pfizer Inc,DIVIDEND,857,4.933,"4,227.38",USD,19.36,0.00,Joint,BRK003,NYSE,2024-02-14T14:59:08Z,Portfolio diversification,
TXN000286,ACC-288646,CUST_905,11-08-2024,11/09/2024,JNJ,Johnson & Johnson,SELL,321,150.48,$48304.00,USD,44.84,391.74,Joint,BRK004,NYSE,2024-11-08T09:21:22Z,Quarterly rebalancing,low
TXN000287,ACC-771736,CUST_207,19-12-2024,22-Dec-2024,BAC,Bank of America Corp,BUY,59,40.340652,"-2,380.10",USD,39.29,0.00,Corporate,BRK004,NYSE,2024-12-19T11:12:21Z,Quarterly rebalancing,Low
TXN000288,ACC-777015,CUST_140,03/09/2024,06-Sep-2024,XOM,Exxon Mobil Corp,SELL,417,$106.5618,$44436.25,USD,25.70,778.82,Corporate,BRK005,NYSE,2024-09-03T09:13:36Z,Estate planning,MEDIUM
TXN000289,ACC-256557,CUST_288,16-Jan-2024,,VTI,Vanguard Total Stock Market ETF,DIVIDEND,219,$2.90,634.62,USD,24.48,0.00,Joint,BRK001,NYSE ARCA,2024-01-16T14:45:02Z,,
TXN000290,ACC-489633,CUST_463,06-03-2024,2024-06-05,GBP/USD,British Pound US Dollar,SELL,488860,$1.3278,"$649,098.06",USD,9.63,11025.18,Joint,BRK002,FOREX,2024-06-03T14:59:30Z,Risk management,Very High
TXN000291,ACC-250255,CUST_788,20/02/2024,,NVDA,NVIDIA Corporation,DIVIDEND,446,3.597,"$1,604.27",USD,31.12,,Individual,BRK003,NASDAQ,2024-02-20T10:21:29Z,Short-term trade,Low
TXN000292,ACC-895338,CUST_320,11-23-2024,25-Nov-2024,SPY,SPDR S&P 500 ETF,BUY,344,477.28,"$-164,183.88",USD,10.88,0.00,Retirement,BRK002,NYSE ARCA,2024-11-23T10:00:39Z,Short-term trade,
TXN000293,ACC-384218,CUST_145,26-12-2024,28-Dec-2024,GLD,SPDR Gold Shares,BUY,26,201.623,"-5,242.20",USD,11.50,0.00,Trust,BRK001,NYSE ARCA,2024-12-26T15:03:05Z,Rebalancing,Medium
TXN000294,ACC-427617,CUST_341,04/11/2024,12 April 2024,ORCL,Oracle Corporation,SELL,159,$102.9179,"$16,363.94",USD,39.22,196.06,Retirement,BRK002,NYSE,2024-04-11T13:58:23Z,Year-end selling,High
TXN000295,ACC-575301,CUST_500,01/16/2024,18/01/2024,EUR/USD,Euro US Dollar,BUY,192774,1.070,$-206221.53,USD,35.22,0.00,Retirement,BRK005,FOREX,2024-01-16T15:52:45Z,Tax loss harvesting,Medium
TXN000296,ACC-658624,CUST_473,2024.07.24,,JPM,JPMorgan Chase & Co,DIVIDEND,212,4.87,1032.88,USD,24.19,0.00,Corporate,BRK002,NYSE,2024-07-24T15:36:50Z,Year-end selling,low
TXN000297,ACC-181678,CUST_758,30 December 2024,,TSLA,Tesla Inc,DIVIDEND,383,2.81993,"$1,080.03",USD,46.10,0.00,Retirement,BRK003,NASDAQ,2024-12-30T10:38:06Z,Market timing,low
TXN000298,ACC-792232,CUST_63,02-16-2024,2024-02-19,DIS,The Walt Disney Company,BUY,339,$107.7123,"$-36,514.48",USD,12.46,0.00,Joint,BRK003,NYSE,2024-02-16T16:12:13Z,Tax loss harvesting,low
TXN000299,ACC-555844,CUST_736,06/25/2024,2024.06.28,GLD,SPDR Gold Shares,BUY,437,$213.91,"$-93,476.69",USD,19.71,0.00,Corporate,BRK005,NYSE ARCA,2024-06-25T09:45:35Z,Tax loss harvesting,Low
TXN000300,ACC-346668,CUST_443,2024.12.25,2024.12.27,XOM,Exxon Mobil Corp,SELL,109,$105.88,$11540.89,USD,38.12,90.29,Trust,BRK003,NYSE,2024-12-25T11:18:55Z,Rebalancing,low
TXN000301,ACC-779885,CUST_17,14 March 2024,03/15/2024,CVX,Chevron Corporation,SELL,413,144.116608,"$59,520.16",USD,25.79,1001.96,Joint,BRK004,NYSE,2024-03-14T16:32:27Z,Portfolio diversification,High
TXN000302,ACC-336706,CUST_191,2024-08-05,06-08-2024,GLD,SPDR Gold Shares,SELL,280,$196.43,55001.38,USD,33.82,0.00,Individual,BRK005,NYSE ARCA,2024-08-05T14:07:37Z,Year-end selling,HIGH
TXN000303,ACC-651978,CUST_880,23 May 2024,05/26/2024,GBP/USD,British Pound US Dollar,BUY,340648,1.274523,"-434,163.76",USD,42.08,0.00,Individual,BRK005,FOREX,2024-05-23T09:57:21Z,Long-term investment,
TXN000304,ACC-592025,CUST_588,2024.06.18,19-06-2024,QQQ,Invesco QQQ Trust,SELL,289,422.697,$122159.48,USD,18.02,1670.18,Joint,BRK001,NASDAQ,2024-06-18T09:18:31Z,,
TXN000305,ACC-992805,CUST_803,22-05-2024,,AMZN,Amazon.com Inc,DIVIDEND,928,1.36,"1,261.23",USD,42.07,0.00,Joint,BRK002,NASDAQ,2024-05-22T16:23:51Z,,High
TXN000306,ACC-653007,CUST_883,17-Jan-2024,18 January 2024,MSFT,Microsoft Corporation,BUY,212,$390.3314,$-82750.25,USD,43.52,,Retirement,BRK004,NASDAQ,2024-01-17T12:36:46Z,Long-term investment,High
TXN000307,ACC-586554,CUST_409,31-08-2024,,EUR/USD,Euro US Dollar,DIVIDEND,994,2.709352,"2,693.10",USD,23.99,0.00,Trust,BRK004,FOREX,2024-08-31T11:33:55Z,Dollar cost averaging,
TXN000308,ACC-656011,CUST_700,01/22/2024,,ORCL,Oracle Corporation,DIVIDEND,914,2.216,"2,025.20",USD,50.90,0.00,Corporate,BRK003,NYSE,2024-01-22T13:51:06Z,,
TXN000309,ACC-808094,CUST_768,05-03-2024,04-May-2024,GBP/USD,British Pound US Dollar,SELL,362741,$1.3048,"$473,290.40",USD,5.42,0.00,Trust,BRK001,FOREX,2024-05-03T10:43:28Z,Year-end selling,Med
TXN000310,ACC-124851,CUST_635,2024-02-17,,SLV,iShares Silver Trust,DIVIDEND,272,4.76,$1294.01,USD,36.90,0.00,Individual,BRK001,NYSE ARCA,2024-02-17T15:42:48Z,Market timing,High
TXN000311,ACC-365641,CUST_302,08/27/2024,2024.08.29,XOM,Exxon Mobil Corp,SELL,342,$112.3055,38408.49,USD,43.49,285.36,Individual,BRK003,NYSE,2024-08-27T15:24:21Z,Dollar cost averaging,Low
TXN000312,ACC-561976,CUST_72,09-08-2024,09/10/2024,SLV,iShares Silver Trust,SELL,394,21.438726,$8446.86,USD,26.56,55.70,Trust,BRK003,NYSE ARCA,2024-09-08T09:04:04Z,Dollar cost averaging,Medium
TXN000313,ACC-621877,CUST_153,2024-11-30,02/12/2024,ORCL,Oracle Corporation,BUY,464,$121.00,-56144.77,USD,24.57,,Individual,BRK005,NYSE,2024-11-30T16:27:25Z,Estate planning,HIGH
TXN000314,ACC-822742,CUST_838,09/03/2024,,GLD,SPDR Gold Shares,DIVIDEND,417,$1.7339,723.02,USD,20.14,0.00,Individual,BRK001,NYSE ARCA,2024-09-03T14:05:53Z,Estate planning,MEDIUM
TXN000315,ACC-141241,CUST_991,07-15-2024,,WFC,Wells Fargo & Co,DIVIDEND,159,3.190,507.21,USD,22.96,0.00,Individual,BRK004,NYSE,2024-07-15T11:02:12Z,,Very High
TXN000316,ACC-166052,CUST_812,03-10-2024,,EUR/USD,Euro US Dollar,DIVIDEND,881,$2.30,2027.71,USD,54.79,0.00,Individual,BRK003,FOREX,2024-10-03T14:50:46Z,,Low
TXN000317,ACC-799731,CUST_536,22/08/2024,,PFE,Pfizer Inc,DIVIDEND,123,0.28,$34.53,USD,12.08,0.00,Individual,BRK004,NYSE,2024-08-22T12:44:41Z,,Low
TXN000318,ACC-960607,CUST_813,19 February 2024,02/20/2024,SLV,iShares Silver Trust,BUY,305,21.141797,"$-6,448.25",USD,44.96,0.00,Retirement,BRK001,NYSE ARCA,2024-02-19T15:21:51Z,Year-end selling,Very High
TXN000319,ACC-817318,CUST_590,06/10/2024,09/10/2024,SPY,SPDR S&P 500 ETF,BUY,62,433.55,$-26880.12,USD,18.69,0.00,Trust,BRK002,NYSE ARCA,2024-10-06T11:28:15Z,Long-term investment,MEDIUM
TXN000320,ACC-762904,CUST_628,11/07/2024,12/07/2024,AAPL,Apple Inc,SELL,362,196.31,71063.08,USD,37.59,798.99,Trust,BRK002,NASDAQ,2024-07-11T11:40:17Z,Dividend reinvestment,Very High
TXN000321,ACC-740195,CUST_709,20/01/2024,21-01-2024,JNJ,Johnson & Johnson,SELL,3,$156.9571,$470.87,USD,32.89,9.32,Individual,BRK005,NYSE,2024-01-20T12:29:49Z,Profit taking,MEDIUM
TXN000322,ACC-303129,CUST_116,17 March 2024,2024-03-18,EUR/USD,Euro US Dollar,BUY,159455,1.095,-174625.59,USD,15.48,0.00,Corporate,BRK003,FOREX,2024-03-17T09:06:47Z,,HIGH
TXN000323,ACC-130477,CUST_497,09/20/2024,23-Sep-2024,MSFT,Microsoft Corporation,BUY,383,350.287953,-134160.29,USD,38.84,0.00,Corporate,BRK002,NASDAQ,2024-09-20T14:14:06Z,,Medium
TXN000324,ACC-331381,CUST_76,29 August 2024,01 September 2024,GOOGL,Alphabet Inc Class A,SELL,192,130.68,$25091.26,USD,11.82,363.33,Corporate,BRK002,NASDAQ,2024-08-29T11:02:44Z,Dollar cost averaging,MEDIUM
TXN000325,ACC-993021,CUST_477,2024.08.22,24/08/2024,META,Meta Platforms Inc,SELL,327,318.432,"104,127.28",USD,52.64,1423.61,Joint,BRK002,NASDAQ,2024-08-22T15:54:33Z,Profit taking,Medium
TXN000326,ACC-977646,CUST_474,2024-05-22,05-23-2024,PFE,Pfizer Inc,SELL,297,$28.27,"8,397.07",USD,16.12,161.17,Joint,BRK001,NYSE,2024-05-22T09:02:30Z,Risk management,low
TXN000327,ACC-656921,CUST_404,09/02/2024,2024-09-05,ETH-USD,Ethereum USD,SELL,4.066774,3386.320,$13771.40,USD,15.90,118.24,Individual,BRK001,CRYPTO,2024-09-02T13:10:45Z,Market timing,HIGH
TXN000328,ACC-576935,CUST_475,2024.03.11,2024-03-14,META,Meta Platforms Inc,SELL,37,$329.0574,$12175.12,USD,24.24,157.84,Corporate,BRK004,NASDAQ,2024-03-11T12:50:43Z,,
TXN000329,ACC-639740,CUST_969,11-Dec-2024,13 December 2024,CRM,Salesforce Inc,BUY,188,$249.53,"-46,911.77",USD,23.32,0.00,Joint,BRK001,NYSE,2024-12-11T12:08:21Z,,Med
TXN000330,ACC-888819,CUST_595,12-25-2024,,KO,The Coca-Cola Company,DIVIDEND,378,1.828,$691.09,USD,18.37,0.00,Trust,BRK003,NYSE,2024-12-25T10:23:22Z,Risk management,Low
TXN000331,ACC-657742,CUST_695,29-09-2024,,ETH-USD,Ethereum USD,DIVIDEND,739,$4.73,$3497.16,USD,45.44,0.00,Individual,BRK002,CRYPTO,2024-09-29T10:05:25Z,Dollar cost averaging,HIGH
TXN000332,ACC-217466,CUST_714,16 March 2024,2024-03-19,AMZN,Amazon.com Inc,BUY,497,151.73,$-75408.21,USD,39.12,,Retirement,BRK004,NASDAQ,2024-03-16T15:28:47Z,Dollar cost averaging,MEDIUM
TXN000333,ACC-940946,CUST_238,23-Sep-2024,,BTC-USD,Bitcoin USD,DIVIDEND,711,$3.9554,2812.32,USD,29.31,0.00,Joint,BRK005,CRYPTO,2024-09-23T16:19:36Z,,HIGH
TXN000334,ACC-337798,CUST_496,09-07-2024,11 July 2024,KO,The Coca-Cola Company,BUY,317,64.56,-20466.20,USD,51.21,0.00,Joint,BRK003,NYSE,2024-07-09T11:53:45Z,Quarterly rebalancing,High
TXN000335,ACC-143150,CUST_325,21/10/2024,2024-10-22,ETH-USD,Ethereum USD,SELL,9.780248,3331.106563,"$32,579.05",USD,12.40,639.59,Joint,BRK003,CRYPTO,2024-10-21T09:25:59Z,Rebalancing,Medium
TXN000336,ACC-263633,CUST_5,06-Oct-2024,,XOM,Exxon Mobil Corp,DIVIDEND,967,1.52,$1469.99,USD,52.20,0.00,Joint,BRK002,NYSE,2024-10-06T14:44:07Z,Long-term investment,HIGH
TXN000337,ACC-521139,CUST_633,22 April 2024,04-25-2024,QQQ,Invesco QQQ Trust,BUY,114,$408.34,"-46,551.12",USD,44.06,0.00,Corporate,BRK002,NASDAQ,2024-04-22T10:34:54Z,Quarterly rebalancing,Low
TXN000338,ACC-433193,CUST_618,2024-11-05,,ORCL,Oracle Corporation,DIVIDEND,201,3.608,$725.25,USD,26.38,0.00,Trust,BRK003,NYSE,2024-11-05T13:22:22Z,Portfolio diversification,Low
TXN000339,ACC-565798,CUST_760,31 July 2024,2024.08.02,WFC,Wells Fargo & Co,BUY,301,37.791,"-11,375.20",USD,34.90,,Retirement,BRK002,NYSE,2024-07-31T16:55:33Z,Short-term trade,
TXN000340,ACC-529350,CUST_655,2024.05.19,,META,Meta Platforms Inc,DIVIDEND,631,3.801,"$2,398.24",USD,11.85,0.00,Retirement,BRK004,NASDAQ,2024-05-19T16:02:52Z,,
TXN000341,ACC-875795,CUST_475,2024-04-24,26 April 2024,PEP,PepsiCo Inc,BUY,341,$162.48,"$-55,406.89",USD,49.63,0.00,Trust,BRK002,NASDAQ,2024-04-24T12:01:07Z,Portfolio diversification,HIGH
TXN000342,ACC-693047,CUST_447,12 May 2024,2024-05-15,JNJ,Johnson & Johnson,BUY,84,$166.9056,"-14,020.07",USD,34.08,0.00,Retirement,BRK003,NYSE,2024-05-12T11:22:10Z,,HIGH
TXN000343,ACC-473276,CUST_50,28-05-2024,,GBP/USD,British Pound US Dollar,DIVIDEND,576,$1.0497,$604.62,USD,36.40,0.00,Individual,BRK005,FOREX,2024-05-28T14:55:20Z,Quarterly rebalancing,High
TXN000344,ACC-821783,CUST_372,19-Feb-2024,,DIS,The Walt Disney Company,BUY,191,100.55,$-19204.12,USD,43.94,0.00,Trust,BRK003,NYSE,2024-02-19T10:13:09Z,,High
TXN000345,ACC-180111,CUST_120,2024-03-08,10/03/2024,EUR/USD,Euro US Dollar,SELL,476472,1.11,"$527,546.32",USD,54.38,10314.41,Retirement,BRK003,FOREX,2024-03-08T10:14:08Z,Rebalancing,Low
TXN000346,ACC-231432,CUST_215,03/07/2024,,BTC-USD,Bitcoin USD,DIVIDEND,164,$0.48,78.87,USD,43.73,0.00,Trust,BRK001,CRYPTO,2024-03-07T10:02:50Z,Market timing,Very High
TXN000347,ACC-365302,CUST_45,03-02-2024,02-04-2024,CVX,Chevron Corporation,BUY,103,$157.6281,"$-16,235.69",USD,14.24,0.00,Corporate,BRK001,NYSE,2024-02-03T11:54:47Z,Market timing,Medium
TXN000348,ACC-624953,CUST_800,11-09-2024,,GBP/USD,British Pound US Dollar,DIVIDEND,889,$2.93,2607.31,USD,5.70,0.00,Retirement,BRK002,FOREX,2024-11-09T11:57:48Z,Year-end selling,
TXN000349,ACC-992649,CUST_725,31-Aug-2024,,JNJ,Johnson & Johnson,DIVIDEND,739,$4.7930,$3542.00,USD,14.04,0.00,Corporate,BRK004,NYSE,2024-08-31T12:32:14Z,Estate planning,low
TXN000350,ACC-644973,CUST_140,10-Sep-2024,09/11/2024,JNJ,Johnson & Johnson,SELL,60,$156.56,"9,393.74",USD,24.24,150.70,Trust,BRK002,NYSE,2024-09-10T15:18:54Z,,Med
TXN000351,ACC-812120,CUST_377,2024-04-01,03 April 2024,CVX,Chevron Corporation,SELL,347,155.679871,$54020.92,USD,9.25,594.74,Joint,BRK001,NYSE,2024-04-01T10:23:12Z,Market timing,High
TXN000352,ACC-344181,CUST_859,05 August 2024,,BAC,Bank of America Corp,DIVIDEND,657,1.437567,$944.48,USD,44.47,0.00,Trust,BRK003,NYSE,2024-08-05T15:31:32Z,,HIGH
TXN000353,ACC-613111,CUST_510,28/04/2024,29 April 2024,AAPL,Apple Inc,BUY,498,$183.91,"-91,584.88",USD,13.95,0.00,Joint,BRK003,NASDAQ,2024-04-28T13:39:39Z,,High
TXN000354,ACC-311740,CUST_301,04 December 2024,,EUR/USD,Euro US Dollar,DIVIDEND,401,4.06646,"1,630.65",USD,32.03,,Individual,BRK001,FOREX,2024-12-04T10:24:28Z,Dividend reinvestment,low
TXN000355,ACC-285460,CUST_571,03-12-2024,,CRM,Salesforce Inc,DIVIDEND,491,$0.76,372.67,USD,40.79,0.00,Trust,BRK001,NYSE,2024-12-03T16:30:35Z,Risk management,HIGH
TXN000356,ACC-719755,CUST_995,12-Jul-2024,2024-07-13,KO,The Coca-Cola Company,SELL,188,56.28,10581.01,USD,22.44,57.17,Corporate,BRK004,NYSE,2024-07-12T15:22:22Z,Long-term investment,Medium
TXN000357,ACC-346019,CUST_664,06/08/2024,,ORCL,Oracle Corporation,DIVIDEND,362,0.660909,$239.25,USD,13.49,,Joint,BRK003,NYSE,2024-06-08T16:42:55Z,Risk management,Low
TXN000358,ACC-592516,CUST_603,12-Jan-2024,,VTI,Vanguard Total Stock Market ETF,DIVIDEND,636,0.578856,368.15,USD,29.42,0.00,Retirement,BRK003,NYSE ARCA,2024-01-12T14:10:39Z,,HIGH
TXN000359,ACC-988494,CUST_998,02-08-2024,,WFC,Wells Fargo & Co,SELL,206,54.924554,11314.46,USD,45.23,219.15,Joint,BRK001,NYSE,2024-02-08T13:04:36Z,Portfolio diversification,MEDIUM
TXN000360,ACC-464187,CUST_815,09-02-2024,12-Feb-2024,GBP/USD,British Pound US Dollar,SELL,220921,1.270008,"$280,571.37",USD,17.56,4229.17,Joint,BRK002,FOREX,2024-02-09T11:36:31Z,,Low
TXN000361,ACC-768914,CUST_546,2024.11.10,,ORCL,Oracle Corporation,DIVIDEND,111,$2.66,295.16,USD,23.21,0.00,Retirement,BRK002,NYSE,2024-11-10T13:54:27Z,,High
TXN000362,ACC-379901,CUST_844,26/05/2024,,BAC,Bank of America Corp,DIVIDEND,465,$1.27,589.88,USD,12.50,0.00,Individual,BRK002,NYSE,2024-05-26T16:31:35Z,Dividend reinvestment,
TXN000363,ACC-243057,CUST_30,12-05-2024,,CVX,Chevron Corporation,DIVIDEND,922,$0.3069,$283.00,USD,41.12,0.00,Individual,BRK001,NYSE,2024-05-12T14:38:19Z,Dividend reinvestment,Medium
TXN000364,ACC-980605,CUST_742,03-12-2024,,TSLA,Tesla Inc,DIVIDEND,173,$2.6576,$459.76,USD,46.45,0.00,Joint,BRK003,NASDAQ,2024-03-12T10:15:38Z,,HIGH
TXN000365,ACC-873048,CUST_400,2024.04.30,01-05-2024,NVDA,NVIDIA Corporation,BUY,131,619.737706,-81185.64,USD,48.14,0.00,Individual,BRK004,NASDAQ,2024-04-30T14:44:07Z,Dividend reinvestment,Med
TXN000366,ACC-922370,CUST_960,15-Mar-2024,,EUR/USD,Euro US Dollar,DIVIDEND,365,$0.2033,$74.19,USD,53.34,0.00,Joint,BRK001,FOREX,2024-03-15T12:16:35Z,Quarterly rebalancing,Low
TXN000367,ACC-347864,CUST_879,2024.08.14,16-08-2024,AAPL,Apple Inc,SELL,422,$154.51,"65,204.28",USD,42.83,1166.59,Retirement,BRK004,NASDAQ,2024-08-14T15:50:02Z,,MEDIUM
TXN000368,ACC-593975,CUST_755,30-Jul-2024,31/07/2024,JNJ,Johnson & Johnson,SELL,260,163.969644,42632.11,USD,8.32,679.49,Joint,BRK003,NYSE,2024-07-30T09:48:03Z,Rebalancing,HIGH
TXN000369,ACC-103225,CUST_411,12-04-2024,,SPY,SPDR S&P 500 ETF,DIVIDEND,211,$1.3231,279.17,USD,40.68,0.00,Retirement,BRK005,NYSE ARCA,2024-04-12T14:28:30Z,Rebalancing,low
TXN000370,ACC-966929,CUST_336,05-24-2024,2024.05.26,MSFT,Microsoft Corporation,SELL,453,413.37,$187257.00,USD,33.52,0.00,Individual,BRK005,NASDAQ,2024-05-24T10:29:12Z,,Very High
TXN000371,ACC-549737,CUST_615,13/05/2024,05/16/2024,MSFT,Microsoft Corporation,SELL,270,$301.6938,"81,457.32",USD,26.76,961.65,Trust,BRK001,NASDAQ,2024-05-13T12:12:55Z,Dollar cost averaging,Very High
TXN000372,ACC-500633,CUST_134,08-08-2024,08-10-2024,SLV,iShares Silver Trust,BUY,210,24.183,"-5,078.50",USD,44.62,,Individual,BRK003,NYSE ARCA,2024-08-08T12:39:28Z,Tax loss harvesting,
TXN000373,ACC-591658,CUST_137,2024.06.14,2024.06.17,CVX,Chevron Corporation,BUY,132,162.083,$-21394.97,USD,8.65,,Joint,BRK001,NYSE,2024-06-14T14:59:15Z,Tax loss harvesting,Low
TXN000374,ACC-629050,CUST_635,14-07-2024,,VTI,Vanguard Total Stock Market ETF,DIVIDEND,963,$2.84,"$2,736.70",USD,34.02,0.00,Corporate,BRK002,NYSE ARCA,2024-07-14T16:59:21Z,Rebalancing,Med
TXN000375,ACC-553959,CUST_146,05/13/2024,15-05-2024,SPY,SPDR S&P 500 ETF,BUY,475,474.782337,-225521.61,USD,26.50,0.00,Corporate,BRK005,NYSE ARCA,2024-05-13T14:27:57Z,,
TXN000376,ACC-789354,CUST_652,2024-08-13,,NVDA,NVIDIA Corporation,BUY,241,491.571,"-118,468.53",USD,18.01,0.00,Trust,BRK004,NASDAQ,2024-08-13T16:02:28Z,Year-end selling,Medium
TXN000377,ACC-217955,CUST_867,03/16/2024,18/03/2024,QQQ,Invesco QQQ Trust,BUY,384,$433.50,-166462.22,USD,30.44,0.00,Corporate,BRK005,NASDAQ,2024-03-16T09:33:49Z,Dividend reinvestment,Very High
TXN000378,ACC-809790,CUST_97,2024-06-17,,WFC,Wells Fargo & Co,DIVIDEND,174,2.031432,353.47,USD,34.52,0.00,Individual,BRK003,NYSE,2024-06-17T09:05:29Z,Quarterly rebalancing,High
TXN000379,ACC-382400,CUST_609,2024-12-02,04-Dec-2024,SPY,SPDR S&P 500 ETF,BUY,376,$494.74,$-186022.93,USD,50.34,0.00,Joint,BRK002,NYSE ARCA,2024-12-02T09:51:41Z,,Very High
TXN000380,ACC-731548,CUST_391,2024.02.17,02/19/2024,BAC,Bank of America Corp,BUY,107,$25.4102,-2718.90,USD,13.15,0.00,Trust,BRK003,NYSE,2024-02-17T10:19:31Z,Year-end selling,High
TXN000381,ACC-200780,CUST_853,07-07-2024,09-07-2024,EUR/USD,Euro US Dollar,SELL,231810,1.09,252537.06,USD,9.51,2657.58,Retirement,BRK004,FOREX,2024-07-07T10:02:32Z,Portfolio diversification,low
TXN000382,ACC-619383,CUST_540,11/18/2024,20-11-2024,WFC,Wells Fargo & Co,SELL,66,37.972131,"2,506.16",USD,39.22,21.88,Trust,BRK003,NYSE,2024-11-18T10:58:02Z,Risk management,Low
TXN000383,ACC-199074,CUST_476,04-12-2024,2024-12-07,QQQ,Invesco QQQ Trust,SELL,339,361.393549,"$122,512.41",USD,28.14,2161.57,Individual,BRK001,NASDAQ,2024-12-04T13:20:37Z,Estate planning,low
TXN000384,ACC-457915,CUST_990,04-05-2024,08-04-2024,META,Meta Platforms Inc,BUY,55,330.742369,"-18,190.83",USD,26.69,0.00,Individual,BRK001,NASDAQ,2024-04-05T10:00:10Z,Portfolio diversification,low
TXN000385,ACC-952631,CUST_998,11-Nov-2024,,JNJ,Johnson & Johnson,DIVIDEND,741,2.04,$1508.30,USD,20.13,0.00,Retirement,BRK002,NYSE,2024-11-11T12:07:52Z,,Low
TXN000386,ACC-780130,CUST_149,11-28-2024,,BTC-USD,Bitcoin USD,DIVIDEND,601,1.04,622.32,USD,20.05,0.00,Trust,BRK002,CRYPTO,2024-11-28T15:01:07Z,,HIGH
TXN000387,ACC-594392,CUST_21,08-18-2024,2024-08-20,NVDA,NVIDIA Corporation,SELL,53,566.925,"30,047.03",USD,36.52,591.70,Trust,BRK005,NASDAQ,2024-08-18T13:02:31Z,Risk management,Med
TXN000388,ACC-343170,CUST_732,2024-02-01,,BTC-USD,Bitcoin USD,DIVIDEND,115,$1.4125,162.43,USD,37.42,0.00,Trust,BRK001,CRYPTO,2024-02-01T14:28:44Z,Rebalancing,HIGH
TXN000389,ACC-559392,CUST_238,09-16-2024,,GLD,SPDR Gold Shares,DIVIDEND,666,$4.2819,"2,851.76",USD,40.76,0.00,Trust,BRK002,NYSE ARCA,2024-09-16T15:26:53Z,Quarterly rebalancing,
TXN000390,ACC-985555,CUST_166,11-14-2024,,WFC,Wells Fargo & Co,DIVIDEND,733,$2.4662,1807.70,USD,13.66,0.00,Retirement,BRK005,NYSE,2024-11-14T10:50:26Z,Portfolio diversification,HIGH
TXN000391,ACC-149334,CUST_19,02-07-2024,,QQQ,Invesco QQQ Trust,DIVIDEND,897,4.31,"3,867.29",USD,30.17,0.00,Individual,BRK003,NASDAQ,2024-07-02T10:39:14Z,,low
TXN000392,ACC-456855,CUST_804,2024-06-30,,KO,The Coca-Cola Company,DIVIDEND,204,$4.28,$873.47,USD,48.68,0.00,Joint,BRK001,NYSE,2024-06-30T16:51:29Z,Estate planning,Low
TXN000393,ACC-739270,CUST_801,2024-02-22,02-23-2024,GBP/USD,British Pound US Dollar,BUY,92330,1.34,$-123823.63,USD,41.42,0.00,Trust,BRK005,FOREX,2024-02-22T10:09:41Z,,HIGH
TXN000394,ACC-560438,CUST_993,2024-07-31,03/08/2024,JPM,JPMorgan Chase & Co,SELL,191,143.409354,"27,391.19",USD,40.76,395.57,Retirement,BRK002,NYSE,2024-07-31T15:50:14Z,,Med
TXN000395,ACC-529191,CUST_920,22-Aug-2024,08/23/2024,AAPL,Apple Inc,SELL,162,$154.2389,"24,986.70",USD,25.08,287.62,Trust,BRK001,NASDAQ,2024-08-22T09:40:45Z,Risk management,High
TXN000396,ACC-521530,CUST_908,14-12-2024,,PFE,Pfizer Inc,DIVIDEND,402,0.139,55.77,USD,18.99,0.00,Joint,BRK005,NYSE,2024-12-14T15:28:41Z,,High
TXN000397,ACC-951266,CUST_801,2024.11.28,2024-11-29,KO,The Coca-Cola Company,BUY,200,60.374,"$-12,074.87",USD,41.25,0.00,Retirement,BRK005,NYSE,2024-11-28T13:13:05Z,Dollar cost averaging,Med
TXN000398,ACC-267800,CUST_24,15-01-2024,01/18/2024,JPM,JPMorgan Chase & Co,SELL,431,$169.2794,72959.44,USD,23.65,752.73,Individual,BRK001,NYSE,2024-01-15T13:36:47Z,,HIGH
TXN000399,ACC-944510,CUST_764,10-24-2024,27/10/2024,QQQ,Invesco QQQ Trust,SELL,267,$421.44,$112523.17,USD,41.88,1434.31,Retirement,BRK003,NASDAQ,2024-10-24T10:09:45Z,Dividend reinvestment,HIGH
TXN000400,ACC-165214,CUST_436,07 March 2024,,NVDA,NVIDIA Corporation,SELL,207,738.411221,152851.12,USD,34.41,1669.40,Corporate,BRK005,NASDAQ,2024-03-07T15:28:44Z,Portfolio diversification,HIGH
TXN000401,ACC-251357,CUST_518,06 March 2024,03/09/2024,JNJ,Johnson & Johnson,SELL,234,163.889,38350.12,USD,28.67,734.83,Corporate,BRK001,NYSE,2024-03-06T10:07:23Z,Long-term investment,low
TXN000402,ACC-223461,CUST_381,05-Jun-2024,06/06/2024,WFC,Wells Fargo & Co,SELL,216,$50.68,"10,945.98",USD,7.43,200.70,Retirement,BRK002,NYSE,2024-06-05T09:07:35Z,,HIGH
TXN000403,ACC-604550,CUST_587,07 June 2024,09/06/2024,CRM,Salesforce Inc,SELL,259,260.956,$67587.63,USD,36.82,1014.38,Retirement,BRK003,NYSE,2024-06-07T15:24:14Z,Tax loss harvesting,Medium
TXN000404,ACC-803011,CUST_912,14-08-2024,2024-08-17,XOM,Exxon Mobil Corp,BUY,408,$109.30,-44594.35,USD,43.58,0.00,Corporate,BRK005,NYSE,2024-08-14T10:12:39Z,Estate planning,Medium
TXN000405,ACC-627054,CUST_919,01/10/2024,,CVX,Chevron Corporation,DIVIDEND,69,$1.45,$99.86,USD,15.29,0.00,Joint,BRK004,NYSE,2024-01-10T14:25:37Z,,Medium
TXN000406,ACC-535092,CUST_25,27-Sep-2024,28/09/2024,VTI,Vanguard Total Stock Market ETF,SELL,94,$214.27,"$20,141.15",USD,17.78,0.00,Corporate,BRK004,NYSE ARCA,2024-09-27T09:39:20Z,,High
TXN000407,ACC-435587,CUST_146,30-Jul-2024,2024-07-31,BAC,Bank of America Corp,SELL,386,$29.05,"11,213.76",USD,34.85,141.62,Joint,BRK004,NYSE,2024-07-30T13:03:20Z,Dividend reinvestment,Medium
TXN000408,ACC-130310,CUST_418,11-20-2024,11/23/2024,ORCL,Oracle Corporation,BUY,285,107.39,"$-30,606.00",USD,37.58,0.00,Retirement,BRK003,NYSE,2024-11-20T16:05:54Z,Profit taking,low
TXN000409,ACC-276358,CUST_801,2024.05.05,,ORCL,Oracle Corporation,DIVIDEND,51,4.082,$208.18,USD,53.06,0.00,Joint,BRK003,NYSE,2024-05-05T09:03:59Z,Dollar cost averaging,High
TXN000410,ACC-498619,CUST_360,11-19-2024,,GLD,SPDR Gold Shares,DIVIDEND,215,3.721996,800.23,USD,33.15,0.00,Corporate,BRK001,NYSE ARCA,2024-11-19T10:53:08Z,Dollar cost averaging,low
TXN000411,ACC-941017,CUST_326,15-Dec-2024,18 December 2024,XOM,Exxon Mobil Corp,SELL,340,101.825328,$34620.61,USD,54.15,411.88,Joint,BRK003,NYSE,2024-12-15T11:41:59Z,,Low
TXN000412,ACC-110043,CUST_689,2024.03.29,,BOND_10Y,US Treasury 10 Year,DIVIDEND,830,2.024676,"$1,680.48",USD,9.06,0.00,Individual,BRK005,BOND,2024-03-29T16:43:07Z,,Low
TXN000413,ACC-979908,CUST_787,2024-12-22,23 December 2024,TSLA,Tesla Inc,SELL,381,181.123596,"$69,008.09",USD,5.99,1298.80,Corporate,BRK002,NASDAQ,2024-12-22T13:51:45Z,,Medium
TXN000414,ACC-138583,CUST_288,09-09-2024,2024.09.12,AAPL,Apple Inc,BUY,143,155.547,-22243.27,USD,33.46,,Trust,BRK002,NASDAQ,2024-09-09T12:42:47Z,Quarterly rebalancing,Med
TXN000415,ACC-234476,CUST_764,03/02/2024,,BAC,Bank of America Corp,DIVIDEND,952,2.663092,$2535.26,USD,44.11,0.00,Retirement,BRK001,NYSE,2024-02-03T13:43:35Z,Long-term investment,Med
TXN000416,ACC-438689,CUST_443,27-07-2024,,TSLA,Tesla Inc,DIVIDEND,557,1.87,"$1,042.27",USD,42.95,,Retirement,BRK001,NASDAQ,2024-07-27T15:34:28Z,Dividend reinvestment,
TXN000417,ACC-699596,CUST_828,01-13-2024,01-14-2024,JNJ,Johnson & Johnson,SELL,160,$153.29,"$24,526.34",USD,8.14,132.89,Trust,BRK001,NYSE,2024-01-13T13:15:06Z,Tax loss harvesting,MEDIUM
TXN000418,ACC-644918,CUST_814,05/01/2024,,KO,The Coca-Cola Company,DIVIDEND,832,$0.57,473.23,USD,27.32,,Individual,BRK001,NYSE,2024-05-01T09:24:20Z,Year-end selling,Low
TXN000419,ACC-941363,CUST_453,29-01-2024,,SLV,iShares Silver Trust,DIVIDEND,154,3.420,$526.69,USD,32.96,0.00,Corporate,BRK004,NYSE ARCA,2024-01-29T10:39:48Z,,low
TXN000420,ACC-586758,CUST_815,08/07/2024,,SPY,SPDR S&P 500 ETF,DIVIDEND,851,0.23,193.40,USD,30.86,0.00,Joint,BRK002,NYSE ARCA,2024-08-07T10:00:38Z,Market timing,Medium
TXN000421,ACC-368735,CUST_364,03 August 2024,,PFE,Pfizer Inc,DIVIDEND,298,0.77,230.83,USD,7.20,0.00,Retirement,BRK003,NYSE,2024-08-03T14:19:37Z,Estate planning,low
TXN000422,ACC-732636,CUST_352,29-May-2024,,AAPL,Apple Inc,DIVIDEND,744,$0.81,$601.56,USD,16.87,0.00,Joint,BRK001,NASDAQ,2024-05-29T14:12:12Z,Profit taking,low
TXN000423,ACC-598833,CUST_712,20 December 2024,,SLV,iShares Silver Trust,DIVIDEND,642,2.873875,1845.03,USD,21.78,0.00,Corporate,BRK004,NYSE ARCA,2024-12-20T11:06:29Z,Long-term investment,MEDIUM
TXN000424,ACC-769795,CUST_229,12-20-2024,,ETH-USD,Ethereum USD,DIVIDEND,542,$3.70,$2005.11,USD,52.63,0.00,Corporate,BRK004,CRYPTO,2024-12-20T15:11:52Z,Tax loss harvesting,Very High
TXN000425,ACC-681636,CUST_118,13-03-2024,2024-03-15,ETH-USD,Ethereum USD,BUY,1.99203,3950.62,$-7869.75,USD,19.21,0.00,Retirement,BRK003,CRYPTO,2024-03-13T14:54:35Z,,High
TXN000426,ACC-374505,CUST_933,2024-02-21,,DIS,The Walt Disney Company,DIVIDEND,720,3.958,"2,850.00",USD,10.55,0.00,Retirement,BRK003,NYSE,2024-02-21T12:23:51Z,Rebalancing,HIGH
TXN000427,ACC-168553,CUST_122,14/03/2024,16-Mar-2024,PEP,PepsiCo Inc,BUY,220,$166.3590,-36598.99,USD,53.85,0.00,Retirement,BRK001,NASDAQ,2024-03-14T13:50:09Z,Long-term investment,Very High
TXN000428,ACC-712454,CUST_908,09-07-2024,09/10/2024,PFE,Pfizer Inc,BUY,199,26.674335,"-5,308.19",USD,42.57,0.00,Joint,BRK003,NYSE,2024-09-07T16:11:20Z,Risk management,HIGH
TXN000429,ACC-709418,CUST_411,2024-11-22,11-24-2024,NVDA,NVIDIA Corporation,BUY,157,$597.95,"$-93,878.15",USD,26.25,0.00,Trust,BRK005,NASDAQ,2024-11-22T14:16:35Z,,High
TXN000430,ACC-468653,CUST_236,2024-10-25,,ETH-USD,Ethereum USD,DIVIDEND,486,2.31,"$1,122.97",USD,26.63,0.00,Corporate,BRK004,CRYPTO,2024-10-25T13:24:01Z,,MEDIUM
TXN000431,ACC-476536,CUST_924,12-02-2024,,DIS,The Walt Disney Company,DIVIDEND,709,0.48,$342.43,USD,18.82,0.00,Retirement,BRK001,NYSE,2024-02-12T10:23:02Z,Tax loss harvesting,Medium
TXN000432,ACC-881410,CUST_836,15-12-2024,,NVDA,NVIDIA Corporation,DIVIDEND,191,4.992185,$953.51,USD,42.62,0.00,Joint,BRK003,NASDAQ,2024-12-15T13:18:52Z,Dividend reinvestment,Low
TXN000433,ACC-637549,CUST_780,2024.03.17,18 March 2024,JPM,JPMorgan Chase & Co,BUY,301,149.348928,-44954.03,USD,44.30,0.00,Trust,BRK004,NYSE,2024-03-17T10:20:54Z,,MEDIUM
TXN000434,ACC-994376,CUST_572,16-Jan-2024,,AMZN,Amazon.com Inc,DIVIDEND,362,4.722,"$1,709.52",USD,5.48,0.00,Corporate,BRK003,NASDAQ,2024-01-16T15:27:43Z,Estate planning,Very High
TXN000435,ACC-124368,CUST_582,17/01/2024,2024.01.20,AMZN,Amazon.com Inc,SELL,105,$179.2069,$18816.72,USD,52.43,0.00,Trust,BRK002,NASDAQ,2024-01-17T10:21:36Z,Quarterly rebalancing,HIGH
TXN000436,ACC-807668,CUST_567,2024-03-31,,DIS,The Walt Disney Company,DIVIDEND,77,$1.01,$78.14,USD,8.47,0.00,Trust,BRK003,NYSE,2024-03-31T12:18:42Z,Portfolio diversification,Very High
TXN000437,ACC-280172,CUST_335,2024.07.29,31 July 2024,META,Meta Platforms Inc,BUY,200,311.47,"$-62,294.28",USD,52.75,0.00,Retirement,BRK002,NASDAQ,2024-07-29T13:27:52Z,Portfolio diversification,Very High
TXN000438,ACC-626883,CUST_734,16 December 2024,,BAC,Bank of America Corp,BUY,33,27.85384,$-919.18,USD,46.23,0.00,Joint,BRK002,NYSE,2024-12-16T14:58:36Z,Portfolio diversification,Med
TXN000439,ACC-401897,CUST_662,21-Aug-2024,,JNJ,Johnson & Johnson,DIVIDEND,450,3.103835,1396.73,USD,45.50,0.00,Retirement,BRK004,NYSE,2024-08-21T11:57:39Z,Portfolio diversification,Very High
TXN000440,ACC-200174,CUST_403,2024-12-23,26-12-2024,JPM,JPMorgan Chase & Co,BUY,35,$166.6663,"-5,833.32",USD,39.90,0.00,Retirement,BRK004,NYSE,2024-12-23T10:23:04Z,Risk management,low
TXN000441,ACC-365045,CUST_213,2024-09-16,,ETH-USD,Ethereum USD,BUY,7.497612,3388.97,"$-25,409.19",USD,24.06,0.00,Trust,BRK002,CRYPTO,2024-09-16T09:00:16Z,,low
TXN000442,ACC-586796,CUST_497,08/24/2024,,MSFT,Microsoft Corporation,DIVIDEND,780,$4.76,"3,708.97",USD,12.01,0.00,Corporate,BRK002,NASDAQ,2024-08-24T09:38:06Z,,High
TXN000443,ACC-804005,CUST_782,06-01-2024,2024-01-07,AMZN,Amazon.com Inc,SELL,273,175.707508,47968.15,USD,15.81,841.72,Joint,BRK001,NASDAQ,2024-01-06T13:28:03Z,Long-term investment,low
TXN000444,ACC-361829,CUST_384,05-02-2024,03-May-2024,MSFT,Microsoft Corporation,BUY,349,$398.4632,"$-139,063.65",USD,38.45,0.00,Retirement,BRK001,NASDAQ,2024-05-02T11:02:26Z,,High
TXN000445,ACC-298754,CUST_640,2024.04.16,17-Apr-2024,BTC-USD,Bitcoin USD,BUY,0.150931,46317.874,"$-6,990.79",USD,37.70,,Individual,BRK004,CRYPTO,2024-04-16T16:14:04Z,Dollar cost averaging,Very High
TXN000446,ACC-329177,CUST_421,03 June 2024,,TSLA,Tesla Inc,DIVIDEND,994,4.27,"$4,241.67",USD,13.57,0.00,Individual,BRK005,NASDAQ,2024-06-03T15:43:59Z,Year-end selling,MEDIUM
TXN000447,ACC-898717,CUST_906,18-Dec-2024,,NFLX,Netflix Inc,DIVIDEND,393,0.19,$73.29,USD,50.61,0.00,Trust,BRK004,NASDAQ,2024-12-18T12:32:37Z,Long-term investment,Med
TXN000448,ACC-230082,CUST_317,2024.05.01,02/05/2024,KO,The Coca-Cola Company,BUY,152,$58.7452,-8929.28,USD,15.10,0.00,Trust,BRK002,NYSE,2024-05-01T12:59:46Z,Portfolio diversification,Low
TXN000449,ACC-774865,CUST_806,2024.01.21,22-Jan-2024,XOM,Exxon Mobil Corp,SELL,106,103.56821,$10978.23,USD,31.97,164.40,Retirement,BRK002,NYSE,2024-01-21T14:11:28Z,Short-term trade,low
TXN000450,ACC-301814,CUST_54,20/11/2024,11-23-2024,NVDA,NVIDIA Corporation,BUY,41,518.16,"$-21,244.36",USD,26.31,0.00,Trust,BRK003,NASDAQ,2024-11-20T12:15:27Z,,High
TXN000451,ACC-570046,CUST_991,11-21-2024,2024.11.23,BAC,Bank of America Corp,SELL,242,$32.5543,7878.15,USD,27.07,126.24,Retirement,BRK004,NYSE,2024-11-21T15:27:54Z,,Low
TXN000452,ACC-679707,CUST_745,30-03-2024,2024.04.01,VTI,Vanguard Total Stock Market ETF,SELL,247,228.107105,"56,342.45",USD,8.60,678.30,Retirement,BRK002,NYSE ARCA,2024-03-30T09:55:32Z,Tax loss harvesting,Low
TXN000453,ACC-536019,CUST_963,21-Jul-2024,07/24/2024,VTI,Vanguard Total Stock Market ETF,SELL,20,220.439,"4,408.79",USD,54.62,83.69,Retirement,BRK002,NYSE ARCA,2024-07-21T13:49:58Z,Tax loss harvesting,low
TXN000454,ACC-765824,CUST_706,2024-07-07,07-10-2024,XOM,Exxon Mobil Corp,SELL,18,101.059,1819.06,USD,51.07,28.37,Individual,BRK002,NYSE,2024-07-07T16:43:09Z,,
TXN000455,ACC-112936,CUST_120,2024.02.17,,VTI,Vanguard Total Stock Market ETF,DIVIDEND,972,0.493707,$479.88,USD,50.50,0.00,Trust,BRK002,NYSE ARCA,2024-02-17T13:44:19Z,Risk management,low
TXN000456,ACC-889013,CUST_898,02/15/2024,,XOM,Exxon Mobil Corp,DIVIDEND,402,$4.09,"1,644.07",USD,18.45,0.00,Retirement,BRK004,NYSE,2024-02-15T09:10:52Z,Short-term trade,
TXN000457,ACC-786315,CUST_296,08/08/2024,08-09-2024,META,Meta Platforms Inc,SELL,258,272.970689,"70,426.44",USD,52.42,1212.43,Retirement,BRK002,NASDAQ,2024-08-08T11:51:48Z,,Low
TXN000458,ACC-757286,CUST_935,11/15/2024,,NFLX,Netflix Inc,DIVIDEND,350,$0.52,$181.99,USD,11.23,0.00,Individual,BRK003,NASDAQ,2024-11-15T12:30:31Z,Short-term trade,Low
TXN000459,ACC-107577,CUST_682,2024-10-25,2024.10.26,TSLA,Tesla Inc,BUY,493,$252.3582,-124412.59,USD,43.07,0.00,Trust,BRK004,NASDAQ,2024-10-25T15:21:23Z,Tax loss harvesting,MEDIUM
TXN000460,ACC-797385,CUST_409,2024-07-12,13 July 2024,QQQ,Invesco QQQ Trust,SELL,206,437.054151,"90,033.16",USD,41.26,637.70,Joint,BRK001,NASDAQ,2024-07-12T13:44:48Z,Tax loss harvesting,Med
TXN000461,ACC-639926,CUST_424,12-04-2024,,AAPL,Apple Inc,DIVIDEND,882,$1.68,"$1,480.61",USD,36.69,0.00,Individual,BRK003,NASDAQ,2024-12-04T12:38:31Z,Market timing,HIGH
TXN000462,ACC-599250,CUST_675,12/24/2024,25/12/2024,PFE,Pfizer Inc,SELL,449,33.698587,15130.67,USD,33.59,190.19,Retirement,BRK004,NYSE,2024-12-24T13:53:43Z,,Medium
TXN000463,ACC-567965,CUST_978,29 February 2024,,CVX,Chevron Corporation,DIVIDEND,266,$0.9351,248.74,USD,52.21,0.00,Individual,BRK001,NYSE,2024-02-29T09:10:59Z,Dividend reinvestment,low
TXN000464,ACC-798281,CUST_488,12/09/2024,12 December 2024,CVX,Chevron Corporation,BUY,355,142.713253,"-50,663.20",USD,21.64,0.00,Retirement,BRK005,NYSE,2024-12-09T14:24:58Z,Year-end selling,Medium
TXN000465,ACC-334410,CUST_266,29-02-2024,03-03-2024,MSFT,Microsoft Corporation,BUY,60,389.35413,"-23,361.25",USD,33.64,0.00,Retirement,BRK003,NASDAQ,2024-02-29T09:19:03Z,Profit taking,low
TXN000466,ACC-482755,CUST_817,13/12/2024,,GBP/USD,British Pound US Dollar,DIVIDEND,277,0.62,$172.37,USD,5.46,0.00,Trust,BRK003,FOREX,2024-12-13T13:53:14Z,Portfolio diversification,High
TXN000467,ACC-797670,CUST_870,2024-12-25,12/28/2024,SLV,iShares Silver Trust,SELL,435,22.73,9889.52,USD,40.33,172.38,Trust,BRK003,NYSE ARCA,2024-12-25T09:51:21Z,,low
TXN000468,ACC-834430,CUST_754,27/01/2024,29/01/2024,NFLX,Netflix Inc,SELL,281,498.66,"140,123.31",USD,24.61,1695.68,Corporate,BRK004,NASDAQ,2024-01-27T10:33:46Z,,low
TXN000469,ACC-202046,CUST_135,2024-06-14,,NFLX,Netflix Inc,DIVIDEND,720,$0.90,$649.51,USD,11.88,0.00,Trust,BRK003,NASDAQ,2024-06-14T12:13:51Z,Year-end selling,High
TXN000470,ACC-703646,CUST_105,13/12/2024,2024-12-14,VTI,Vanguard Total Stock Market ETF,SELL,499,$204.80,102196.39,USD,28.69,690.87,Joint,BRK003,NYSE ARCA,2024-12-13T11:40:46Z,Long-term investment,low
TXN000471,ACC-515912,CUST_501,03/06/2024,,XOM,Exxon Mobil Corp,DIVIDEND,758,$4.96,$3757.18,USD,38.54,,Individual,BRK004,NYSE,2024-06-03T13:40:41Z,Long-term investment,low
TXN000472,ACC-612982,CUST_657,12-08-2024,,AAPL,Apple Inc,DIVIDEND,636,2.450,1557.91,USD,39.69,,Individual,BRK005,NASDAQ,2024-12-08T15:30:41Z,Dollar cost averaging,High
TXN000473,ACC-166582,CUST_731,02/10/2024,,VTI,Vanguard Total Stock Market ETF,DIVIDEND,619,$4.11,2541.35,USD,44.17,0.00,Joint,BRK004,NYSE ARCA,2024-10-02T10:48:48Z,,Medium
TXN000474,ACC-828986,CUST_185,03 January 2024,01-04-2024,PEP,PepsiCo Inc,SELL,45,$173.05,7787.38,USD,33.12,43.03,Individual,BRK005,NASDAQ,2024-01-03T14:34:10Z,Quarterly rebalancing,
TXN000475,ACC-415201,CUST_48,22-09-2024,,CVX,Chevron Corporation,DIVIDEND,640,2.50,$1602.03,USD,20.65,0.00,Corporate,BRK005,NYSE,2024-09-22T12:44:06Z,Long-term investment,Med
TXN000476,ACC-414267,CUST_877,20/04/2024,,SLV,iShares Silver Trust,DIVIDEND,417,1.459239,608.50,USD,41.46,,Trust,BRK001,NYSE ARCA,2024-04-20T13:16:24Z,Rebalancing,Med
TXN000477,ACC-366526,CUST_693,05/08/2024,,BOND_10Y,US Treasury 10 Year,BUY,325,102.326749,"-33,256.19",USD,39.84,,Retirement,BRK003,BOND,2024-08-05T11:26:52Z,,Med
TXN000478,ACC-732928,CUST_254,09-02-2024,,TSLA,Tesla Inc,DIVIDEND,611,$2.09,$1278.96,USD,21.47,0.00,Individual,BRK003,NASDAQ,2024-02-09T13:09:55Z,Dollar cost averaging,MEDIUM
TXN000479,ACC-333020,CUST_388,02/23/2024,,META,Meta Platforms Inc,DIVIDEND,363,2.99,"$1,083.65",USD,45.34,0.00,Individual,BRK005,NASDAQ,2024-02-23T13:35:17Z,Long-term investment,MEDIUM
TXN000480,ACC-508486,CUST_186,2024.06.25,,EUR/USD,Euro US Dollar,DIVIDEND,59,3.46,204.41,USD,40.66,0.00,Retirement,BRK002,FOREX,2024-06-25T13:03:58Z,Tax loss harvesting,low
TXN000481,ACC-291999,CUST_450,30 June 2024,07-02-2024,GBP/USD,British Pound US Dollar,SELL,459797,$1.2805,"588,778.68",USD,9.35,9749.40,Individual,BRK001,FOREX,2024-06-30T12:05:10Z,Short-term trade,Medium
TXN000482,ACC-947613,CUST_896,2024.01.06,,CVX,Chevron Corporation,DIVIDEND,189,$2.45,463.11,USD,30.75,0.00,Joint,BRK001,NYSE,2024-01-06T09:39:12Z,Year-end selling,low
TXN000483,ACC-886083,CUST_354,2024-05-05,05-08-2024,SLV,iShares Silver Trust,SELL,188,21.75,$4088.65,USD,46.97,78.86,Trust,BRK004,NYSE ARCA,2024-05-05T11:23:07Z,Quarterly rebalancing,low
TXN000484,ACC-404154,CUST_307,04-09-2024,,BAC,Bank of America Corp,BUY,202,$37.6235,$-7599.95,USD,15.87,0.00,Corporate,BRK005,NYSE,2024-09-04T16:57:39Z,Long-term investment,Low
TXN000485,ACC-444511,CUST_306,06/30/2024,2024.07.01,AAPL,Apple Inc,SELL,52,167.73,"8,721.78",USD,26.54,112.83,Retirement,BRK004,NASDAQ,2024-06-30T16:00:09Z,Dollar cost averaging,Medium
TXN000486,ACC-514563,CUST_384,02-Jun-2024,06/04/2024,BTC-USD,Bitcoin USD,BUY,6.56314,$69627.92,-456977.82,USD,26.97,0.00,Retirement,BRK003,CRYPTO,2024-06-02T09:22:56Z,Profit taking,low
TXN000487,ACC-240173,CUST_405,03-Aug-2024,04 August 2024,CRM,Salesforce Inc,BUY,137,276.776,"-37,918.30",USD,10.94,0.00,Trust,BRK005,NYSE,2024-08-03T11:20:48Z,Dividend reinvestment,HIGH
TXN000488,ACC-213119,CUST_812,11/01/2024,01-14-2024,AMZN,Amazon.com Inc,SELL,425,142.082,60384.68,USD,22.11,969.87,Trust,BRK004,NASDAQ,2024-01-11T13:31:05Z,Profit taking,
TXN000489,ACC-864672,CUST_524,04-05-2024,04-08-2024,BAC,Bank of America Corp,BUY,220,38.33,$-8431.85,USD,14.92,0.00,Individual,BRK005,NYSE,2024-04-05T12:54:37Z,Rebalancing,High
TXN000490,ACC-140230,CUST_281,08/04/2024,2024-04-09,BTC-USD,Bitcoin USD,BUY,5.250187,$48312.34,"$-253,648.83",USD,40.01,0.00,Retirement,BRK002,CRYPTO,2024-04-08T15:30:03Z,Quarterly rebalancing,MEDIUM
TXN000491,ACC-481237,CUST_288,2024.06.28,2024-06-29,JPM,JPMorgan Chase & Co,SELL,339,$140.02,$47467.27,USD,42.24,573.45,Joint,BRK001,NYSE,2024-06-28T11:16:31Z,Dollar cost averaging,low
TXN000492,ACC-801442,CUST_14,15/12/2024,17-Dec-2024,SPY,SPDR S&P 500 ETF,SELL,142,423.83,60183.18,USD,15.50,1101.83,Retirement,BRK005,NYSE ARCA,2024-12-15T09:37:58Z,,Medium
TXN000493,ACC-838889,CUST_457,02/20/2024,,BOND_10Y,US Treasury 10 Year,DIVIDEND,792,2.424,"$1,919.47",USD,43.05,0.00,Joint,BRK002,BOND,2024-02-20T11:12:26Z,Dollar cost averaging,Low
TXN000494,ACC-570267,CUST_645,2024.03.01,2024-03-04,MSFT,Microsoft Corporation,SELL,141,$320.03,45124.54,USD,39.84,256.38,Joint,BRK001,NASDAQ,2024-03-01T15:31:43Z,Risk management,Very High
TXN000495,ACC-559008,CUST_769,2024.09.17,09-19-2024,BOND_10Y,US Treasury 10 Year,SELL,82,$96.8407,$7940.93,USD,33.59,40.76,Joint,BRK004,BOND,2024-09-17T13:19:54Z,,Med
TXN000496,ACC-279420,CUST_230,01-24-2024,26/01/2024,WFC,Wells Fargo & Co,BUY,405,$40.4087,"$-16,365.52",USD,7.58,,Retirement,BRK002,NYSE,2024-01-24T10:00:41Z,Market timing,Med
TXN000497,ACC-839730,CUST_906,08-10-2024,11-10-2024,PFE,Pfizer Inc,BUY,30,28.246,$-847.39,USD,36.30,0.00,Individual,BRK003,NYSE,2024-10-08T13:11:16Z,Risk management,Very High
TXN000498,ACC-821541,CUST_392,30-11-2024,,NFLX,Netflix Inc,DIVIDEND,614,1.110179,$681.65,USD,27.11,0.00,Corporate,BRK003,NASDAQ,2024-11-30T15:09:28Z,,Very High
TXN000499,ACC-602275,CUST_96,10/09/2024,09-11-2024,ETH-USD,Ethereum USD,BUY,9.433607,3139.316,-29615.07,USD,14.02,,Corporate,BRK001,CRYPTO,2024-09-10T11:56:11Z,Quarterly rebalancing,
TXN000500,ACC-175548,CUST_437,05 May 2024,,ORCL,Oracle Corporation,DIVIDEND,152,$3.65,$554.66,USD,11.86,0.00,Individual,BRK005,NYSE,2024-05-05T15:24:01Z,,Medium
TXN000501,ACC-907526,CUST_86,17/05/2024,,XOM,Exxon Mobil Corp,DIVIDEND,59,4.79,$282.75,USD,10.32,0.00,Corporate,BRK001,NYSE,2024-05-17T11:30:48Z,Portfolio diversification,Very High
TXN000502,ACC-262018,CUST_250,29-01-2024,,XOM,Exxon Mobil Corp,DIVIDEND,894,0.32,284.45,USD,32.23,0.00,Individual,BRK005,NYSE,2024-01-29T11:00:58Z,,low
TXN000503,ACC-470472,CUST_672,05-26-2024,,ORCL,Oracle Corporation,DIVIDEND,955,$3.6028,$3440.65,USD,50.08,0.00,Trust,BRK002,NYSE,2024-05-26T12:06:18Z,Market timing,Medium
TXN000504,ACC-188923,CUST_918,23/01/2024,26/01/2024,META,Meta Platforms Inc,SELL,77,$301.91,$23247.45,USD,49.66,334.10,Corporate,BRK003,NASDAQ,2024-01-23T13:58:31Z,Dollar cost averaging,Medium
TXN000505,ACC-255863,CUST_797,01/12/2024,04 December 2024,SPY,SPDR S&P 500 ETF,BUY,58,$481.4650,"-27,924.97",USD,33.89,0.00,Corporate,BRK002,NYSE ARCA,2024-12-01T14:08:11Z,Tax loss harvesting,Medium
TXN000506,ACC-827104,CUST_997,30-Jul-2024,,AMZN,Amazon.com Inc,DIVIDEND,442,2.151,950.93,USD,29.86,0.00,Joint,BRK004,NASDAQ,2024-07-30T12:24:05Z,Dividend reinvestment,Med
TXN000507,ACC-346617,CUST_371,01-02-2024,04/01/2024,NFLX,Netflix Inc,BUY,31,488.14,-15132.20,USD,50.57,0.00,Corporate,BRK002,NASDAQ,2024-01-02T16:09:53Z,Dividend reinvestment,
TXN000508,ACC-158579,CUST_765,03/11/2024,,JNJ,Johnson & Johnson,DIVIDEND,800,$0.23,183.28,USD,53.25,0.00,Corporate,BRK001,NYSE,2024-03-11T10:30:53Z,Rebalancing,Medium
TXN000509,ACC-182830,CUST_251,2024-02-09,10 February 2024,GLD,SPDR Gold Shares,SELL,384,$209.74,80541.05,USD,31.37,970.74,Corporate,BRK004,NYSE ARCA,2024-02-09T13:07:09Z,,Low
TXN000510,ACC-627743,CUST_165,2024.01.06,08-01-2024,DIS,The Walt Disney Company,SELL,257,112.575,$28931.65,USD,20.30,548.88,Corporate,BRK001,NYSE,2024-01-06T15:08:47Z,,Med
TXN000511,ACC-329540,CUST_402,04/04/2024,,DIS,The Walt Disney Company,DIVIDEND,370,$3.30,$1220.35,USD,25.25,,Trust,BRK002,NYSE,2024-04-04T14:41:27Z,,Low
TXN000512,ACC-732490,CUST_798,2024-06-20,06/21/2024,JPM,JPMorgan Chase & Co,SELL,6,148.476398,$890.86,USD,42.83,11.83,Individual,BRK002,NYSE,2024-06-20T10:36:36Z,,
TXN000513,ACC-150382,CUST_323,17-02-2024,02-19-2024,AAPL,Apple Inc,SELL,201,165.724,"33,310.45",USD,41.28,517.64,Individual,BRK003,NASDAQ,2024-02-17T10:32:51Z,Long-term investment,low
TXN000514,ACC-600121,CUST_601,20-01-2024,01/21/2024,META,Meta Platforms Inc,BUY,119,$342.9227,"$-40,807.81",USD,49.22,0.00,Retirement,BRK002,NASDAQ,2024-01-20T14:28:50Z,,Med
TXN000515,ACC-551832,CUST_41,2024.12.30,01/02/2025,JPM,JPMorgan Chase & Co,BUY,291,$178.32,"-51,891.30",USD,36.39,,Trust,BRK001,NYSE,2024-12-30T11:49:55Z,,Low
TXN000516,ACC-428957,CUST_174,31/05/2024,06/02/2024,MSFT,Microsoft Corporation,SELL,364,$308.5361,"112,307.13",USD,43.60,1358.79,Corporate,BRK004,NASDAQ,2024-05-31T10:36:31Z,,High
TXN000517,ACC-528902,CUST_878,13/11/2024,16-Nov-2024,ETH-USD,Ethereum USD,SELL,6.822327,$2747.37,"$18,743.43",USD,30.30,339.88,Individual,BRK005,CRYPTO,2024-11-13T12:44:52Z,Rebalancing,Low
TXN000518,ACC-494077,CUST_163,2024.10.18,10/20/2024,NFLX,Netflix Inc,BUY,240,402.340694,-96561.77,USD,37.12,0.00,Trust,BRK001,NASDAQ,2024-10-18T11:46:06Z,Dividend reinvestment,Medium
TXN000519,ACC-167603,CUST_325,24 June 2024,,NVDA,NVIDIA Corporation,DIVIDEND,167,1.464,244.49,USD,6.91,,Retirement,BRK004,NASDAQ,2024-06-24T12:20:36Z,,High
TXN000520,ACC-947808,CUST_371,08 August 2024,2024.08.09,NVDA,NVIDIA Corporation,BUY,326,534.924055,-174385.24,USD,13.81,0.00,Retirement,BRK001,NASDAQ,2024-08-08T15:05:19Z,Portfolio diversification,
TXN000521,ACC-372050,CUST_189,01/28/2024,30/01/2024,CRM,Salesforce Inc,SELL,483,215.89,$104274.11,USD,25.96,1598.78,Retirement,BRK004,NYSE,2024-01-28T15:52:00Z,Market timing,MEDIUM
TXN000522,ACC-857830,CUST_684,23/10/2024,,SPY,SPDR S&P 500 ETF,DIVIDEND,801,$3.74,"2,995.66",USD,41.84,0.00,Corporate,BRK001,NYSE ARCA,2024-10-23T16:59:09Z,Tax loss harvesting,High
TXN000523,ACC-857371,CUST_4,18/08/2024,08/21/2024,XOM,Exxon Mobil Corp,SELL,382,95.912,$36638.44,USD,53.95,483.31,Retirement,BRK005,NYSE,2024-08-18T12:22:13Z,Quarterly rebalancing,low
TXN000524,ACC-488241,CUST_834,2024-07-05,06 July 2024,WFC,Wells Fargo & Co,SELL,234,47.98,11226.91,USD,25.70,195.60,Trust,BRK005,NYSE,2024-07-05T10:59:11Z,Tax loss harvesting,MEDIUM
TXN000525,ACC-669128,CUST_447,14-07-2024,,NFLX,Netflix Inc,DIVIDEND,497,$3.21,"1,593.94",USD,40.10,0.00,Individual,BRK001,NASDAQ,2024-07-14T10:41:01Z,Dividend reinvestment,Medium
TXN000526,ACC-754128,CUST_950,10/05/2024,06-10-2024,XOM,Exxon Mobil Corp,SELL,109,116.292631,$12675.90,USD,16.14,135.84,Retirement,BRK004,NYSE,2024-10-05T14:50:58Z,,Medium
TXN000527,ACC-492842,CUST_801,24-04-2024,,BAC,Bank of America Corp,DIVIDEND,908,$4.5231,"$4,106.97",USD,50.47,0.00,Retirement,BRK001,NYSE,2024-04-24T09:00:01Z,,low
TXN000528,ACC-699982,CUST_441,2024.05.03,,NVDA,NVIDIA Corporation,DIVIDEND,898,0.352747,316.77,USD,51.60,,Trust,BRK002,NASDAQ,2024-05-03T11:25:57Z,Rebalancing,low
TXN000529,ACC-940089,CUST_130,09/15/2024,,XOM,Exxon Mobil Corp,DIVIDEND,913,$3.83,3501.03,USD,50.83,,Joint,BRK002,NYSE,2024-09-15T12:05:05Z,,MEDIUM
TXN000530,ACC-841947,CUST_557,2024.02.10,,AAPL,Apple Inc,DIVIDEND,514,3.208869,"$1,649.36",USD,43.88,0.00,Retirement,BRK002,NASDAQ,2024-02-10T13:12:34Z,Year-end selling,Very High
TXN000531,ACC-388321,CUST_85,2024-03-14,,XOM,Exxon Mobil Corp,DIVIDEND,163,2.349726,$383.01,USD,34.79,0.00,Individual,BRK002,NYSE,2024-03-14T13:57:11Z,,
TXN000532,ACC-318074,CUST_401,21 February 2024,02/23/2024,PEP,PepsiCo Inc,BUY,215,164.206,$-35304.27,USD,23.76,0.00,Corporate,BRK004,NASDAQ,2024-02-21T11:19:00Z,Quarterly rebalancing,High
TXN000533,ACC-459462,CUST_356,2024-09-04,,META,Meta Platforms Inc,DIVIDEND,998,$0.70,$694.42,USD,35.31,0.00,Joint,BRK001,NASDAQ,2024-09-04T11:13:55Z,Profit taking,Med
TXN000534,ACC-187496,CUST_746,20/12/2024,21-Dec-2024,BAC,Bank of America Corp,SELL,334,$39.1617,"13,080.00",USD,19.72,162.68,Joint,BRK004,NYSE,2024-12-20T13:11:12Z,Year-end selling,Very High
TXN000535,ACC-207892,CUST_598,27-10-2024,2024.10.29,META,Meta Platforms Inc,BUY,217,$332.43,"-72,137.01",USD,34.82,0.00,Corporate,BRK003,NASDAQ,2024-10-27T15:27:12Z,Tax loss harvesting,Medium
TXN000536,ACC-135399,CUST_982,18-09-2024,21-Sep-2024,GLD,SPDR Gold Shares,SELL,59,$195.9323,$11560.00,USD,14.00,194.94,Corporate,BRK002,NYSE ARCA,2024-09-18T12:42:23Z,Estate planning,Medium
TXN000537,ACC-110100,CUST_327,2024-12-18,21-Dec-2024,JNJ,Johnson & Johnson,SELL,288,$167.97,"48,376.77",USD,8.31,395.85,Retirement,BRK001,NYSE,2024-12-18T13:45:38Z,Estate planning,Med
TXN000538,ACC-815267,CUST_775,10-Aug-2024,11 August 2024,DIS,The Walt Disney Company,SELL,141,99.960,$14094.29,USD,26.06,106.65,Corporate,BRK005,NYSE,2024-08-10T12:36:01Z,,low
TXN000539,ACC-584202,CUST_292,2024.03.08,,GOOGL,Alphabet Inc Class A,DIVIDEND,90,$1.75,$157.79,USD,5.81,0.00,Trust,BRK001,NASDAQ,2024-03-08T13:17:20Z,Dividend reinvestment,low
TXN000540,ACC-149359,CUST_403,01 June 2024,,EUR/USD,Euro US Dollar,DIVIDEND,174,$4.2311,736.21,USD,51.89,0.00,Individual,BRK001,FOREX,2024-06-01T09:52:00Z,,Very High
TXN000541,ACC-192292,CUST_196,2024-07-07,,ORCL,Oracle Corporation,DIVIDEND,315,4.428265,"$1,394.90",USD,7.15,0.00,Individual,BRK003,NYSE,2024-07-07T13:21:44Z,Estate planning,Medium
TXN000542,ACC-244455,CUST_598,08/23/2024,2024.08.26,AMZN,Amazon.com Inc,SELL,343,$165.4761,$56758.32,USD,11.12,775.79,Trust,BRK003,NASDAQ,2024-08-23T16:14:05Z,,MEDIUM
TXN000543,ACC-470157,CUST_572,05-04-2024,,JNJ,Johnson & Johnson,BUY,109,159.892,"$-17,428.24",USD,5.66,0.00,Retirement,BRK004,NYSE,2024-05-04T12:31:06Z,,low
TXN000544,ACC-426972,CUST_726,20/08/2024,,NFLX,Netflix Inc,DIVIDEND,183,$1.1720,214.48,USD,23.18,0.00,Trust,BRK005,NASDAQ,2024-08-20T12:49:25Z,,Med
TXN000545,ACC-422066,CUST_975,10/22/2024,10/25/2024,AMZN,Amazon.com Inc,SELL,458,149.622498,68527.10,USD,28.04,832.17,Joint,BRK004,NASDAQ,2024-10-22T13:07:59Z,Tax loss harvesting,MEDIUM
TXN000546,ACC-257936,CUST_407,2024.09.14,,GBP/USD,British Pound US Dollar,SELL,61282,1.277,"78,272.98",USD,7.46,1480.95,Retirement,BRK003,FOREX,2024-09-14T15:11:38Z,,Very High
TXN000547,ACC-643810,CUST_444,2024-02-25,02/26/2024,XOM,Exxon Mobil Corp,BUY,19,96.328444,"-1,830.24",USD,33.76,0.00,Retirement,BRK001,NYSE,2024-02-25T10:17:14Z,Year-end selling,Med
TXN000548,ACC-330569,CUST_752,20-12-2024,21-Dec-2024,EUR/USD,Euro US Dollar,BUY,380070,1.09,-416018.14,USD,34.82,0.00,Individual,BRK001,FOREX,2024-12-20T16:47:19Z,Year-end selling,High
TXN000549,ACC-172828,CUST_171,05-Apr-2024,06 April 2024,CRM,Salesforce Inc,SELL,11,234.233804,$2576.57,USD,13.88,15.86,Individual,BRK005,NYSE,2024-04-05T16:37:00Z,Profit taking,MEDIUM
TXN000550,ACC-147371,CUST_839,09-01-2024,10/01/2024,DIS,The Walt Disney Company,BUY,52,$108.2577,"-5,629.40",USD,20.23,,Corporate,BRK004,NYSE,2024-01-09T14:34:16Z,Dollar cost averaging,HIGH
TXN000551,ACC-469755,CUST_309,29-Dec-2024,,CRM,Salesforce Inc,DIVIDEND,927,4.34,"$4,022.37",USD,47.18,0.00,Trust,BRK001,NYSE,2024-12-29T09:09:26Z,Quarterly rebalancing,
TXN000552,ACC-356238,CUST_592,2024.12.22,2024.12.23,QQQ,Invesco QQQ Trust,BUY,495,413.873375,"-204,867.32",USD,18.70,0.00,Joint,BRK004,NASDAQ,2024-12-22T11:16:58Z,Tax loss harvesting,Med
TXN000553,ACC-389666,CUST_317,2024-04-07,,GLD,SPDR Gold Shares,DIVIDEND,904,3.10,"2,802.94",USD,26.67,0.00,Trust,BRK005,NYSE ARCA,2024-04-07T13:07:00Z,Quarterly rebalancing,MEDIUM
TXN000554,ACC-648600,CUST_990,28/05/2024,2024-05-30,WFC,Wells Fargo & Co,SELL,112,$44.0772,4936.64,USD,19.15,28.62,Corporate,BRK001,NYSE,2024-05-28T14:42:53Z,,low
TXN000555,ACC-467230,CUST_900,25/05/2024,,MSFT,Microsoft Corporation,DIVIDEND,800,1.063964,851.17,USD,34.26,0.00,Individual,BRK003,NASDAQ,2024-05-25T09:30:59Z,Estate planning,Very High
TXN000556,ACC-202905,CUST_915,13-05-2024,15-May-2024,SLV,iShares Silver Trust,SELL,72,28.043802,2019.15,USD,39.17,14.21,Joint,BRK002,NYSE ARCA,2024-05-13T13:05:19Z,Quarterly rebalancing,
TXN000557,ACC-494228,CUST_802,08/11/2024,,AMZN,Amazon.com Inc,DIVIDEND,370,$2.57,$950.42,USD,39.26,0.00,Corporate,BRK004,NASDAQ,2024-08-11T15:29:26Z,Portfolio diversification,MEDIUM
TXN000558,ACC-541365,CUST_91,12-03-2024,14/03/2024,PEP,PepsiCo Inc,BUY,461,172.418,"-79,484.60",USD,33.28,0.00,Corporate,BRK001,NASDAQ,2024-03-12T11:25:42Z,,low
TXN000559,ACC-188771,CUST_57,05/18/2024,,SPY,SPDR S&P 500 ETF,DIVIDEND,347,2.870673,996.12,USD,39.53,0.00,Individual,BRK001,NYSE ARCA,2024-05-18T09:44:13Z,Risk management,Med
TXN000560,ACC-808502,CUST_656,20-03-2024,21 March 2024,XOM,Exxon Mobil Corp,SELL,103,$110.59,"11,390.93",USD,10.74,0.00,Joint,BRK001,NYSE,2024-03-20T10:15:13Z,,Med
TXN000561,ACC-227728,CUST_308,26 July 2024,29-07-2024,META,Meta Platforms Inc,BUY,349,323.25,-112815.29,USD,26.96,0.00,Joint,BRK001,NASDAQ,2024-07-26T11:40:01Z,,low
TXN000562,ACC-833613,CUST_560,12 April 2024,13 April 2024,EUR/USD,Euro US Dollar,SELL,154274,1.075714,$165954.66,USD,24.56,1096.97,Trust,BRK004,FOREX,2024-04-12T09:18:29Z,,High
TXN000563,ACC-708738,CUST_311,18 January 2024,20 January 2024,GOOGL,Alphabet Inc Class A,SELL,82,136.614,"$11,202.37",USD,22.89,140.57,Corporate,BRK005,NASDAQ,2024-01-18T10:11:41Z,,low
TXN000564,ACC-581801,CUST_733,12-03-2024,,PEP,PepsiCo Inc,DIVIDEND,453,0.434,$196.71,USD,46.97,0.00,Trust,BRK004,NASDAQ,2024-03-12T11:36:45Z,Estate planning,HIGH
TXN000565,ACC-439818,CUST_603,24-Oct-2024,,GLD,SPDR Gold Shares,DIVIDEND,119,0.32,38.10,USD,47.60,0.00,Retirement,BRK002,NYSE ARCA,2024-10-24T10:31:59Z,Tax loss harvesting,Medium
TXN000566,ACC-282450,CUST_746,2024.07.15,,ORCL,Oracle Corporation,BUY,20,107.514515,"-2,150.29",USD,47.34,0.00,Individual,BRK004,NYSE,2024-07-15T09:59:11Z,Year-end selling,MEDIUM
TXN000567,ACC-768357,CUST_588,10-11-2024,14-10-2024,NVDA,NVIDIA Corporation,SELL,380,$512.7483,"194,844.34",USD,13.10,3337.70,Retirement,BRK001,NASDAQ,2024-10-11T10:13:02Z,Long-term investment,Low
TXN000568,ACC-695900,CUST_560,06-Feb-2024,,META,Meta Platforms Inc,DIVIDEND,982,3.67,$3602.55,USD,31.41,0.00,Retirement,BRK002,NASDAQ,2024-02-06T14:22:39Z,,HIGH
TXN000569,ACC-755853,CUST_386,02/06/2024,,AMZN,Amazon.com Inc,DIVIDEND,170,2.54369,$432.43,USD,7.57,,Joint,BRK003,NASDAQ,2024-02-06T12:52:18Z,Dollar cost averaging,Low
TXN000570,ACC-265531,CUST_992,05/27/2024,,BOND_10Y,US Treasury 10 Year,DIVIDEND,580,$4.67,$2706.20,USD,30.00,0.00,Trust,BRK005,BOND,2024-05-27T10:37:30Z,Dollar cost averaging,Low
TXN000571,ACC-373553,CUST_206,2024-06-20,23-Jun-2024,AMZN,Amazon.com Inc,BUY,340,$176.97,"$-60,168.77",USD,50.62,0.00,Individual,BRK002,NASDAQ,2024-06-20T10:51:36Z,Year-end selling,HIGH
TXN000572,ACC-536459,CUST_613,11/09/2024,,CRM,Salesforce Inc,DIVIDEND,182,1.43,$259.44,USD,7.09,0.00,Individual,BRK004,NYSE,2024-11-09T12:41:22Z,Dollar cost averaging,Med
TXN000573,ACC-127633,CUST_793,2024.04.10,,CVX,Chevron Corporation,DIVIDEND,615,$2.46,"$1,514.53",USD,24.36,0.00,Trust,BRK002,NYSE,2024-04-10T15:35:08Z,,low
TXN000574,ACC-459793,CUST_448,01-30-2024,2024.01.31,JPM,JPMorgan Chase & Co,BUY,455,$169.90,$-77304.06,USD,45.39,,Joint,BRK005,NYSE,2024-01-30T09:55:46Z,,Low
TXN000575,ACC-559859,CUST_185,2024-05-24,25-05-2024,SPY,SPDR S&P 500 ETF,SELL,204,412.97,"84,246.21",USD,28.94,518.29,Corporate,BRK005,NYSE ARCA,2024-05-24T16:45:47Z,,Very High
TXN000576,ACC-847775,CUST_310,06-07-2024,,NFLX,Netflix Inc,DIVIDEND,964,1.410923,"$1,360.13",USD,39.89,,Joint,BRK001,NASDAQ,2024-07-06T14:57:26Z,Market timing,Low
TXN000577,ACC-243792,CUST_862,09-23-2024,,WFC,Wells Fargo & Co,DIVIDEND,175,$1.92,336.82,USD,45.82,0.00,Retirement,BRK001,NYSE,2024-09-23T16:41:48Z,Short-term trade,Very High
TXN000578,ACC-383428,CUST_285,2024.10.28,,WFC,Wells Fargo & Co,BUY,197,52.091485,$-10262.02,USD,29.77,0.00,Trust,BRK004,NYSE,2024-10-28T09:14:13Z,Quarterly rebalancing,HIGH
TXN000579,ACC-132826,CUST_555,2024-06-27,,ORCL,Oracle Corporation,DIVIDEND,394,4.621224,$1820.76,USD,50.37,0.00,Joint,BRK002,NYSE,2024-06-27T14:46:53Z,,Low
TXN000580,ACC-680170,CUST_398,13-12-2024,,NFLX,Netflix Inc,DIVIDEND,636,$3.62,"$2,304.98",USD,43.45,0.00,Corporate,BRK002,NASDAQ,2024-12-13T16:47:59Z,,low
TXN000581,ACC-387721,CUST_88,07-05-2024,,SPY,SPDR S&P 500 ETF,DIVIDEND,680,$1.4439,981.87,USD,18.44,0.00,Corporate,BRK005,NYSE ARCA,2024-05-07T10:19:36Z,,Low
TXN000582,ACC-118105,CUST_451,05 January 2024,01-08-2024,GOOGL,Alphabet Inc Class A,SELL,297,144.516653,42921.45,USD,51.94,607.55,Corporate,BRK001,NASDAQ,2024-01-05T11:16:49Z,Dollar cost averaging,HIGH
TXN000583,ACC-338466,CUST_646,30/03/2024,,NFLX,Netflix Inc,DIVIDEND,288,$0.6608,$190.31,USD,6.93,,Joint,BRK004,NASDAQ,2024-03-30T09:35:45Z,,MEDIUM
TXN000584,ACC-985974,CUST_879,2024-06-29,30 June 2024,SLV,iShares Silver Trust,BUY,40,21.13,$-845.27,USD,16.85,0.00,Corporate,BRK005,NYSE ARCA,2024-06-29T15:04:41Z,Dollar cost averaging,MEDIUM
TXN000585,ACC-926450,CUST_369,2024.06.20,,CRM,Salesforce Inc,DIVIDEND,351,$3.1474,"$1,104.73",USD,13.02,0.00,Individual,BRK003,NYSE,2024-06-20T09:06:38Z,,High
TXN000586,ACC-497242,CUST_851,2024-10-25,,CVX,Chevron Corporation,DIVIDEND,830,4.989,$4141.14,USD,8.92,0.00,Individual,BRK002,NYSE,2024-10-25T15:34:46Z,,Med
TXN000587,ACC-791218,CUST_538,23 September 2024,26-09-2024,SPY,SPDR S&P 500 ETF,SELL,169,$491.1070,$82997.07,USD,17.15,865.62,Trust,BRK003,NYSE ARCA,2024-09-23T12:28:46Z,Dividend reinvestment,Medium
TXN000588,ACC-469082,CUST_574,09/15/2024,09-18-2024,ORCL,Oracle Corporation,SELL,215,$113.4690,$24395.84,USD,16.49,483.07,Joint,BRK002,NYSE,2024-09-15T11:38:16Z,Tax loss harvesting,low
TXN000589,ACC-185465,CUST_419,03/08/2024,04/08/2024,GLD,SPDR Gold Shares,SELL,8,215.06,$1720.45,USD,13.34,28.36,Trust,BRK001,NYSE ARCA,2024-08-03T09:53:27Z,,High
TXN000590,ACC-238808,CUST_528,2024.09.28,09-30-2024,CRM,Salesforce Inc,SELL,61,256.958681,"15,674.48",USD,21.84,157.52,Joint,BRK005,NYSE,2024-09-28T09:04:47Z,Portfolio diversification,Medium
TXN000591,ACC-876677,CUST_855,11-08-2024,14/08/2024,KO,The Coca-Cola Company,SELL,302,62.237,"$18,795.60",USD,50.82,117.60,Individual,BRK005,NYSE,2024-08-11T16:24:20Z,Risk management,MEDIUM
TXN000592,ACC-910555,CUST_100,28-04-2024,,EUR/USD,Euro US Dollar,SELL,285352,1.09,"309,960.02",USD,33.99,3533.65,Corporate,BRK004,FOREX,2024-04-28T11:09:02Z,Year-end selling,MEDIUM
TXN000593,ACC-644352,CUST_285,21-Oct-2024,22-10-2024,TSLA,Tesla Inc,SELL,225,212.86,47893.91,USD,16.18,914.20,Corporate,BRK005,NASDAQ,2024-10-21T12:42:17Z,,Medium
TXN000594,ACC-128678,CUST_613,01-21-2024,22-Jan-2024,AAPL,Apple Inc,SELL,483,160.157047,"77,355.85",USD,52.39,902.93,Retirement,BRK004,NASDAQ,2024-01-21T10:45:45Z,Short-term trade,
TXN000595,ACC-617215,CUST_270,14/02/2024,,BAC,Bank of America Corp,DIVIDEND,412,4.038,$1663.59,USD,42.21,0.00,Retirement,BRK001,NYSE,2024-02-14T11:32:21Z,,MEDIUM
TXN000596,ACC-430102,CUST_914,2024.01.20,,TSLA,Tesla Inc,DIVIDEND,375,1.03,$387.36,USD,32.91,0.00,Individual,BRK001,NASDAQ,2024-01-20T11:37:24Z,Profit taking,Very High
TXN000597,ACC-608042,CUST_834,05 April 2024,04-06-2024,WFC,Wells Fargo & Co,BUY,35,35.063954,-1227.24,USD,29.53,0.00,Joint,BRK002,NYSE,2024-04-05T09:26:44Z,,High
TXN000598,ACC-607755,CUST_544,02/12/2024,04 December 2024,CRM,Salesforce Inc,SELL,323,239.217758,$77267.34,USD,24.61,943.77,Individual,BRK002,NYSE,2024-12-02T13:26:28Z,Quarterly rebalancing,Medium
TXN000599,ACC-284753,CUST_476,06/12/2024,,QQQ,Invesco QQQ Trust,DIVIDEND,181,3.89,704.28,USD,29.19,,Trust,BRK005,NASDAQ,2024-06-12T12:01:18Z,,low
TXN000600,ACC-909289,CUST_331,13-May-2024,2024.05.15,BTC-USD,Bitcoin USD,SELL,0.547279,44124.48,$24148.40,USD,29.28,351.21,Individual,BRK003,CRYPTO,2024-05-13T15:14:36Z,Risk management,HIGH
TXN000601,ACC-743095,CUST_626,17/06/2024,,SLV,iShares Silver Trust,DIVIDEND,789,0.203,160.54,USD,23.96,0.00,Corporate,BRK003,NYSE ARCA,2024-06-17T10:41:03Z,Tax loss harvesting,Med
TXN000602,ACC-978862,CUST_549,07-21-2024,2024.07.23,WFC,Wells Fargo & Co,BUY,376,39.31,"$-14,781.43",USD,17.44,0.00,Individual,BRK001,NYSE,2024-07-21T10:32:25Z,Long-term investment,Low
TXN000603,ACC-341177,CUST_647,12-18-2024,2024.12.20,GOOGL,Alphabet Inc Class A,SELL,380,$127.87,"48,591.20",USD,48.83,298.73,Joint,BRK004,NASDAQ,2024-12-18T09:47:53Z,Rebalancing,Low
TXN000604,ACC-303721,CUST_852,06-11-2024,2024-11-09,PEP,PepsiCo Inc,SELL,235,$166.0431,"39,020.12",USD,15.13,579.09,Trust,BRK004,NASDAQ,2024-11-06T15:05:14Z,Risk management,
TXN000605,ACC-398239,CUST_930,12-25-2024,2024.12.28,VTI,Vanguard Total Stock Market ETF,BUY,391,$247.5729,"-96,800.99",USD,32.33,0.00,Individual,BRK004,NYSE ARCA,2024-12-25T09:25:49Z,,Very High
TXN000606,ACC-774044,CUST_319,19/06/2024,,PEP,PepsiCo Inc,DIVIDEND,147,2.848,418.71,USD,15.38,,Trust,BRK005,NASDAQ,2024-06-19T10:09:25Z,Portfolio diversification,Very High
TXN000607,ACC-617386,CUST_259,29-07-2024,30-Jul-2024,PFE,Pfizer Inc,SELL,307,31.889976,"9,790.22",USD,25.33,0.00,Retirement,BRK005,NYSE,2024-07-29T16:20:41Z,,HIGH
TXN000608,ACC-875615,CUST_751,02/11/2024,,BTC-USD,Bitcoin USD,DIVIDEND,180,3.808745,685.57,USD,13.10,0.00,Individual,BRK002,CRYPTO,2024-02-11T16:55:07Z,,Very High
TXN000609,ACC-942167,CUST_538,06/09/2024,,PFE,Pfizer Inc,DIVIDEND,59,1.55,91.69,USD,26.77,0.00,Corporate,BRK003,NYSE,2024-09-06T14:39:56Z,Quarterly rebalancing,Med
TXN000610,ACC-818299,CUST_210,10-Nov-2024,,GBP/USD,British Pound US Dollar,DIVIDEND,523,1.132024,$592.05,USD,21.51,0.00,Retirement,BRK002,FOREX,2024-11-10T16:00:20Z,Rebalancing,Med
TXN000611,ACC-105874,CUST_320,12-25-2024,,NVDA,NVIDIA Corporation,DIVIDEND,519,$1.7221,$893.76,USD,8.06,0.00,Trust,BRK005,NASDAQ,2024-12-25T10:22:40Z,Profit taking,High
TXN000612,ACC-387918,CUST_292,06-08-2024,,QQQ,Invesco QQQ Trust,DIVIDEND,310,$2.8495,$883.33,USD,37.08,0.00,Retirement,BRK001,NASDAQ,2024-08-06T10:46:13Z,,High
TXN000613,ACC-647689,CUST_602,2024.11.26,,SPY,SPDR S&P 500 ETF,DIVIDEND,656,3.06,$2009.59,USD,53.33,0.00,Joint,BRK004,NYSE ARCA,2024-11-26T11:00:50Z,,Very High
TXN000614,ACC-744794,CUST_151,14/03/2024,15/03/2024,EUR/USD,Euro US Dollar,BUY,240523,1.085819,"-261,164.53",USD,26.27,0.00,Trust,BRK003,FOREX,2024-03-14T10:15:35Z,Estate planning,
TXN000615,ACC-979387,CUST_535,06/11/2024,,CRM,Salesforce Inc,DIVIDEND,220,$4.73,"1,041.24",USD,46.68,0.00,Retirement,BRK004,NYSE,2024-06-11T16:31:44Z,Quarterly rebalancing,Med
TXN000616,ACC-286659,CUST_26,06 July 2024,,KO,The Coca-Cola Company,DIVIDEND,484,1.147522,$555.40,USD,32.99,0.00,Retirement,BRK004,NYSE,2024-07-06T11:59:47Z,Profit taking,MEDIUM
TXN000617,ACC-105887,CUST_601,07-Jun-2024,2024-06-10,TSLA,Tesla Inc,SELL,18,252.81293,"4,550.63",USD,37.36,49.94,Corporate,BRK003,NASDAQ,2024-06-07T09:55:45Z,Market timing,Low
TXN000618,ACC-282212,CUST_485,11/27/2024,,GOOGL,Alphabet Inc Class A,SELL,79,$173.66,"$13,718.82",USD,40.28,243.70,Individual,BRK004,NASDAQ,2024-11-27T09:28:40Z,Tax loss harvesting,Medium
TXN000619,ACC-993990,CUST_199,2024-12-01,,SPY,SPDR S&P 500 ETF,DIVIDEND,374,$4.50,$1682.59,USD,13.46,0.00,Joint,BRK003,NYSE ARCA,2024-12-01T09:42:25Z,Quarterly rebalancing,Med
TXN000620,ACC-898273,CUST_514,16-03-2024,03-18-2024,MSFT,Microsoft Corporation,BUY,210,$382.65,"-80,355.66",USD,13.65,,Individual,BRK003,NASDAQ,2024-03-16T14:07:21Z,,
TXN000621,ACC-194960,CUST_187,14/02/2024,,SPY,SPDR S&P 500 ETF,DIVIDEND,70,3.86,269.99,USD,44.44,0.00,Retirement,BRK003,NYSE ARCA,2024-02-14T10:56:46Z,Dollar cost averaging,HIGH
TXN000622,ACC-497735,CUST_723,26/05/2024,05-28-2024,BAC,Bank of America Corp,BUY,140,$41.7055,"$-5,838.77",USD,49.18,0.00,Retirement,BRK003,NYSE,2024-05-26T16:16:05Z,Market timing,
TXN000623,ACC-648450,CUST_461,19/11/2024,,GOOGL,Alphabet Inc Class A,DIVIDEND,600,$2.8867,$1732.01,USD,54.69,0.00,Trust,BRK003,NASDAQ,2024-11-19T12:21:44Z,Risk management,
TXN000624,ACC-320958,CUST_265,21 April 2024,24/04/2024,BAC,Bank of America Corp,BUY,240,$34.5042,$-8281.01,USD,34.34,0.00,Corporate,BRK005,NYSE,2024-04-21T09:20:44Z,,low
TXN000625,ACC-598593,CUST_343,06/21/2024,23/06/2024,META,Meta Platforms Inc,SELL,225,312.806777,"70,381.52",USD,45.46,959.97,Trust,BRK004,NASDAQ,2024-06-21T12:16:46Z,Tax loss harvesting,HIGH
TXN000626,ACC-414754,CUST_42,04/29/2024,2024.05.02,BTC-USD,Bitcoin USD,SELL,1.641096,$55757.66,"$91,503.66",USD,13.32,1276.73,Joint,BRK002,CRYPTO,2024-04-29T11:42:21Z,Long-term investment,High
TXN000627,ACC-931377,CUST_785,13-Mar-2024,14/03/2024,ETH-USD,Ethereum USD,SELL,1.721512,$2400.81,"4,133.03",USD,20.38,73.84,Trust,BRK001,CRYPTO,2024-03-13T11:43:35Z,Tax loss harvesting,Very High
TXN000628,ACC-267069,CUST_353,21 February 2024,,BOND_10Y,US Treasury 10 Year,DIVIDEND,267,4.572882,"$1,220.96",USD,38.42,0.00,Trust,BRK002,BOND,2024-02-21T15:08:20Z,Rebalancing,Medium
TXN000629,ACC-959613,CUST_691,2024.08.05,2024-08-08,BOND_10Y,US Treasury 10 Year,BUY,312,97.217,"-30,331.69",USD,13.91,0.00,Retirement,BRK003,BOND,2024-08-05T14:32:52Z,,MEDIUM
TXN000630,ACC-776936,CUST_236,11 March 2024,03/13/2024,NVDA,NVIDIA Corporation,BUY,335,569.793328,-190880.76,USD,13.99,0.00,Retirement,BRK003,NASDAQ,2024-03-11T15:43:52Z,Dollar cost averaging,
TXN000631,ACC-815485,CUST_530,24 February 2024,02/27/2024,PEP,PepsiCo Inc,BUY,208,$173.12,"-36,008.41",USD,45.18,0.00,Individual,BRK002,NASDAQ,2024-02-24T11:36:32Z,Portfolio diversification,MEDIUM
TXN000632,ACC-802750,CUST_412,2024-08-04,08/07/2024,WFC,Wells Fargo & Co,SELL,411,47.072721,$19346.89,USD,50.41,323.38,Corporate,BRK005,NYSE,2024-08-04T10:50:11Z,Risk management,MEDIUM
TXN000633,ACC-257692,CUST_8,21-06-2024,,NVDA,NVIDIA Corporation,DIVIDEND,795,4.374,"$3,477.18",USD,26.74,0.00,Trust,BRK003,NASDAQ,2024-06-21T10:55:31Z,Long-term investment,Low
TXN000634,ACC-453854,CUST_692,2024-05-31,2024.06.02,BOND_10Y,US Treasury 10 Year,SELL,167,$95.18,15894.26,USD,19.88,0.00,Individual,BRK003,BOND,2024-05-31T15:15:11Z,,Low
TXN000635,ACC-763664,CUST_506,08-08-2024,09 August 2024,QQQ,Invesco QQQ Trust,SELL,168,354.064098,"59,482.77",USD,23.64,1168.99,Individual,BRK004,NASDAQ,2024-08-08T10:21:59Z,Dollar cost averaging,Med
TXN000636,ACC-123470,CUST_189,05/11/2024,12-05-2024,DIS,The Walt Disney Company,SELL,316,114.85,"$36,291.83",USD,30.70,314.15,Individual,BRK003,NYSE,2024-05-11T12:48:59Z,Year-end selling,HIGH
TXN000637,ACC-625927,CUST_688,2024.01.24,2024-01-26,ORCL,Oracle Corporation,BUY,10,$112.22,-1122.15,USD,44.10,0.00,Retirement,BRK003,NYSE,2024-01-24T16:38:50Z,Tax loss harvesting,
TXN000638,ACC-843449,CUST_333,04/23/2024,26 April 2024,SLV,iShares Silver Trust,SELL,326,25.879142,"8,436.60",USD,34.76,102.37,Joint,BRK001,NYSE ARCA,2024-04-23T14:20:22Z,Rebalancing,MEDIUM
TXN000639,ACC-320869,CUST_546,23/12/2024,12/24/2024,CVX,Chevron Corporation,SELL,288,$158.94,45775.16,USD,54.25,0.00,Joint,BRK003,NYSE,2024-12-23T13:48:20Z,Portfolio diversification,
TXN000640,ACC-274833,CUST_640,2024.06.29,01 July 2024,BTC-USD,Bitcoin USD,BUY,3.753468,$69638.81,"$-261,387.04",USD,31.88,0.00,Trust,BRK005,CRYPTO,2024-06-29T10:25:13Z,,Medium
TXN000641,ACC-266846,CUST_786,2024.07.24,27-07-2024,QQQ,Invesco QQQ Trust,BUY,186,381.94035,"$-71,040.91",USD,36.51,0.00,Corporate,BRK005,NASDAQ,2024-07-24T15:14:54Z,Estate planning,Med
TXN000642,ACC-571288,CUST_161,2024.03.31,02 April 2024,WFC,Wells Fargo & Co,BUY,350,48.12,-16843.33,USD,50.36,0.00,Trust,BRK005,NYSE,2024-03-31T15:26:12Z,Market timing,low
TXN000643,ACC-627812,CUST_83,2024.11.02,03 November 2024,AAPL,Apple Inc,SELL,488,$184.2182,89898.46,USD,23.51,1640.89,Trust,BRK005,NASDAQ,2024-11-02T12:54:58Z,,Med
TXN000644,ACC-283722,CUST_484,12-30-2024,12-31-2024,SPY,SPDR S&P 500 ETF,BUY,236,457.760,"$-108,031.41",USD,17.25,0.00,Joint,BRK004,NYSE ARCA,2024-12-30T11:29:32Z,Estate planning,Very High
TXN000645,ACC-267003,CUST_251,08/24/2024,,AAPL,Apple Inc,DIVIDEND,743,2.091,$1553.69,USD,30.99,0.00,Trust,BRK004,NASDAQ,2024-08-24T15:16:56Z,Short-term trade,Medium
TXN000646,ACC-967962,CUST_744,31-01-2024,2024-02-03,PEP,PepsiCo Inc,SELL,367,$167.27,61387.16,USD,51.37,712.13,Individual,BRK001,NASDAQ,2024-01-31T13:48:52Z,Estate planning,High
TXN000647,ACC-484265,CUST_423,02-Dec-2024,03-12-2024,AMZN,Amazon.com Inc,BUY,329,143.885028,"$-47,338.17",USD,39.69,0.00,Trust,BRK004,NASDAQ,2024-12-02T13:21:18Z,Tax loss harvesting,Very High
TXN000648,ACC-723303,CUST_37,12/03/2024,,GBP/USD,British Pound US Dollar,SELL,305456,1.34,408705.34,USD,23.14,7835.65,Retirement,BRK005,FOREX,2024-03-12T16:45:28Z,Rebalancing,
TXN000649,ACC-736956,CUST_300,15-07-2024,,XOM,Exxon Mobil Corp,BUY,156,100.29,"$-15,645.48",USD,12.42,0.00,Individual,BRK003,NYSE,2024-07-15T15:30:39Z,Tax loss harvesting,MEDIUM
TXN000650,ACC-496339,CUST_887,05/09/2024,,NFLX,Netflix Inc,DIVIDEND,545,4.496,$2450.30,USD,5.71,0.00,Individual,BRK003,NASDAQ,2024-09-05T13:13:14Z,,Very High
TXN000651,ACC-473818,CUST_511,2024-08-23,,DIS,The Walt Disney Company,DIVIDEND,851,$3.96,"$3,369.67",USD,49.91,0.00,Retirement,BRK003,NYSE,2024-08-23T15:40:06Z,Risk management,Low
TXN000652,ACC-660730,CUST_867,10/02/2024,10-05-2024,PEP,PepsiCo Inc,BUY,409,$164.8938,$-67441.58,USD,41.97,0.00,Retirement,BRK002,NASDAQ,2024-10-02T11:02:38Z,,HIGH
TXN000653,ACC-868959,CUST_851,02/02/2024,,GBP/USD,British Pound US Dollar,SELL,317063,1.27,$403544.67,USD,43.08,2612.57,Individual,BRK003,FOREX,2024-02-02T12:30:07Z,Portfolio diversification,Medium
TXN000654,ACC-668714,CUST_604,20 April 2024,,WFC,Wells Fargo & Co,DIVIDEND,490,4.319582,2116.59,USD,10.58,0.00,Trust,BRK002,NYSE,2024-04-20T09:16:48Z,Dollar cost averaging,HIGH
TXN000655,ACC-606755,CUST_527,25-05-2024,,BAC,Bank of America Corp,DIVIDEND,331,3.421429,"1,132.49",USD,30.15,0.00,Trust,BRK001,NYSE,2024-05-25T16:00:20Z,Risk management,High
TXN000656,ACC-168744,CUST_779,09-08-2024,12/08/2024,TSLA,Tesla Inc,SELL,56,203.231,11380.96,USD,43.14,142.57,Corporate,BRK005,NASDAQ,2024-08-09T10:43:19Z,Profit taking,HIGH
TXN000657,ACC-439492,CUST_161,2024.04.08,11/04/2024,PEP,PepsiCo Inc,BUY,265,$166.5136,"$-44,126.11",USD,54.06,0.00,Joint,BRK004,NASDAQ,2024-04-08T12:59:16Z,,
TXN000658,ACC-449933,CUST_745,30-Jun-2024,2024.07.02,ETH-USD,Ethereum USD,SELL,9.399933,$2011.3451,"$18,906.51",USD,7.77,277.68,Retirement,BRK004,CRYPTO,2024-06-30T09:52:45Z,,
TXN000659,ACC-972993,CUST_383,13-Jan-2024,01-16-2024,BTC-USD,Bitcoin USD,SELL,6.175941,62911.611591,388538.39,USD,27.01,2376.46,Retirement,BRK003,CRYPTO,2024-01-13T16:02:49Z,Year-end selling,HIGH
TXN000660,ACC-393750,CUST_622,2024.10.27,,GOOGL,Alphabet Inc Class A,BUY,276,140.561516,-38794.98,USD,23.47,0.00,Corporate,BRK001,NASDAQ,2024-10-27T11:56:47Z,,HIGH
TXN000661,ACC-718458,CUST_307,10-20-2024,22-10-2024,BOND_10Y,US Treasury 10 Year,BUY,419,100.57,-42137.47,USD,19.57,0.00,Individual,BRK002,BOND,2024-10-20T14:54:23Z,Portfolio diversification,Medium
TXN000662,ACC-338742,CUST_472,04-Jul-2024,,NVDA,NVIDIA Corporation,DIVIDEND,315,$1.35,$425.64,USD,42.38,0.00,Individual,BRK002,NASDAQ,2024-07-04T15:27:25Z,Estate planning,Medium
TXN000663,ACC-637145,CUST_383,2024.01.09,,GOOGL,Alphabet Inc Class A,DIVIDEND,384,$3.97,1525.12,USD,29.60,0.00,Joint,BRK003,NASDAQ,2024-01-09T10:36:05Z,Estate planning,Medium
TXN000664,ACC-987409,CUST_872,14 February 2024,,SLV,iShares Silver Trust,DIVIDEND,819,0.458,$375.19,USD,39.20,0.00,Corporate,BRK004,NYSE ARCA,2024-02-14T11:41:21Z,,HIGH
TXN000665,ACC-919056,CUST_710,2024-08-09,,VTI,Vanguard Total Stock Market ETF,DIVIDEND,688,$4.1583,"2,860.90",USD,5.94,0.00,Retirement,BRK003,NYSE ARCA,2024-08-09T11:16:54Z,,low
TXN000666,ACC-310062,CUST_789,21-Oct-2024,,CRM,Salesforce Inc,DIVIDEND,206,1.03,$211.22,USD,12.41,0.00,Corporate,BRK002,NYSE,2024-10-21T09:34:38Z,Long-term investment,Medium
TXN000667,ACC-443367,CUST_892,06-10-2024,2024.06.11,CVX,Chevron Corporation,BUY,120,169.730109,$-20367.61,USD,51.82,0.00,Retirement,BRK003,NYSE,2024-06-10T11:56:57Z,Short-term trade,Low
TXN000668,ACC-880080,CUST_875,2024.04.16,04-17-2024,GOOGL,Alphabet Inc Class A,SELL,303,166.259024,"$50,376.48",USD,45.72,0.00,Retirement,BRK005,NASDAQ,2024-04-16T10:10:48Z,,Med
TXN000669,ACC-432272,CUST_426,04-07-2024,,MSFT,Microsoft Corporation,DIVIDEND,311,$2.5928,$806.36,USD,52.24,0.00,Individual,BRK001,NASDAQ,2024-04-07T15:25:54Z,,low
TXN000670,ACC-555238,CUST_969,29-11-2024,,JPM,JPMorgan Chase & Co,DIVIDEND,709,4.070,$2885.51,USD,48.80,0.00,Individual,BRK003,NYSE,2024-11-29T09:09:54Z,,MEDIUM
TXN000671,ACC-263324,CUST_144,21 December 2024,,KO,The Coca-Cola Company,BUY,444,63.024,-27982.57,USD,41.99,0.00,Corporate,BRK003,NYSE,2024-12-21T11:26:11Z,,low
TXN000672,ACC-949681,CUST_685,02-Apr-2024,03 April 2024,CRM,Salesforce Inc,BUY,207,$216.33,-44779.51,USD,36.27,0.00,Corporate,BRK005,NYSE,2024-04-02T09:50:01Z,Portfolio diversification,MEDIUM
TXN000673,ACC-148758,CUST_553,12/07/2024,,META,Meta Platforms Inc,BUY,48,334.58,$-16059.76,USD,25.99,0.00,Individual,BRK001,NASDAQ,2024-07-12T16:26:54Z,Portfolio diversification,HIGH
TXN000674,ACC-592292,CUST_922,11/05/2024,,SPY,SPDR S&P 500 ETF,DIVIDEND,678,3.38,2288.46,USD,9.82,0.00,Trust,BRK005,NYSE ARCA,2024-05-11T11:14:32Z,,Very High
TXN000675,ACC-879286,CUST_98,25-07-2024,,CRM,Salesforce Inc,DIVIDEND,281,1.328286,$373.25,USD,41.50,0.00,Corporate,BRK003,NYSE,2024-07-25T13:48:57Z,,HIGH
TXN000676,ACC-707511,CUST_755,2024.01.18,2024-01-19,XOM,Exxon Mobil Corp,BUY,18,$98.5739,-1774.33,USD,46.77,0.00,Retirement,BRK002,NYSE,2024-01-18T14:00:36Z,,low
TXN000677,ACC-956675,CUST_995,2024.10.22,24 October 2024,ETH-USD,Ethereum USD,BUY,2.793773,2235.638,"-6,245.87",USD,43.43,0.00,Corporate,BRK003,CRYPTO,2024-10-22T13:21:51Z,Estate planning,High
TXN000678,ACC-800462,CUST_877,24-06-2024,25/06/2024,MSFT,Microsoft Corporation,SELL,500,311.350,155675.01,USD,27.87,2063.78,Corporate,BRK002,NASDAQ,2024-06-24T13:28:27Z,Short-term trade,MEDIUM
TXN000679,ACC-516869,CUST_840,09-18-2024,,AMZN,Amazon.com Inc,DIVIDEND,67,1.074,71.93,USD,42.23,0.00,Joint,BRK005,NASDAQ,2024-09-18T09:51:34Z,Profit taking,High
TXN000680,ACC-205002,CUST_697,03-25-2024,,DIS,The Walt Disney Company,DIVIDEND,674,2.177677,"$1,467.75",USD,15.11,0.00,Individual,BRK004,NYSE,2024-03-25T15:57:33Z,Portfolio diversification,
TXN000681,ACC-414565,CUST_1,08-02-2024,,JNJ,Johnson & Johnson,DIVIDEND,263,4.62,"1,215.84",USD,35.66,0.00,Individual,BRK001,NYSE,2024-02-08T11:09:30Z,Estate planning,low
TXN000682,ACC-777468,CUST_430,07-19-2024,,JPM,JPMorgan Chase & Co,SELL,142,$178.5343,$25351.87,USD,12.02,402.83,Joint,BRK002,NYSE,2024-07-19T16:09:43Z,,Very High
TXN000683,ACC-767687,CUST_121,23-09-2024,26 September 2024,GBP/USD,British Pound US Dollar,BUY,239780,$1.2732,"$-305,292.24",USD,19.94,0.00,Individual,BRK005,FOREX,2024-09-23T11:04:56Z,Year-end selling,HIGH
TXN000684,ACC-142961,CUST_391,05/10/2024,11 May 2024,XOM,Exxon Mobil Corp,SELL,116,113.961488,"13,219.53",USD,31.14,,Joint,BRK005,NYSE,2024-05-10T12:55:54Z,,MEDIUM
TXN000685,ACC-210299,CUST_886,23-05-2024,2024.05.25,CRM,Salesforce Inc,SELL,129,$253.36,"32,683.22",USD,54.15,0.00,Individual,BRK004,NYSE,2024-05-23T16:14:37Z,Dollar cost averaging,Very High
TXN000686,ACC-978090,CUST_580,2024.07.11,,GOOGL,Alphabet Inc Class A,DIVIDEND,908,3.98864,"3,621.68",USD,52.70,0.00,Joint,BRK001,NASDAQ,2024-07-11T12:23:37Z,Market timing,Medium
TXN000687,ACC-141801,CUST_356,27 November 2024,2024-11-30,NFLX,Netflix Inc,SELL,417,491.02955,$204759.32,USD,45.26,2350.01,Individual,BRK002,NASDAQ,2024-11-27T09:40:21Z,,High
TXN000688,ACC-864472,CUST_468,09-May-2024,,DIS,The Walt Disney Company,DIVIDEND,304,$1.4555,442.47,USD,44.19,0.00,Corporate,BRK004,NYSE,2024-05-09T11:13:35Z,Risk management,
TXN000689,ACC-918904,CUST_836,29 March 2024,04-01-2024,NFLX,Netflix Inc,BUY,157,$397.4801,"-62,404.38",USD,10.06,0.00,Individual,BRK004,NASDAQ,2024-03-29T16:40:11Z,Profit taking,MEDIUM
TXN000690,ACC-945044,CUST_449,04/07/2024,,META,Meta Platforms Inc,SELL,159,$228.47,$36326.49,USD,50.44,487.04,Joint,BRK005,NASDAQ,2024-07-04T15:39:44Z,,High
TXN000691,ACC-846235,CUST_613,2024.12.05,07-Dec-2024,NFLX,Netflix Inc,SELL,472,409.514,193290.38,USD,24.26,3101.20,Corporate,BRK005,NASDAQ,2024-12-05T14:14:28Z,Profit taking,Medium
TXN000692,ACC-799946,CUST_281,14 January 2024,,JPM,JPMorgan Chase & Co,DIVIDEND,301,4.388166,"1,320.84",USD,27.02,0.00,Retirement,BRK002,NYSE,2024-01-14T13:15:01Z,Portfolio diversification,Low
TXN000693,ACC-695681,CUST_197,30/07/2024,,NFLX,Netflix Inc,DIVIDEND,692,$2.9197,"$2,020.46",USD,50.12,,Trust,BRK003,NASDAQ,2024-07-30T13:27:23Z,Profit taking,MEDIUM
TXN000694,ACC-826871,CUST_138,06-13-2024,,PEP,PepsiCo Inc,DIVIDEND,148,$4.9070,726.23,USD,44.21,0.00,Joint,BRK004,NASDAQ,2024-06-13T14:06:51Z,Profit taking,Med
TXN000695,ACC-702154,CUST_857,28 January 2024,01/30/2024,SLV,iShares Silver Trust,SELL,88,$29.5316,"$2,598.78",USD,6.11,38.34,Corporate,BRK004,NYSE ARCA,2024-01-28T10:43:22Z,,High
TXN000696,ACC-863112,CUST_29,02 November 2024,,BTC-USD,Bitcoin USD,DIVIDEND,186,4.932412,917.43,USD,15.76,0.00,Trust,BRK003,CRYPTO,2024-11-02T13:21:14Z,Risk management,Med
TXN000697,ACC-814417,CUST_601,2024-06-10,06/12/2024,SLV,iShares Silver Trust,BUY,37,27.75,$-1026.61,USD,35.69,0.00,Joint,BRK004,NYSE ARCA,2024-06-10T12:15:38Z,Rebalancing,High
TXN000698,ACC-619018,CUST_747,02-Mar-2024,2024.03.05,MSFT,Microsoft Corporation,BUY,196,396.589674,"$-77,731.58",USD,39.82,0.00,Retirement,BRK003,NASDAQ,2024-03-02T10:19:22Z,,High
TXN000699,ACC-293531,CUST_267,07-24-2024,07/27/2024,JPM,JPMorgan Chase & Co,SELL,385,153.589,$59131.69,USD,9.70,1075.58,Individual,BRK005,NYSE,2024-07-24T14:06:10Z,,Low
TXN000700,ACC-104887,CUST_335,15-07-2024,,AAPL,Apple Inc,DIVIDEND,929,0.440,$408.77,USD,13.62,0.00,Joint,BRK004,NASDAQ,2024-07-15T12:22:06Z,Rebalancing,High
TXN000701,ACC-562104,CUST_724,31/03/2024,,DIS,The Walt Disney Company,SELL,276,$86.16,"23,781.05",USD,49.41,161.81,Corporate,BRK003,NYSE,2024-03-31T14:43:11Z,Rebalancing,Medium
TXN000702,ACC-302542,CUST_618,20-Mar-2024,,ETH-USD,Ethereum USD,DIVIDEND,448,3.941907,1765.97,USD,52.20,0.00,Joint,BRK001,CRYPTO,2024-03-20T12:23:09Z,,MEDIUM
TXN000703,ACC-143610,CUST_367,31 January 2024,,PEP,PepsiCo Inc,DIVIDEND,909,$2.9966,2723.87,USD,47.39,0.00,Individual,BRK003,NASDAQ,2024-01-31T15:48:34Z,Dollar cost averaging,Med
TXN000704,ACC-307661,CUST_300,2024.11.16,2024-11-18,VTI,Vanguard Total Stock Market ETF,SELL,165,224.562,37052.73,USD,33.06,355.28,Corporate,BRK001,NYSE ARCA,2024-11-16T09:12:05Z,Market timing,Med
TXN000705,ACC-772066,CUST_322,2024-01-25,2024-01-27,GOOGL,Alphabet Inc Class A,SELL,351,169.42,59468.09,USD,48.69,764.75,Retirement,BRK005,NASDAQ,2024-01-25T09:58:13Z,,MEDIUM
TXN000706,ACC-847016,CUST_328,02-07-2024,2024-02-10,EUR/USD,Euro US Dollar,BUY,210009,1.05,"-221,174.42",USD,15.30,0.00,Individual,BRK003,FOREX,2024-02-07T12:42:52Z,Tax loss harvesting,Low
TXN000707,ACC-489843,CUST_940,2024-07-24,27-07-2024,AMZN,Amazon.com Inc,BUY,217,175.277792,"$-38,035.28",USD,39.02,0.00,Corporate,BRK002,NASDAQ,2024-07-24T15:44:00Z,Dividend reinvestment,
TXN000708,ACC-298701,CUST_837,06-09-2024,2024-09-08,SLV,iShares Silver Trust,BUY,230,26.96,"$-6,200.80",USD,11.44,0.00,Retirement,BRK001,NYSE ARCA,2024-09-06T10:10:57Z,Short-term trade,Medium
TXN000709,ACC-876043,CUST_263,2024.12.14,,WFC,Wells Fargo & Co,DIVIDEND,926,2.894,$2679.41,USD,10.42,0.00,Individual,BRK004,NYSE,2024-12-14T10:35:54Z,Rebalancing,Very High
TXN000710,ACC-214655,CUST_115,2024-04-27,04/30/2024,DIS,The Walt Disney Company,SELL,316,$92.25,29151.81,USD,23.55,339.05,Individual,BRK005,NYSE,2024-04-27T12:46:20Z,,Very High
TXN000711,ACC-457928,CUST_881,08/05/2024,2024-05-11,QQQ,Invesco QQQ Trust,SELL,79,389.13,"$30,741.36",USD,52.34,257.57,Retirement,BRK003,NASDAQ,2024-05-08T09:55:28Z,,HIGH
TXN000712,ACC-683902,CUST_165,14-Mar-2024,2024-03-16,GOOGL,Alphabet Inc Class A,BUY,87,157.115174,$-13669.02,USD,41.20,0.00,Corporate,BRK003,NASDAQ,2024-03-14T11:57:06Z,Long-term investment,Low
TXN000713,ACC-953232,CUST_397,10/17/2024,10/18/2024,NFLX,Netflix Inc,BUY,422,352.969004,"$-148,952.92",USD,50.54,0.00,Joint,BRK004,NASDAQ,2024-10-17T15:28:58Z,Quarterly rebalancing,
TXN000714,ACC-767625,CUST_466,02/09/2024,,ETH-USD,Ethereum USD,DIVIDEND,279,$0.8076,225.32,USD,36.85,,Retirement,BRK004,CRYPTO,2024-09-02T11:23:47Z,,
TXN000715,ACC-530305,CUST_728,10-04-2024,10-06-2024,VTI,Vanguard Total Stock Market ETF,BUY,216,247.094055,-53372.32,USD,49.18,0.00,Trust,BRK004,NYSE ARCA,2024-10-04T15:29:23Z,Quarterly rebalancing,HIGH
TXN000716,ACC-315917,CUST_252,04-21-2024,24-Apr-2024,GLD,SPDR Gold Shares,BUY,281,216.014173,"$-60,699.98",USD,48.12,0.00,Trust,BRK003,NYSE ARCA,2024-04-21T12:25:09Z,Risk management,
TXN000717,ACC-912203,CUST_891,2024.11.15,18/11/2024,GOOGL,Alphabet Inc Class A,BUY,480,159.579,-76597.96,USD,30.88,0.00,Retirement,BRK004,NASDAQ,2024-11-15T12:24:36Z,Dollar cost averaging,Low
TXN000718,ACC-703003,CUST_801,11/04/2024,14/04/2024,BTC-USD,Bitcoin USD,SELL,4.867363,$61691.71,"$300,275.96",USD,35.52,3891.22,Individual,BRK001,CRYPTO,2024-04-11T10:01:00Z,,Medium
TXN000719,ACC-994016,CUST_93,09-Jun-2024,,NVDA,NVIDIA Corporation,DIVIDEND,268,$1.6071,$430.69,USD,8.30,0.00,Joint,BRK003,NASDAQ,2024-06-09T16:21:45Z,,HIGH
TXN000720,ACC-267575,CUST_923,18/03/2024,2024.03.21,BTC-USD,Bitcoin USD,BUY,5.52366,$40539.81,-223928.14,USD,28.48,0.00,Corporate,BRK002,CRYPTO,2024-03-18T11:58:28Z,,Medium
TXN000721,ACC-595780,CUST_389,01/09/2024,03 September 2024,KO,The Coca-Cola Company,BUY,94,60.85,"$-5,719.80",USD,27.37,0.00,Individual,BRK004,NYSE,2024-09-01T14:05:56Z,Rebalancing,MEDIUM
TXN000722,ACC-256747,CUST_114,12-08-2024,09-Dec-2024,XOM,Exxon Mobil Corp,SELL,410,110.070314,"$45,128.83",USD,29.74,625.25,Retirement,BRK003,NYSE,2024-12-08T12:32:17Z,Long-term investment,
TXN000723,ACC-274988,CUST_54,11-28-2024,30-Nov-2024,JNJ,Johnson & Johnson,SELL,384,150.809,$57910.70,USD,54.75,862.36,Corporate,BRK005,NYSE,2024-11-28T11:55:59Z,Year-end selling,Low
TXN000724,ACC-417414,CUST_390,12 April 2024,,VTI,Vanguard Total Stock Market ETF,SELL,357,233.60,"83,393.48",USD,23.76,1058.16,Trust,BRK004,NYSE ARCA,2024-04-12T11:22:46Z,,MEDIUM
TXN000725,ACC-395322,CUST_274,12 February 2024,,ORCL,Oracle Corporation,DIVIDEND,732,$4.58,3349.17,USD,48.07,0.00,Individual,BRK001,NYSE,2024-02-12T10:15:04Z,,High
TXN000726,ACC-348455,CUST_798,02/14/2024,,AAPL,Apple Inc,DIVIDEND,876,$1.77,$1551.89,USD,50.45,0.00,Individual,BRK002,NASDAQ,2024-02-14T14:50:42Z,,HIGH
TXN000727,ACC-309213,CUST_941,11/02/2024,,MSFT,Microsoft Corporation,DIVIDEND,53,2.22,117.74,USD,39.28,0.00,Retirement,BRK001,NASDAQ,2024-02-11T15:20:40Z,Portfolio diversification,Medium
TXN000728,ACC-295103,CUST_481,2024-05-27,28/05/2024,ETH-USD,Ethereum USD,BUY,2.633353,3948.38,-10397.48,USD,48.91,0.00,Joint,BRK002,CRYPTO,2024-05-27T10:12:11Z,Estate planning,Medium
TXN000729,ACC-976651,CUST_607,2024.05.31,,GBP/USD,British Pound US Dollar,DIVIDEND,486,$1.33,$646.21,USD,22.24,0.00,Retirement,BRK005,FOREX,2024-05-31T13:18:48Z,,Low
TXN000730,ACC-868516,CUST_62,2024.11.13,,MSFT,Microsoft Corporation,DIVIDEND,783,2.285067,"$1,789.21",USD,53.86,0.00,Individual,BRK003,NASDAQ,2024-11-13T10:36:16Z,Tax loss harvesting,MEDIUM
TXN000731,ACC-603787,CUST_380,12-09-2024,09-15-2024,KO,The Coca-Cola Company,SELL,88,57.28,"5,040.74",USD,7.13,60.36,Trust,BRK003,NYSE,2024-09-12T16:55:57Z,Rebalancing,low
TXN000732,ACC-539979,CUST_973,13/01/2024,16/01/2024,PEP,PepsiCo Inc,SELL,8,$167.9884,"$1,343.91",USD,26.72,24.97,Retirement,BRK005,NASDAQ,2024-01-13T12:06:01Z,Rebalancing,High
TXN000733,ACC-307362,CUST_23,2024.09.11,14-09-2024,META,Meta Platforms Inc,SELL,250,234.160894,"$58,540.22",USD,35.34,674.77,Retirement,BRK004,NASDAQ,2024-09-11T14:06:04Z,Year-end selling,Low
TXN000734,ACC-248350,CUST_241,22 September 2024,23-09-2024,PEP,PepsiCo Inc,BUY,174,172.63,"$-30,037.65",USD,36.52,0.00,Joint,BRK004,NASDAQ,2024-09-22T11:33:18Z,Tax loss harvesting,Medium
TXN000735,ACC-596524,CUST_65,10 January 2024,01-12-2024,QQQ,Invesco QQQ Trust,SELL,463,441.015,204189.77,USD,20.63,3999.65,Corporate,BRK005,NASDAQ,2024-01-10T14:44:12Z,Tax loss harvesting,MEDIUM
TXN000736,ACC-842501,CUST_608,11-08-2024,2024-11-10,DIS,The Walt Disney Company,BUY,451,$94.4038,$-42576.11,USD,9.78,0.00,Retirement,BRK005,NYSE,2024-11-08T10:33:31Z,Year-end selling,MEDIUM
TXN000737,ACC-915197,CUST_198,21/05/2024,2024-05-22,QQQ,Invesco QQQ Trust,BUY,423,382.72,-161891.17,USD,36.03,0.00,Joint,BRK002,NASDAQ,2024-05-21T14:31:20Z,Risk management,
TXN000738,ACC-726615,CUST_620,02-03-2024,03-03-2024,PFE,Pfizer Inc,BUY,193,27.482265,$-5304.08,USD,26.15,0.00,Individual,BRK003,NYSE,2024-03-02T12:09:18Z,,
TXN000739,ACC-913482,CUST_932,16 March 2024,19 March 2024,XOM,Exxon Mobil Corp,SELL,56,$113.96,$6381.85,USD,51.85,50.84,Joint,BRK004,NYSE,2024-03-16T11:37:08Z,Long-term investment,
TXN000740,ACC-442399,CUST_566,01-Sep-2024,2024-09-03,AMZN,Amazon.com Inc,SELL,331,165.16,"54,666.51",USD,21.19,776.06,Individual,BRK003,NASDAQ,2024-09-01T09:56:32Z,,MEDIUM
TXN000741,ACC-166980,CUST_950,04/02/2024,02-07-2024,AMZN,Amazon.com Inc,BUY,185,$143.67,"-26,579.76",USD,53.62,0.00,Corporate,BRK001,NASDAQ,2024-02-04T14:48:04Z,Risk management,low
TXN000742,ACC-515225,CUST_712,03/20/2024,21-03-2024,DIS,The Walt Disney Company,BUY,29,91.82,-2662.83,USD,37.24,0.00,Joint,BRK001,NYSE,2024-03-20T12:30:02Z,,Low
TXN000743,ACC-244360,CUST_513,12-Jun-2024,,VTI,Vanguard Total Stock Market ETF,DIVIDEND,69,2.60,179.41,USD,19.48,,Individual,BRK004,NYSE ARCA,2024-06-12T10:02:12Z,Profit taking,Med
TXN000744,ACC-835916,CUST_83,24-Oct-2024,2024-10-25,GBP/USD,British Pound US Dollar,BUY,400203,1.342,"$-536,880.36",USD,36.14,0.00,Corporate,BRK005,FOREX,2024-10-24T15:10:53Z,,MEDIUM
TXN000745,ACC-442945,CUST_920,2024.05.13,,TSLA,Tesla Inc,DIVIDEND,79,2.28,180.37,USD,53.39,0.00,Joint,BRK004,NASDAQ,2024-05-13T11:07:02Z,Short-term trade,Very High
TXN000746,ACC-871440,CUST_766,06-01-2024,,CRM,Salesforce Inc,DIVIDEND,419,2.37,$994.09,USD,37.39,0.00,Retirement,BRK005,NYSE,2024-06-01T12:32:01Z,Profit taking,
TXN000747,ACC-854914,CUST_398,16 June 2024,,VTI,Vanguard Total Stock Market ETF,DIVIDEND,992,$2.51,$2489.17,USD,33.04,0.00,Corporate,BRK002,NYSE ARCA,2024-06-16T10:56:00Z,Market timing,Medium
TXN000748,ACC-100009,CUST_311,2024.08.15,,PFE,Pfizer Inc,DIVIDEND,149,$0.36,$53.99,USD,15.77,0.00,Retirement,BRK004,NYSE,2024-08-15T10:17:26Z,Dollar cost averaging,MEDIUM
TXN000749,ACC-375487,CUST_468,04/14/2024,,ORCL,Oracle Corporation,DIVIDEND,748,3.985,"$2,980.43",USD,49.01,0.00,Trust,BRK002,NYSE,2024-04-14T10:05:46Z,,Low
TXN000750,ACC-837019,CUST_577,09/02/2024,,PFE,Pfizer Inc,DIVIDEND,116,$2.05,$237.56,USD,23.87,0.00,Individual,BRK004,NYSE,2024-09-02T16:26:11Z,Market timing,low
TXN000751,ACC-394464,CUST_727,24 May 2024,,NVDA,NVIDIA Corporation,SELL,447,$535.98,"$239,583.61",USD,14.40,4110.13,Individual,BRK005,NASDAQ,2024-05-24T16:50:14Z,Year-end selling,low
TXN000752,ACC-481718,CUST_91,02-Nov-2024,04-Nov-2024,ETH-USD,Ethereum USD,SELL,5.408129,3452.397206,"18,671.01",USD,21.04,207.34,Joint,BRK004,CRYPTO,2024-11-02T16:22:49Z,,MEDIUM
TXN000753,ACC-477832,CUST_985,08/09/2024,11-Aug-2024,SLV,iShares Silver Trust,SELL,231,26.45,6111.02,USD,42.69,45.61,Individual,BRK003,NYSE ARCA,2024-08-09T11:38:21Z,,Med
TXN000754,ACC-955908,CUST_812,2024.04.15,2024-04-18,MSFT,Microsoft Corporation,SELL,295,$362.3483,"106,892.74",USD,5.20,1600.14,Retirement,BRK002,NASDAQ,2024-04-15T16:07:20Z,Estate planning,MEDIUM
TXN000755,ACC-648532,CUST_673,07-20-2024,07/23/2024,GLD,SPDR Gold Shares,SELL,330,$189.0326,62380.76,USD,27.68,1149.58,Retirement,BRK001,NYSE ARCA,2024-07-20T10:31:09Z,Year-end selling,Med
TXN000756,ACC-892514,CUST_416,06-04-2024,,BOND_10Y,US Treasury 10 Year,DIVIDEND,884,$1.0359,915.76,USD,5.81,0.00,Corporate,BRK001,BOND,2024-06-04T11:52:49Z,Short-term trade,Very High
TXN000757,ACC-542412,CUST_968,2024.07.02,,AAPL,Apple Inc,DIVIDEND,401,$2.0000,$801.98,USD,15.42,,Trust,BRK005,NASDAQ,2024-07-02T09:43:31Z,Portfolio diversification,HIGH
TXN000758,ACC-834665,CUST_485,07/15/2024,,BTC-USD,Bitcoin USD,DIVIDEND,951,$1.8202,$1730.98,USD,53.57,,Trust,BRK001,CRYPTO,2024-07-15T09:31:48Z,Portfolio diversification,low
TXN000759,ACC-859461,CUST_851,11/19/2024,20 November 2024,ETH-USD,Ethereum USD,SELL,3.098826,2068.684,"6,410.49",USD,43.86,52.88,Trust,BRK001,CRYPTO,2024-11-19T11:37:55Z,Long-term investment,Low
TXN000760,ACC-172456,CUST_515,02 April 2024,,BAC,Bank of America Corp,DIVIDEND,870,4.63,$4030.19,USD,37.69,0.00,Individual,BRK003,NYSE,2024-04-02T16:11:57Z,,Medium
TXN000761,ACC-447514,CUST_437,26/02/2024,02-28-2024,DIS,The Walt Disney Company,BUY,398,85.171,"-33,897.97",USD,42.23,0.00,Retirement,BRK004,NYSE,2024-02-26T13:11:14Z,Quarterly rebalancing,Low
TXN000762,ACC-566266,CUST_828,12/24/2024,2024-12-27,TSLA,Tesla Inc,BUY,188,232.571675,$-43723.47,USD,44.72,0.00,Trust,BRK001,NASDAQ,2024-12-24T14:40:34Z,,Med
TXN000763,ACC-684352,CUST_719,08/04/2024,07-Aug-2024,MSFT,Microsoft Corporation,BUY,260,356.96,"-92,808.32",USD,50.96,0.00,Retirement,BRK001,NASDAQ,2024-08-04T11:05:36Z,,Low
TXN000764,ACC-672437,CUST_383,12-10-2024,15/10/2024,EUR/USD,Euro US Dollar,BUY,70738,$1.0907,$-77157.36,USD,32.98,0.00,Retirement,BRK002,FOREX,2024-10-12T13:08:47Z,Long-term investment,High
TXN000765,ACC-112756,CUST_116,25-09-2024,,GLD,SPDR Gold Shares,DIVIDEND,951,$4.08,3876.43,USD,20.98,0.00,Retirement,BRK004,NYSE ARCA,2024-09-25T12:42:30Z,Profit taking,Very High
TXN000766,ACC-764164,CUST_643,10/04/2024,,AMZN,Amazon.com Inc,DIVIDEND,572,$0.8125,464.73,USD,43.03,0.00,Trust,BRK005,NASDAQ,2024-10-04T11:15:40Z,,Medium
TXN000767,ACC-526132,CUST_62,2024-08-09,08-10-2024,NFLX,Netflix Inc,SELL,477,450.75,"$215,006.99",USD,23.68,3772.42,Retirement,BRK002,NASDAQ,2024-08-09T15:41:55Z,Rebalancing,HIGH
TXN000768,ACC-621282,CUST_792,2024.02.08,02/11/2024,SLV,iShares Silver Trust,BUY,398,$27.0447,"$-10,763.81",USD,12.28,0.00,Individual,BRK003,NYSE ARCA,2024-02-08T15:17:29Z,Tax loss harvesting,
TXN000769,ACC-996929,CUST_972,28 August 2024,,VTI,Vanguard Total Stock Market ETF,DIVIDEND,623,4.625,$2881.33,USD,35.26,0.00,Joint,BRK002,NYSE ARCA,2024-08-28T14:05:44Z,Tax loss harvesting,HIGH
TXN000770,ACC-381240,CUST_957,18-05-2024,,SLV,iShares Silver Trust,DIVIDEND,999,4.538473,"$4,533.93",USD,50.36,0.00,Joint,BRK002,NYSE ARCA,2024-05-18T13:12:52Z,Quarterly rebalancing,MEDIUM
TXN000771,ACC-544436,CUST_686,12-03-2024,,KO,The Coca-Cola Company,DIVIDEND,192,4.03,$773.95,USD,39.42,0.00,Retirement,BRK003,NYSE,2024-12-03T14:13:51Z,Risk management,Med
TXN000772,ACC-405619,CUST_654,05-06-2024,,SLV,iShares Silver Trust,DIVIDEND,237,4.448,"$1,054.09",USD,45.48,0.00,Corporate,BRK002,NYSE ARCA,2024-05-06T16:45:17Z,Portfolio diversification,low
TXN000773,ACC-735420,CUST_74,05/09/2024,,VTI,Vanguard Total Stock Market ETF,DIVIDEND,53,$0.43,22.58,USD,45.60,0.00,Corporate,BRK004,NYSE ARCA,2024-05-09T13:32:36Z,Dollar cost averaging,HIGH
TXN000774,ACC-613340,CUST_610,25 February 2024,26/02/2024,BTC-USD,Bitcoin USD,SELL,7.601484,39302.080889,298754.14,USD,54.71,,Individual,BRK003,CRYPTO,2024-02-25T13:08:50Z,,Medium
TXN000775,ACC-792371,CUST_581,2024-01-31,03-02-2024,TSLA,Tesla Inc,SELL,124,214.10,26548.72,USD,16.52,359.98,Corporate,BRK005,NASDAQ,2024-01-31T12:09:01Z,Tax loss harvesting,MEDIUM
TXN000776,ACC-944848,CUST_990,07-15-2024,,BOND_10Y,US Treasury 10 Year,DIVIDEND,214,0.546771,117.01,USD,42.02,0.00,Corporate,BRK004,BOND,2024-07-15T10:15:54Z,Profit taking,Medium
TXN000777,ACC-331044,CUST_287,2024-02-24,,JPM,JPMorgan Chase & Co,DIVIDEND,643,4.318387,2776.72,USD,47.48,0.00,Trust,BRK002,NYSE,2024-02-24T10:54:05Z,Portfolio diversification,Very High
TXN000778,ACC-503151,CUST_872,2024.11.10,,AAPL,Apple Inc,DIVIDEND,260,4.420851,1149.42,USD,29.58,0.00,Joint,BRK003,NASDAQ,2024-11-10T09:31:32Z,,MEDIUM
TXN000779,ACC-837627,CUST_80,2024.11.03,05-Nov-2024,META,Meta Platforms Inc,SELL,128,260.765,"$33,377.96",USD,40.75,356.87,Trust,BRK001,NASDAQ,2024-11-03T10:28:45Z,Dividend reinvestment,Very High
TXN000780,ACC-476984,CUST_391,11 January 2024,,BTC-USD,Bitcoin USD,DIVIDEND,484,0.538,260.57,USD,17.75,0.00,Retirement,BRK003,CRYPTO,2024-01-11T13:30:10Z,,MEDIUM
TXN000781,ACC-499973,CUST_374,01-25-2024,,MSFT,Microsoft Corporation,DIVIDEND,144,3.115705,$448.66,USD,32.64,0.00,Corporate,BRK001,NASDAQ,2024-01-25T13:28:09Z,,Med
TXN000782,ACC-295056,CUST_235,28-07-2024,,META,Meta Platforms Inc,DIVIDEND,942,$0.55,520.10,USD,7.61,0.00,Retirement,BRK003,NASDAQ,2024-07-28T16:27:57Z,,Med
TXN000783,ACC-180790,CUST_69,21-02-2024,23-Feb-2024,DIS,The Walt Disney Company,BUY,79,$106.70,$-8429.00,USD,31.68,0.00,Retirement,BRK002,NYSE,2024-02-21T14:54:10Z,Risk management,Low
TXN000784,ACC-275113,CUST_50,28/08/2024,31-Aug-2024,NFLX,Netflix Inc,BUY,143,$436.08,"-62,359.39",USD,28.12,0.00,Trust,BRK002,NASDAQ,2024-08-28T12:10:40Z,Long-term investment,Medium
TXN000785,ACC-401153,CUST_472,27 September 2024,2024.09.30,CVX,Chevron Corporation,SELL,239,166.663781,39832.64,USD,53.11,410.64,Joint,BRK005,NYSE,2024-09-27T13:33:59Z,Risk management,low
TXN000786,ACC-943934,CUST_38,04/15/2024,2024.04.16,SLV,iShares Silver Trust,SELL,154,23.83,"$3,669.16",USD,23.68,29.28,Individual,BRK002,NYSE ARCA,2024-04-15T11:28:55Z,Estate planning,low
TXN000787,ACC-515614,CUST_251,2024-03-13,15 March 2024,CRM,Salesforce Inc,BUY,365,$231.94,"$-84,657.78",USD,28.26,0.00,Retirement,BRK004,NYSE,2024-03-13T15:03:15Z,Quarterly rebalancing,High
TXN000788,ACC-467583,CUST_477,2024.07.16,,MSFT,Microsoft Corporation,DIVIDEND,890,$2.61,$2324.28,USD,28.86,0.00,Trust,BRK001,NASDAQ,2024-07-16T14:12:19Z,Rebalancing,MEDIUM
TXN000789,ACC-845647,CUST_576,2024-05-18,,AAPL,Apple Inc,DIVIDEND,583,$1.92,$1118.90,USD,27.42,0.00,Corporate,BRK005,NASDAQ,2024-05-18T14:39:20Z,,HIGH
TXN000790,ACC-895337,CUST_500,2024-08-09,,CVX,Chevron Corporation,DIVIDEND,629,2.58,1622.28,USD,54.93,,Retirement,BRK004,NYSE,2024-08-09T16:46:46Z,Rebalancing,MEDIUM
TXN000791,ACC-502537,CUST_283,07-20-2024,07-21-2024,GOOGL,Alphabet Inc Class A,BUY,100,$145.10,-14510.26,USD,25.88,0.00,Retirement,BRK004,NASDAQ,2024-07-20T13:58:13Z,,Med
TXN000792,ACC-378404,CUST_745,09/04/2024,05 September 2024,JPM,JPMorgan Chase & Co,SELL,343,144.569,"$49,587.33",USD,27.98,706.72,Corporate,BRK004,NYSE,2024-09-04T14:40:42Z,Rebalancing,
TXN000793,ACC-945350,CUST_609,05-05-2024,07-May-2024,DIS,The Walt Disney Company,BUY,154,113.20,-17432.52,USD,29.94,0.00,Trust,BRK001,NYSE,2024-05-05T13:06:52Z,,
TXN000794,ACC-360820,CUST_476,03/19/2024,,JNJ,Johnson & Johnson,DIVIDEND,472,$3.74,"$1,764.51",USD,25.96,0.00,Corporate,BRK003,NYSE,2024-03-19T12:10:39Z,Quarterly rebalancing,Medium
TXN000795,ACC-159667,CUST_447,2024.07.26,27-Jul-2024,AMZN,Amazon.com Inc,SELL,61,177.50,10827.73,USD,20.40,216.20,Trust,BRK005,NASDAQ,2024-07-26T15:27:54Z,,Very High
TXN000796,ACC-452438,CUST_164,02-Nov-2024,11/03/2024,GLD,SPDR Gold Shares,SELL,378,$183.2924,"$69,284.53",USD,5.42,858.42,Individual,BRK002,NYSE ARCA,2024-11-02T09:30:11Z,,Low
TXN000797,ACC-811710,CUST_703,24-Dec-2024,,CVX,Chevron Corporation,DIVIDEND,219,4.48,980.05,USD,21.51,0.00,Individual,BRK005,NYSE,2024-12-24T09:39:00Z,Profit taking,Medium
TXN000798,ACC-614179,CUST_111,16-05-2024,,SLV,iShares Silver Trust,DIVIDEND,677,$1.4938,$1011.29,USD,8.25,0.00,Joint,BRK003,NYSE ARCA,2024-05-16T10:31:38Z,,High
TXN000799,ACC-455108,CUST_681,24 March 2024,27-03-2024,PEP,PepsiCo Inc,SELL,362,$165.87,$60046.05,USD,45.73,1138.32,Corporate,BRK003,NASDAQ,2024-03-24T12:29:09Z,Long-term investment,Very High
TXN000800,ACC-716230,CUST_897,01/03/2024,03/04/2024,TSLA,Tesla Inc,SELL,171,213.897031,$36576.39,USD,39.39,577.16,Trust,BRK004,NASDAQ,2024-03-01T13:59:45Z,,Medium
TXN000801,ACC-481901,CUST_161,07-19-2024,,QQQ,Invesco QQQ Trust,BUY,412,434.11,"$-178,854.20",USD,17.61,0.00,Retirement,BRK004,NASDAQ,2024-07-19T15:50:45Z,Portfolio diversification,HIGH
TXN000802,ACC-841746,CUST_433,03-Dec-2024,,ORCL,Oracle Corporation,DIVIDEND,238,0.14,32.48,USD,44.16,0.00,Corporate,BRK004,NYSE,2024-12-03T16:56:21Z,,Medium
TXN000803,ACC-619420,CUST_981,05-22-2024,23-May-2024,PFE,Pfizer Inc,BUY,410,32.11,-13166.60,USD,35.74,0.00,Corporate,BRK001,NYSE,2024-05-22T16:49:52Z,Profit taking,Medium
TXN000804,ACC-790660,CUST_879,15-09-2024,09-18-2024,GBP/USD,British Pound US Dollar,SELL,393396,1.293,$508855.27,USD,45.01,8033.10,Joint,BRK003,FOREX,2024-09-15T16:02:18Z,Dividend reinvestment,Med
TXN000805,ACC-597567,CUST_850,01 August 2024,,ORCL,Oracle Corporation,DIVIDEND,995,$1.6444,"1,636.16",USD,34.54,0.00,Trust,BRK003,NYSE,2024-08-01T09:52:14Z,Market timing,
TXN000806,ACC-656524,CUST_235,01-21-2024,2024.01.22,DIS,The Walt Disney Company,SELL,39,86.433,3370.88,USD,45.12,58.03,Joint,BRK004,NYSE,2024-01-21T13:49:38Z,Portfolio diversification,Low
TXN000807,ACC-660033,CUST_678,09-10-2024,11-Oct-2024,KO,The Coca-Cola Company,BUY,336,$56.7724,-19075.52,USD,15.01,0.00,Trust,BRK001,NYSE,2024-10-09T12:30:01Z,,MEDIUM
TXN000808,ACC-804444,CUST_264,31/07/2024,01-Aug-2024,CRM,Salesforce Inc,SELL,478,207.81,$99332.39,USD,19.44,1527.07,Individual,BRK001,NYSE,2024-07-31T10:54:59Z,,High
TXN000809,ACC-916489,CUST_789,18/05/2024,21 May 2024,TSLA,Tesla Inc,SELL,247,$241.29,$59599.51,USD,38.40,372.44,Individual,BRK003,NASDAQ,2024-05-18T15:51:12Z,Dollar cost averaging,High
TXN000810,ACC-166514,CUST_167,15-Mar-2024,,META,Meta Platforms Inc,DIVIDEND,597,1.051,627.71,USD,54.56,0.00,Corporate,BRK001,NASDAQ,2024-03-15T15:50:48Z,Estate planning,MEDIUM
TXN000811,ACC-299380,CUST_636,22 November 2024,,KO,The Coca-Cola Company,DIVIDEND,118,$4.88,576.20,USD,42.23,0.00,Trust,BRK005,NYSE,2024-11-22T15:20:41Z,Long-term investment,HIGH
TXN000812,ACC-698673,CUST_364,09-Jan-2024,10-Jan-2024,XOM,Exxon Mobil Corp,SELL,44,$116.5502,$5128.21,USD,11.70,0.00,Joint,BRK005,NYSE,2024-01-09T11:30:31Z,Risk management,Medium
TXN000813,ACC-134057,CUST_806,22-Nov-2024,24-11-2024,JPM,JPMorgan Chase & Co,SELL,55,141.558,"$7,785.67",USD,7.75,151.52,Retirement,BRK003,NYSE,2024-11-22T11:17:21Z,Short-term trade,low
TXN000814,ACC-178760,CUST_511,06-06-2024,,BTC-USD,Bitcoin USD,BUY,1.848577,$44980.4326,"$-83,149.78",USD,9.65,0.00,Retirement,BRK005,CRYPTO,2024-06-06T14:07:06Z,Estate planning,Medium
TXN000815,ACC-291489,CUST_591,04/18/2024,04/21/2024,JPM,JPMorgan Chase & Co,BUY,282,$172.4631,"-48,634.59",USD,51.76,,Joint,BRK003,NYSE,2024-04-18T13:06:57Z,Long-term investment,Med
TXN000816,ACC-449455,CUST_276,27/01/2024,2024-01-30,MSFT,Microsoft Corporation,BUY,245,312.82,$-76640.76,USD,7.13,0.00,Corporate,BRK004,NASDAQ,2024-01-27T10:16:10Z,Risk management,Med
TXN000817,ACC-294122,CUST_665,10/18/2024,21/10/2024,XOM,Exxon Mobil Corp,BUY,491,99.23,"-48,724.01",USD,46.11,0.00,Joint,BRK002,NYSE,2024-10-18T09:43:33Z,Market timing,low
TXN000818,ACC-162255,CUST_441,2024.04.18,,NVDA,NVIDIA Corporation,DIVIDEND,189,2.082151,$393.53,USD,34.54,0.00,Joint,BRK003,NASDAQ,2024-04-18T12:39:54Z,Year-end selling,
TXN000819,ACC-621852,CUST_2,2024.02.28,02/03/2024,GLD,SPDR Gold Shares,BUY,417,$203.06,"-84,677.96",USD,37.04,0.00,Individual,BRK002,NYSE ARCA,2024-02-28T09:14:15Z,Year-end selling,High
TXN000820,ACC-328731,CUST_284,2024-02-27,2024-03-01,XOM,Exxon Mobil Corp,BUY,175,$105.3339,"-18,433.43",USD,15.32,0.00,Retirement,BRK002,NYSE,2024-02-27T14:20:26Z,Risk management,Medium
TXN000821,ACC-999422,CUST_651,03-15-2024,03-18-2024,VTI,Vanguard Total Stock Market ETF,SELL,486,224.495667,"$109,104.89",USD,18.69,0.00,Individual,BRK004,NYSE ARCA,2024-03-15T11:03:50Z,Long-term investment,HIGH
TXN000822,ACC-215780,CUST_903,27/05/2024,28 May 2024,WFC,Wells Fargo & Co,SELL,272,50.71,"13,794.18",USD,8.26,131.71,Retirement,BRK004,NYSE,2024-05-27T13:53:30Z,Dollar cost averaging,Very High
TXN000823,ACC-331279,CUST_449,2024-03-09,03-11-2024,KO,The Coca-Cola Company,BUY,283,64.865,"$-18,356.78",USD,30.48,0.00,Retirement,BRK001,NYSE,2024-03-09T14:33:16Z,Dollar cost averaging,
TXN000824,ACC-121285,CUST_65,10/17/2024,18/10/2024,JPM,JPMorgan Chase & Co,SELL,271,$165.1008,"44,742.31",USD,5.17,443.43,Joint,BRK004,NYSE,2024-10-17T09:30:12Z,,MEDIUM
TXN000825,ACC-363368,CUST_713,05-19-2024,22-May-2024,XOM,Exxon Mobil Corp,SELL,242,97.402,$23571.34,USD,36.23,232.67,Corporate,BRK003,NYSE,2024-05-19T12:34:21Z,Dividend reinvestment,HIGH
TXN000826,ACC-823233,CUST_79,22/02/2024,23 February 2024,JPM,JPMorgan Chase & Co,SELL,379,$156.4944,$59311.38,USD,8.63,1164.81,Trust,BRK002,NYSE,2024-02-22T12:13:23Z,,Very High
TXN000827,ACC-716038,CUST_419,02-03-2024,,XOM,Exxon Mobil Corp,DIVIDEND,964,1.12,$1084.03,USD,22.04,0.00,Retirement,BRK005,NYSE,2024-03-02T10:51:16Z,Risk management,Medium
TXN000828,ACC-390541,CUST_555,2024-03-26,2024.03.27,ORCL,Oracle Corporation,SELL,52,126.62,$6584.45,USD,9.44,124.26,Corporate,BRK001,NYSE,2024-03-26T14:59:22Z,Risk management,low
TXN000829,ACC-874793,CUST_100,2024-11-17,11-18-2024,CVX,Chevron Corporation,SELL,376,$162.12,60958.72,USD,13.97,485.52,Corporate,BRK004,NYSE,2024-11-17T16:14:39Z,,Low
TXN000830,ACC-484452,CUST_643,2024.06.02,,AMZN,Amazon.com Inc,DIVIDEND,972,$0.88,854.81,USD,23.90,0.00,Retirement,BRK003,NASDAQ,2024-06-02T11:43:53Z,Short-term trade,Low
TXN000831,ACC-261207,CUST_426,2024.02.25,,JPM,JPMorgan Chase & Co,DIVIDEND,322,3.597,1158.27,USD,40.69,0.00,Joint,BRK005,NYSE,2024-02-25T16:10:53Z,Risk management,MEDIUM
TXN000832,ACC-545525,CUST_177,08 November 2024,2024-11-09,BAC,Bank of America Corp,SELL,152,$28.93,"4,396.66",USD,23.78,83.14,Joint,BRK001,NYSE,2024-11-08T09:14:47Z,,High
TXN000833,ACC-513775,CUST_932,28/11/2024,,GOOGL,Alphabet Inc Class A,DIVIDEND,946,1.236,$1169.09,USD,11.32,0.00,Individual,BRK005,NASDAQ,2024-11-28T10:15:34Z,Tax loss harvesting,Med
TXN000834,ACC-448206,CUST_563,10/03/2024,11/03/2024,GOOGL,Alphabet Inc Class A,SELL,113,$168.1722,"19,003.46",USD,39.94,0.00,Retirement,BRK005,NASDAQ,2024-03-10T10:27:46Z,Short-term trade,HIGH
TXN000835,ACC-389733,CUST_868,2024-06-21,2024-06-24,GOOGL,Alphabet Inc Class A,BUY,371,$171.77,"-63,727.84",USD,6.52,0.00,Corporate,BRK002,NASDAQ,2024-06-21T10:44:12Z,Estate planning,Medium
TXN000836,ACC-665215,CUST_664,2024-07-09,,PEP,PepsiCo Inc,DIVIDEND,669,$0.2266,$151.61,USD,12.49,0.00,Corporate,BRK003,NASDAQ,2024-07-09T10:50:58Z,Dollar cost averaging,low
TXN000837,ACC-672286,CUST_833,16 March 2024,17/03/2024,WFC,Wells Fargo & Co,SELL,391,$38.51,$15059.17,USD,19.45,84.89,Trust,BRK004,NYSE,2024-03-16T15:29:01Z,,Low
TXN000838,ACC-794196,CUST_268,2024.05.05,,QQQ,Invesco QQQ Trust,DIVIDEND,420,$3.6471,1531.78,USD,18.75,0.00,Retirement,BRK004,NASDAQ,2024-05-05T10:15:26Z,,low
TXN000839,ACC-487518,CUST_678,26-Jan-2024,2024-01-28,WFC,Wells Fargo & Co,BUY,21,46.050867,$-967.07,USD,36.25,0.00,Individual,BRK004,NYSE,2024-01-26T12:26:38Z,Risk management,Very High
TXN000840,ACC-117819,CUST_791,15/11/2024,,AMZN,Amazon.com Inc,BUY,476,$172.08,"$-81,909.96",USD,11.12,0.00,Trust,BRK003,NASDAQ,2024-11-15T10:56:35Z,Year-end selling,Med
TXN000841,ACC-371226,CUST_986,25/11/2024,11-26-2024,BOND_10Y,US Treasury 10 Year,SELL,392,98.78,"$38,722.10",USD,14.38,425.77,Retirement,BRK002,BOND,2024-11-25T11:44:25Z,Dollar cost averaging,Medium
TXN000842,ACC-527442,CUST_305,2024-03-22,23-Mar-2024,JPM,JPMorgan Chase & Co,SELL,433,168.889979,73129.36,USD,31.42,705.24,Corporate,BRK001,NYSE,2024-03-22T09:52:24Z,,HIGH
TXN000843,ACC-471904,CUST_969,10-07-2024,11-Jul-2024,NFLX,Netflix Inc,BUY,350,$400.9896,$-140346.36,USD,14.35,0.00,Retirement,BRK001,NASDAQ,2024-07-10T16:24:19Z,Dollar cost averaging,Medium
TXN000844,ACC-866278,CUST_112,07-07-2024,,BOND_10Y,US Treasury 10 Year,DIVIDEND,232,$4.1690,967.22,USD,18.77,0.00,Retirement,BRK004,BOND,2024-07-07T14:02:18Z,Long-term investment,Low
TXN000845,ACC-326632,CUST_214,06-30-2024,,DIS,The Walt Disney Company,DIVIDEND,372,4.429053,$1647.61,USD,11.11,0.00,Retirement,BRK002,NYSE,2024-06-30T10:06:45Z,Risk management,Medium
TXN000846,ACC-735915,CUST_1000,04-11-2024,12 April 2024,GLD,SPDR Gold Shares,BUY,208,188.671,"-39,243.63",USD,37.20,0.00,Retirement,BRK001,NYSE ARCA,2024-04-11T09:46:04Z,Estate planning,low
TXN000847,ACC-443346,CUST_399,18 February 2024,2024-02-21,GBP/USD,British Pound US Dollar,SELL,106903,1.25,$133742.84,USD,15.44,0.00,Individual,BRK005,FOREX,2024-02-18T14:49:26Z,,Medium
TXN000848,ACC-495618,CUST_342,29 August 2024,,BAC,Bank of America Corp,DIVIDEND,660,$0.69,$453.11,USD,41.24,0.00,Trust,BRK001,NYSE,2024-08-29T15:23:39Z,Rebalancing,Very High
TXN000849,ACC-174357,CUST_828,04-03-2024,,TSLA,Tesla Inc,DIVIDEND,286,2.05,584.96,USD,28.87,,Individual,BRK005,NASDAQ,2024-03-04T15:12:10Z,Rebalancing,High
TXN000850,ACC-573213,CUST_282,20-Jun-2024,21-06-2024,BTC-USD,Bitcoin USD,BUY,5.361514,39551.835792,$-212057.73,USD,52.03,0.00,Individual,BRK003,CRYPTO,2024-06-20T14:15:31Z,Dividend reinvestment,Low
TXN000851,ACC-200647,CUST_120,2024.03.06,2024-03-07,KO,The Coca-Cola Company,BUY,105,$60.2026,-6321.27,USD,23.07,,Trust,BRK005,NYSE,2024-03-06T09:24:09Z,Short-term trade,Medium
TXN000852,ACC-284033,CUST_787,21-04-2024,23/04/2024,CRM,Salesforce Inc,SELL,56,234.90,"$13,154.36",USD,29.27,149.53,Joint,BRK002,NYSE,2024-04-21T13:18:47Z,Short-term trade,Very High
TXN000853,ACC-681467,CUST_6,27 September 2024,28 September 2024,KO,The Coca-Cola Company,BUY,468,$63.63,$-29778.06,USD,32.51,0.00,Joint,BRK002,NYSE,2024-09-27T09:13:14Z,Market timing,low
TXN000854,ACC-488563,CUST_463,2024-12-19,12/22/2024,SLV,iShares Silver Trust,BUY,147,28.033,"-4,120.83",USD,33.70,0.00,Individual,BRK004,NYSE ARCA,2024-12-19T11:25:48Z,Market timing,
TXN000855,ACC-700535,CUST_828,11-07-2024,,DIS,The Walt Disney Company,DIVIDEND,827,3.041522,2515.34,USD,41.49,0.00,Trust,BRK001,NYSE,2024-07-11T13:09:34Z,Market timing,Med
TXN000856,ACC-692801,CUST_106,2024-05-30,,KO,The Coca-Cola Company,DIVIDEND,633,3.13,"$1,982.58",USD,53.74,0.00,Retirement,BRK002,NYSE,2024-05-30T10:11:53Z,,Very High
TXN000857,ACC-913976,CUST_993,2024.08.08,,GLD,SPDR Gold Shares,DIVIDEND,106,$2.10,222.42,USD,39.98,0.00,Joint,BRK004,NYSE ARCA,2024-08-08T15:40:07Z,Dividend reinvestment,High
TXN000858,ACC-326394,CUST_317,10-14-2024,,GBP/USD,British Pound US Dollar,DIVIDEND,736,$3.35,"$2,463.00",USD,50.39,0.00,Retirement,BRK005,FOREX,2024-10-14T09:53:52Z,,High
TXN000859,ACC-795817,CUST_121,2024.03.13,2024.03.14,SPY,SPDR S&P 500 ETF,BUY,184,$459.0512,"-84,465.42",USD,32.23,0.00,Retirement,BRK004,NYSE ARCA,2024-03-13T10:50:35Z,Dividend reinvestment,
TXN000860,ACC-969494,CUST_222,08 January 2024,11/01/2024,PEP,PepsiCo Inc,SELL,414,175.330,"$72,586.55",USD,31.43,1430.47,Individual,BRK003,NASDAQ,2024-01-08T13:25:34Z,,Very High
TXN000861,ACC-991041,CUST_522,2024-05-19,20 May 2024,NFLX,Netflix Inc,BUY,1,462.849927,-462.85,USD,5.33,,Joint,BRK004,NASDAQ,2024-05-19T15:04:03Z,,low
TXN000862,ACC-800779,CUST_198,09-Nov-2024,,DIS,The Walt Disney Company,BUY,271,86.986673,-23573.39,USD,7.80,0.00,Corporate,BRK001,NYSE,2024-11-09T10:54:47Z,Portfolio diversification,
TXN000863,ACC-647155,CUST_201,25 October 2024,26-Oct-2024,XOM,Exxon Mobil Corp,SELL,144,100.512769,"14,473.84",USD,18.51,168.04,Joint,BRK003,NYSE,2024-10-25T11:03:45Z,Rebalancing,low
TXN000864,ACC-804007,CUST_134,01/11/2024,02 November 2024,QQQ,Invesco QQQ Trust,BUY,423,422.498817,"$-178,717.00",USD,28.71,,Trust,BRK001,NASDAQ,2024-11-01T10:49:49Z,,High
TXN000865,ACC-304753,CUST_204,13 April 2024,15-Apr-2024,JPM,JPMorgan Chase & Co,BUY,88,168.60,$-14836.51,USD,15.13,,Trust,BRK001,NYSE,2024-04-13T10:29:00Z,,HIGH
TXN000866,ACC-271319,CUST_1,07/13/2024,16-Jul-2024,JPM,JPMorgan Chase & Co,SELL,254,$145.2943,$36904.74,USD,32.31,392.66,Retirement,BRK002,NYSE,2024-07-13T10:57:42Z,Dollar cost averaging,HIGH
TXN000867,ACC-861252,CUST_985,27-Mar-2024,2024-03-29,GOOGL,Alphabet Inc Class A,BUY,49,$178.38,"-8,740.85",USD,26.56,0.00,Corporate,BRK001,NASDAQ,2024-03-27T16:13:43Z,,Very High
TXN000868,ACC-213542,CUST_950,13 March 2024,14/03/2024,PFE,Pfizer Inc,SELL,427,25.752,"10,996.01",USD,13.07,0.00,Trust,BRK005,NYSE,2024-03-13T11:06:40Z,,Med
TXN000869,ACC-672653,CUST_349,08 September 2024,09-09-2024,JPM,JPMorgan Chase & Co,SELL,435,$175.07,"76,153.59",USD,30.77,1518.41,Trust,BRK001,NYSE,2024-09-08T12:36:48Z,Year-end selling,MEDIUM
TXN000870,ACC-923769,CUST_720,2024.10.28,,VTI,Vanguard Total Stock Market ETF,DIVIDEND,171,$2.32,$397.15,USD,40.01,0.00,Trust,BRK004,NYSE ARCA,2024-10-28T15:33:49Z,,Very High
TXN000871,ACC-494387,CUST_554,03/14/2024,17-Mar-2024,CVX,Chevron Corporation,BUY,82,$149.8367,"-12,286.61",USD,9.31,0.00,Trust,BRK003,NYSE,2024-03-14T14:34:28Z,Quarterly rebalancing,Low
TXN000872,ACC-868071,CUST_75,24/09/2024,,MSFT,Microsoft Corporation,DIVIDEND,631,$2.0499,$1293.46,USD,27.84,0.00,Joint,BRK001,NASDAQ,2024-09-24T13:15:27Z,Risk management,Med
TXN000873,ACC-233037,CUST_914,20-Jan-2024,01-23-2024,PEP,PepsiCo Inc,BUY,278,173.246,"$-48,162.46",USD,26.66,0.00,Joint,BRK003,NASDAQ,2024-01-20T13:41:08Z,,Med
TXN000874,ACC-739348,CUST_525,10/10/2024,12 October 2024,XOM,Exxon Mobil Corp,BUY,385,119.06075,"-45,838.39",USD,50.65,0.00,Trust,BRK001,NYSE,2024-10-10T11:15:57Z,Portfolio diversification,MEDIUM
TXN000875,ACC-906467,CUST_996,02/12/2024,,AAPL,Apple Inc,DIVIDEND,439,3.923,"1,722.29",USD,53.18,0.00,Individual,BRK004,NASDAQ,2024-12-02T16:24:34Z,,HIGH
TXN000876,ACC-853443,CUST_866,19/03/2024,,SPY,SPDR S&P 500 ETF,DIVIDEND,555,4.97,"$2,759.20",USD,6.91,,Joint,BRK003,NYSE ARCA,2024-03-19T09:25:41Z,,Med
TXN000877,ACC-382410,CUST_905,16-Jan-2024,19-Jan-2024,KO,The Coca-Cola Company,SELL,292,61.856,"18,061.99",USD,6.92,135.80,Joint,BRK002,NYSE,2024-01-16T14:17:16Z,,MEDIUM
TXN000878,ACC-583064,CUST_608,07-20-2024,23-07-2024,AMZN,Amazon.com Inc,SELL,127,$147.43,"$18,723.30",USD,36.70,243.23,Joint,BRK003,NASDAQ,2024-07-20T12:55:12Z,Market timing,low
TXN000879,ACC-524569,CUST_169,05/13/2024,,CVX,Chevron Corporation,DIVIDEND,241,2.712,653.57,USD,21.89,0.00,Trust,BRK002,NYSE,2024-05-13T15:10:36Z,,MEDIUM
TXN000880,ACC-333067,CUST_352,28-Sep-2024,10/01/2024,TSLA,Tesla Inc,BUY,201,247.192,"$-49,685.60",USD,23.46,0.00,Individual,BRK004,NASDAQ,2024-09-28T13:24:54Z,Long-term investment,Med
TXN000881,ACC-910552,CUST_697,27-05-2024,05/30/2024,JPM,JPMorgan Chase & Co,BUY,458,175.11,"$-80,200.38",USD,30.62,0.00,Joint,BRK001,NYSE,2024-05-27T16:38:30Z,,Medium
TXN000882,ACC-382207,CUST_813,01/20/2024,01/22/2024,DIS,The Walt Disney Company,SELL,233,94.757,$22078.47,USD,10.38,177.39,Retirement,BRK002,NYSE,2024-01-20T12:52:26Z,,MEDIUM
TXN000883,ACC-349717,CUST_818,06 August 2024,,NFLX,Netflix Inc,SELL,137,493.970032,$67673.89,USD,52.64,1215.69,Individual,BRK003,NASDAQ,2024-08-06T09:49:22Z,,Medium
TXN000884,ACC-829891,CUST_606,25 September 2024,26 September 2024,BOND_10Y,US Treasury 10 Year,BUY,185,95.067,"-17,587.44",USD,11.49,0.00,Joint,BRK005,BOND,2024-09-25T14:25:10Z,Tax loss harvesting,Med
TXN000885,ACC-440215,CUST_885,2024.10.25,27-10-2024,PEP,PepsiCo Inc,SELL,71,177.252,"$12,584.88",USD,29.64,126.59,Corporate,BRK005,NASDAQ,2024-10-25T15:23:50Z,Estate planning,MEDIUM
TXN000886,ACC-286410,CUST_515,06-03-2024,2024.03.09,SLV,iShares Silver Trust,BUY,14,29.854,-417.95,USD,11.81,,Individual,BRK001,NYSE ARCA,2024-03-06T11:51:19Z,Profit taking,Low
TXN000887,ACC-347905,CUST_135,11/25/2024,11-26-2024,PEP,PepsiCo Inc,SELL,175,160.111,"28,019.49",USD,29.03,406.32,Trust,BRK005,NASDAQ,2024-11-25T10:18:19Z,,High
TXN000888,ACC-504567,CUST_601,13 November 2024,11-16-2024,AMZN,Amazon.com Inc,SELL,461,156.92,"$72,341.45",USD,36.87,1391.98,Trust,BRK002,NASDAQ,2024-11-13T11:23:54Z,Year-end selling,Low
TXN000889,ACC-401898,CUST_215,02-05-2024,06/02/2024,PEP,PepsiCo Inc,BUY,33,$163.81,$-5405.68,USD,11.31,0.00,Joint,BRK002,NASDAQ,2024-02-05T13:39:05Z,,Low
TXN000890,ACC-535544,CUST_269,07/09/2024,,NVDA,NVIDIA Corporation,DIVIDEND,403,0.22,$88.14,USD,13.25,0.00,Trust,BRK004,NASDAQ,2024-09-07T10:42:29Z,,Med
TXN000891,ACC-436434,CUST_267,04-07-2024,2024-07-07,EUR/USD,Euro US Dollar,BUY,334330,1.07,"-358,662.67",USD,9.51,0.00,Trust,BRK004,FOREX,2024-07-04T12:46:06Z,Risk management,Med
TXN000892,ACC-776772,CUST_481,03/30/2024,,ETH-USD,Ethereum USD,DIVIDEND,503,3.957,1990.54,USD,41.42,0.00,Joint,BRK005,CRYPTO,2024-03-30T09:20:11Z,,High
TXN000893,ACC-279508,CUST_979,2024.02.21,02/24/2024,PEP,PepsiCo Inc,SELL,121,172.80715,$20909.67,USD,32.66,385.80,Corporate,BRK003,NASDAQ,2024-02-21T12:20:35Z,Dollar cost averaging,Very High
TXN000894,ACC-612861,CUST_743,26 November 2024,,PFE,Pfizer Inc,DIVIDEND,274,0.891652,$244.31,USD,24.65,0.00,Retirement,BRK001,NYSE,2024-11-26T13:55:16Z,Estate planning,MEDIUM
TXN000895,ACC-568531,CUST_619,25 October 2024,10/27/2024,AAPL,Apple Inc,BUY,170,$158.1045,-26877.76,USD,17.32,0.00,Joint,BRK004,NASDAQ,2024-10-25T16:46:07Z,,Med
TXN000896,ACC-685432,CUST_969,09-22-2024,,AMZN,Amazon.com Inc,BUY,498,167.009,"-83,170.39",USD,9.93,0.00,Corporate,BRK004,NASDAQ,2024-09-22T12:11:02Z,Dollar cost averaging,Low
TXN000897,ACC-819338,CUST_907,26 August 2024,,QQQ,Invesco QQQ Trust,DIVIDEND,807,$3.64,2935.88,USD,48.93,,Joint,BRK003,NASDAQ,2024-08-26T12:40:34Z,Long-term investment,High
TXN000898,ACC-416778,CUST_242,07/17/2024,,DIS,The Walt Disney Company,DIVIDEND,637,1.672,1064.81,USD,28.01,0.00,Corporate,BRK002,NYSE,2024-07-17T10:01:49Z,,Very High
TXN000899,ACC-865215,CUST_965,27-Oct-2024,28 October 2024,CVX,Chevron Corporation,BUY,445,148.32,"-66,000.41",USD,41.75,,Retirement,BRK001,NYSE,2024-10-27T09:36:26Z,Short-term trade,Very High
TXN000900,ACC-220764,CUST_149,2024-07-22,07-23-2024,XOM,Exxon Mobil Corp,BUY,444,$98.94,$-43927.19,USD,39.34,0.00,Trust,BRK004,NYSE,2024-07-22T11:03:07Z,Year-end selling,HIGH
TXN000901,ACC-522257,CUST_108,07/03/2024,08 March 2024,GOOGL,Alphabet Inc Class A,BUY,176,$128.16,"$-22,556.02",USD,38.09,0.00,Joint,BRK004,NASDAQ,2024-03-07T12:59:39Z,Profit taking,Very High
TXN000902,ACC-552406,CUST_390,06-21-2024,23-06-2024,BOND_10Y,US Treasury 10 Year,BUY,54,102.766488,-5549.39,USD,12.48,0.00,Corporate,BRK002,BOND,2024-06-21T10:18:01Z,Quarterly rebalancing,Medium
TXN000903,ACC-109166,CUST_591,06-Dec-2024,08/12/2024,AMZN,Amazon.com Inc,BUY,422,140.68,"$-59,368.90",USD,34.57,0.00,Corporate,BRK003,NASDAQ,2024-12-06T10:51:47Z,Long-term investment,low
TXN000904,ACC-828299,CUST_598,2024-09-11,09/13/2024,KO,The Coca-Cola Company,BUY,98,56.42,$-5529.04,USD,26.19,0.00,Corporate,BRK005,NYSE,2024-09-11T14:24:19Z,Rebalancing,MEDIUM
TXN000905,ACC-178589,CUST_910,2024-03-20,03/22/2024,AMZN,Amazon.com Inc,SELL,83,154.472903,$12821.25,USD,28.97,117.56,Retirement,BRK005,NASDAQ,2024-03-20T16:46:46Z,Dividend reinvestment,Low
TXN000906,ACC-532371,CUST_234,07/03/2024,08-Mar-2024,NFLX,Netflix Inc,SELL,488,397.915,"$194,182.65",USD,48.20,2964.53,Individual,BRK002,NASDAQ,2024-03-07T09:15:03Z,,
TXN000907,ACC-525239,CUST_980,11 September 2024,09/13/2024,QQQ,Invesco QQQ Trust,SELL,303,$387.0888,"117,287.91",USD,38.85,1240.85,Trust,BRK002,NASDAQ,2024-09-11T13:30:53Z,,Very High
TXN000908,ACC-555275,CUST_3,2024-02-26,02/29/2024,BOND_10Y,US Treasury 10 Year,BUY,14,$95.39,"-1,335.42",USD,45.30,0.00,Trust,BRK005,BOND,2024-02-26T10:28:25Z,,Very High
TXN000909,ACC-641358,CUST_44,2024-10-05,08-Oct-2024,GBP/USD,British Pound US Dollar,BUY,87663,1.294776,$-113503.96,USD,34.64,0.00,Individual,BRK003,FOREX,2024-10-05T16:05:12Z,Dividend reinvestment,Low
TXN000910,ACC-584385,CUST_730,27-Apr-2024,29-Apr-2024,MSFT,Microsoft Corporation,BUY,489,$416.40,"-203,617.80",USD,18.78,0.00,Corporate,BRK002,NASDAQ,2024-04-27T11:07:45Z,,low
TXN000911,ACC-657519,CUST_881,27-Sep-2024,30-09-2024,ETH-USD,Ethereum USD,SELL,2.046414,$2992.3483,"6,123.58",USD,33.06,122.45,Retirement,BRK005,CRYPTO,2024-09-27T11:52:51Z,Portfolio diversification,low
TXN000912,ACC-512744,CUST_448,03/17/2024,,QQQ,Invesco QQQ Trust,DIVIDEND,296,$4.1704,"$1,234.44",USD,39.97,0.00,Trust,BRK001,NASDAQ,2024-03-17T09:17:25Z,Short-term trade,Low
TXN000913,ACC-126144,CUST_774,02/04/2024,07 February 2024,GOOGL,Alphabet Inc Class A,SELL,130,$127.4594,$16569.72,USD,6.87,148.14,Retirement,BRK005,NASDAQ,2024-02-04T10:52:45Z,Year-end selling,Med
TXN000914,ACC-430350,CUST_256,12/07/2024,,SPY,SPDR S&P 500 ETF,BUY,257,461.06,$-118491.35,USD,6.89,0.00,Joint,BRK003,NYSE ARCA,2024-12-07T15:50:38Z,Portfolio diversification,HIGH
TXN000915,ACC-718992,CUST_450,12/16/2024,19-12-2024,DIS,The Walt Disney Company,SELL,465,88.06,40948.67,USD,24.10,0.00,Retirement,BRK004,NYSE,2024-12-16T09:31:30Z,Profit taking,
TXN000916,ACC-558116,CUST_188,17-04-2024,,GLD,SPDR Gold Shares,DIVIDEND,675,2.285733,1542.87,USD,5.73,0.00,Corporate,BRK002,NYSE ARCA,2024-04-17T11:01:13Z,Risk management,low
TXN000917,ACC-530694,CUST_57,2024-03-22,,XOM,Exxon Mobil Corp,DIVIDEND,147,4.263,626.68,USD,50.10,0.00,Joint,BRK001,NYSE,2024-03-22T14:43:44Z,Market timing,Very High
TXN000918,ACC-217395,CUST_86,2024-08-15,,PFE,Pfizer Inc,DIVIDEND,651,4.83,$3142.02,USD,51.39,0.00,Joint,BRK001,NYSE,2024-08-15T15:57:16Z,Rebalancing,Medium
TXN000919,ACC-473346,CUST_535,09-19-2024,21 September 2024,GLD,SPDR Gold Shares,SELL,277,217.30,60192.18,USD,13.63,535.26,Individual,BRK004,NYSE ARCA,2024-09-19T14:30:42Z,,HIGH
TXN000920,ACC-498720,CUST_577,13-02-2024,02/16/2024,SLV,iShares Silver Trust,SELL,262,29.341487,$7687.47,USD,49.55,106.52,Retirement,BRK005,NYSE ARCA,2024-02-13T11:29:46Z,Market timing,low
TXN000921,ACC-380110,CUST_45,28-Oct-2024,,JPM,JPMorgan Chase & Co,DIVIDEND,976,3.97,3877.95,USD,44.51,0.00,Trust,BRK001,NYSE,2024-10-28T15:02:31Z,Quarterly rebalancing,MEDIUM
TXN000922,ACC-806942,CUST_916,12-19-2024,,SPY,SPDR S&P 500 ETF,DIVIDEND,159,$3.9173,622.84,USD,28.01,0.00,Trust,BRK002,NYSE ARCA,2024-12-19T09:56:38Z,Year-end selling,
TXN000923,ACC-360733,CUST_738,2024.05.15,17/05/2024,AAPL,Apple Inc,SELL,6,153.238,919.43,USD,12.65,9.92,Retirement,BRK003,NASDAQ,2024-05-15T15:17:34Z,Long-term investment,Very High
TXN000924,ACC-378835,CUST_548,07-23-2024,24-07-2024,SLV,iShares Silver Trust,BUY,78,$23.9519,$-1868.25,USD,54.53,0.00,Joint,BRK004,NYSE ARCA,2024-07-23T15:01:39Z,Short-term trade,Medium
TXN000925,ACC-969999,CUST_116,10-27-2024,,QQQ,Invesco QQQ Trust,DIVIDEND,664,$3.2365,2149.02,USD,13.16,0.00,Retirement,BRK004,NASDAQ,2024-10-27T12:13:30Z,Long-term investment,Medium
TXN000926,ACC-145918,CUST_941,10-May-2024,,BOND_10Y,US Treasury 10 Year,DIVIDEND,390,3.921,$1529.12,USD,40.02,0.00,Retirement,BRK003,BOND,2024-05-10T13:31:09Z,,
TXN000927,ACC-781874,CUST_33,08-04-2024,2024.04.10,BAC,Bank of America Corp,BUY,241,41.903,$-10098.52,USD,42.78,0.00,Trust,BRK001,NYSE,2024-04-08T11:44:16Z,Market timing,Med
TXN000928,ACC-864921,CUST_3,24 July 2024,,DIS,The Walt Disney Company,DIVIDEND,328,0.490135,$160.76,USD,18.54,0.00,Joint,BRK001,NYSE,2024-07-24T14:39:11Z,Quarterly rebalancing,Very High
TXN000929,ACC-746413,CUST_680,10-02-2024,,JNJ,Johnson & Johnson,DIVIDEND,683,$2.79,$1907.49,USD,20.58,0.00,Joint,BRK004,NYSE,2024-10-02T10:20:21Z,Tax loss harvesting,
TXN000930,ACC-241314,CUST_740,02/11/2024,,GOOGL,Alphabet Inc Class A,DIVIDEND,419,$1.31,547.78,USD,51.44,0.00,Individual,BRK003,NASDAQ,2024-11-02T10:30:05Z,Year-end selling,Medium
TXN000931,ACC-663942,CUST_771,2024.10.11,13/10/2024,NVDA,NVIDIA Corporation,SELL,297,450.00,"$133,651.23",USD,18.00,780.15,Trust,BRK001,NASDAQ,2024-10-11T09:38:41Z,Dollar cost averaging,Low
TXN000932,ACC-656115,CUST_995,24-10-2024,2024.10.26,META,Meta Platforms Inc,BUY,141,302.361262,"$-42,632.94",USD,44.28,0.00,Joint,BRK005,NASDAQ,2024-10-24T15:31:26Z,,low
TXN000933,ACC-960032,CUST_810,08-Jun-2024,10-Jun-2024,BTC-USD,Bitcoin USD,SELL,0.292813,$53813.1285,"$15,757.18",USD,27.53,260.31,Retirement,BRK002,CRYPTO,2024-06-08T09:27:08Z,,Med
TXN000934,ACC-937738,CUST_415,14/07/2024,,NFLX,Netflix Inc,DIVIDEND,478,1.748886,835.97,USD,19.46,0.00,Individual,BRK004,NASDAQ,2024-07-14T14:14:59Z,,MEDIUM
TXN000935,ACC-224166,CUST_180,18-03-2024,20 March 2024,META,Meta Platforms Inc,SELL,69,246.592,"$17,014.88",USD,43.19,184.65,Individual,BRK001,NASDAQ,2024-03-18T13:45:06Z,,High
TXN000936,ACC-659319,CUST_817,2024.09.21,2024-09-24,GOOGL,Alphabet Inc Class A,BUY,302,126.501,"$-38,203.26",USD,30.81,0.00,Trust,BRK004,NASDAQ,2024-09-21T11:12:55Z,,HIGH
TXN000937,ACC-923754,CUST_919,07-01-2024,09-01-2024,ETH-USD,Ethereum USD,BUY,6.386302,3705.483588,"$-23,664.34",USD,26.25,0.00,Retirement,BRK001,CRYPTO,2024-01-07T09:13:33Z,,High
TXN000938,ACC-462512,CUST_714,2024.10.28,,NFLX,Netflix Inc,DIVIDEND,617,1.817,1120.93,USD,45.95,0.00,Retirement,BRK003,NASDAQ,2024-10-28T11:19:08Z,,
TXN000939,ACC-365518,CUST_371,2024-05-17,,GOOGL,Alphabet Inc Class A,DIVIDEND,310,1.60,495.06,USD,23.37,0.00,Trust,BRK003,NASDAQ,2024-05-17T12:54:56Z,,High
TXN000940,ACC-847556,CUST_459,26 May 2024,,CVX,Chevron Corporation,DIVIDEND,136,2.308676,313.98,USD,50.06,,Trust,BRK002,NYSE,2024-05-26T13:41:41Z,Rebalancing,Very High
TXN000941,ACC-973048,CUST_569,2024.10.02,04-Oct-2024,CVX,Chevron Corporation,BUY,336,161.43,$-54239.31,USD,32.15,0.00,Individual,BRK005,NYSE,2024-10-02T12:52:02Z,,low
TXN000942,ACC-931338,CUST_236,15/06/2024,,BAC,Bank of America Corp,DIVIDEND,388,4.254,"$1,650.58",USD,49.05,0.00,Individual,BRK001,NYSE,2024-06-15T10:45:55Z,Portfolio diversification,Medium
TXN000943,ACC-170213,CUST_863,05-Aug-2024,08-Aug-2024,META,Meta Platforms Inc,SELL,219,$239.25,"$52,395.29",USD,7.67,906.01,Corporate,BRK001,NASDAQ,2024-08-05T12:28:45Z,Short-term trade,HIGH
TXN000944,ACC-352626,CUST_660,11/01/2024,,AMZN,Amazon.com Inc,DIVIDEND,564,$2.61,"$1,472.72",USD,17.77,0.00,Joint,BRK004,NASDAQ,2024-11-01T11:56:56Z,Market timing,low
TXN000945,ACC-429779,CUST_493,23/10/2024,25/10/2024,DIS,The Walt Disney Company,SELL,120,92.61,11113.66,USD,6.82,0.00,Joint,BRK005,NYSE,2024-10-23T13:11:17Z,,low
TXN000946,ACC-270639,CUST_534,04-30-2024,01 May 2024,GLD,SPDR Gold Shares,BUY,472,181.20,-85527.98,USD,45.85,0.00,Joint,BRK002,NYSE ARCA,2024-04-30T09:45:36Z,Profit taking,High
TXN000947,ACC-955862,CUST_120,08/01/2024,01/09/2024,JPM,JPMorgan Chase & Co,BUY,198,167.667,"-33,197.99",USD,28.07,0.00,Trust,BRK001,NYSE,2024-01-08T09:32:53Z,Quarterly rebalancing,Low
TXN000948,ACC-227614,CUST_12,10/07/2024,10/09/2024,DIS,The Walt Disney Company,SELL,470,93.663,44021.57,USD,41.23,411.18,Corporate,BRK002,NYSE,2024-10-07T09:50:30Z,,Medium
TXN000949,ACC-304459,CUST_323,2024.06.07,,NFLX,Netflix Inc,DIVIDEND,742,$3.9715,"$2,946.87",USD,6.74,0.00,Retirement,BRK001,NASDAQ,2024-06-07T15:58:11Z,,HIGH
TXN000950,ACC-716904,CUST_389,08/12/2024,2024.08.13,SPY,SPDR S&P 500 ETF,BUY,460,$443.2851,$-203911.14,USD,38.42,0.00,Trust,BRK003,NYSE ARCA,2024-08-12T10:00:57Z,Tax loss harvesting,Medium
TXN000951,ACC-838281,CUST_861,25-04-2024,2024.04.26,AAPL,Apple Inc,SELL,473,180.705925,85473.90,USD,50.82,1220.50,Individual,BRK005,NASDAQ,2024-04-25T14:49:35Z,Dividend reinvestment,Low
TXN000952,ACC-408492,CUST_568,2024.03.13,,BOND_10Y,US Treasury 10 Year,DIVIDEND,686,2.086,$1430.83,USD,24.42,0.00,Trust,BRK001,BOND,2024-03-13T12:34:27Z,Risk management,Med
TXN000953,ACC-815263,CUST_677,24 November 2024,,PEP,PepsiCo Inc,DIVIDEND,81,1.918,155.35,USD,34.57,0.00,Retirement,BRK003,NASDAQ,2024-11-24T10:36:29Z,Long-term investment,HIGH
TXN000954,ACC-191200,CUST_136,08-Aug-2024,,ETH-USD,Ethereum USD,DIVIDEND,622,$4.17,"2,595.03",USD,14.34,0.00,Individual,BRK003,CRYPTO,2024-08-08T09:48:57Z,Rebalancing,Medium
TXN000955,ACC-635294,CUST_322,01 March 2024,02/03/2024,EUR/USD,Euro US Dollar,SELL,211901,1.084179,"$229,738.71",USD,35.11,1481.49,Joint,BRK002,FOREX,2024-03-01T10:38:45Z,Rebalancing,
TXN000956,ACC-285625,CUST_167,13 March 2024,,SPY,SPDR S&P 500 ETF,DIVIDEND,510,$0.3616,$184.43,USD,40.36,0.00,Corporate,BRK003,NYSE ARCA,2024-03-13T11:06:52Z,Quarterly rebalancing,
TXN000957,ACC-975569,CUST_47,2024.06.12,,KO,The Coca-Cola Company,DIVIDEND,915,2.932092,2682.86,USD,11.32,0.00,Corporate,BRK004,NYSE,2024-06-12T09:46:03Z,,Low
TXN000958,ACC-458792,CUST_420,2024-05-20,21-05-2024,ETH-USD,Ethereum USD,BUY,4.700557,3695.237,-17369.67,USD,13.88,0.00,Retirement,BRK005,CRYPTO,2024-05-20T13:00:03Z,,MEDIUM
TXN000959,ACC-374535,CUST_735,08-19-2024,2024.08.20,MSFT,Microsoft Corporation,BUY,278,$412.99,$-114811.69,USD,51.21,0.00,Corporate,BRK001,NASDAQ,2024-08-19T10:03:50Z,Risk management,HIGH
TXN000960,ACC-489862,CUST_999,01/01/2024,01/02/2024,NFLX,Netflix Inc,SELL,219,$397.25,"86,997.20",USD,9.04,1405.70,Retirement,BRK004,NASDAQ,2024-01-01T11:12:02Z,,Low
TXN000961,ACC-722485,CUST_322,2024-12-14,12/17/2024,AAPL,Apple Inc,SELL,294,193.862828,"$56,995.67",USD,44.26,564.74,Corporate,BRK002,NASDAQ,2024-12-14T16:26:37Z,Profit taking,High
TXN000962,ACC-237893,CUST_610,11-05-2024,05/14/2024,EUR/USD,Euro US Dollar,BUY,425776,$1.12,$-475657.16,USD,41.05,0.00,Retirement,BRK004,FOREX,2024-05-11T13:51:34Z,,Very High
TXN000963,ACC-147609,CUST_158,2024.06.29,,JPM,JPMorgan Chase & Co,DIVIDEND,529,4.473,$2366.09,USD,15.67,0.00,Corporate,BRK004,NYSE,2024-06-29T12:21:55Z,Dividend reinvestment,
TXN000964,ACC-386270,CUST_559,2024-08-10,08-13-2024,PFE,Pfizer Inc,SELL,129,$34.8973,"4,501.75",USD,49.55,56.50,Joint,BRK003,NYSE,2024-08-10T14:51:14Z,Estate planning,High
TXN000965,ACC-244598,CUST_554,25-Jan-2024,27-01-2024,SPY,SPDR S&P 500 ETF,BUY,202,470.469,-95034.70,USD,23.01,0.00,Joint,BRK003,NYSE ARCA,2024-01-25T10:23:25Z,,MEDIUM
TXN000966,ACC-110205,CUST_609,18-Jan-2024,20-01-2024,CRM,Salesforce Inc,SELL,342,258.45,"$88,389.76",USD,54.51,751.63,Individual,BRK001,NYSE,2024-01-18T15:06:38Z,Long-term investment,HIGH
TXN000967,ACC-944566,CUST_303,26 December 2024,,CVX,Chevron Corporation,SELL,87,161.08,14014.04,USD,36.69,200.61,Retirement,BRK003,NYSE,2024-12-26T10:43:11Z,Short-term trade,
TXN000968,ACC-559000,CUST_923,09-Jun-2024,,NFLX,Netflix Inc,BUY,389,$478.9897,"$-186,327.01",USD,45.62,0.00,Individual,BRK001,NASDAQ,2024-06-09T10:21:13Z,Rebalancing,MEDIUM
TXN000969,ACC-747637,CUST_348,17 January 2024,01/19/2024,WFC,Wells Fargo & Co,BUY,361,$50.2997,$-18158.19,USD,14.56,0.00,Retirement,BRK004,NYSE,2024-01-17T09:59:22Z,Market timing,Med
TXN000970,ACC-798799,CUST_770,2024-02-03,02-06-2024,AAPL,Apple Inc,SELL,396,$198.49,"$78,602.73",USD,41.07,1450.92,Individual,BRK001,NASDAQ,2024-02-03T14:08:02Z,Dividend reinvestment,
TXN000971,ACC-167538,CUST_74,04-10-2024,,XOM,Exxon Mobil Corp,DIVIDEND,276,4.953,"$1,367.13",USD,21.84,0.00,Joint,BRK005,NYSE,2024-10-04T14:22:48Z,Tax loss harvesting,High
TXN000972,ACC-478898,CUST_398,2024-02-06,2024-02-09,GOOGL,Alphabet Inc Class A,SELL,204,158.65,"32,364.09",USD,33.56,603.02,Joint,BRK001,NASDAQ,2024-02-06T15:45:28Z,Long-term investment,Medium
TXN000973,ACC-625288,CUST_274,21/12/2024,24-12-2024,JNJ,Johnson & Johnson,BUY,358,156.14,"$-55,896.38",USD,53.16,0.00,Corporate,BRK002,NYSE,2024-12-21T09:25:31Z,Estate planning,Low
TXN000974,ACC-328554,CUST_165,20-Nov-2024,,DIS,The Walt Disney Company,BUY,195,91.375,$-17818.22,USD,20.66,0.00,Retirement,BRK004,NYSE,2024-11-20T13:06:29Z,Rebalancing,High
TXN000975,ACC-793624,CUST_970,20/10/2024,10/21/2024,JPM,JPMorgan Chase & Co,BUY,404,140.609,"-56,806.17",USD,6.60,0.00,Individual,BRK004,NYSE,2024-10-20T14:15:00Z,Risk management,Low
TXN000976,ACC-354778,CUST_15,03/18/2024,19/03/2024,MSFT,Microsoft Corporation,SELL,4,$373.95,1495.81,USD,19.08,28.97,Trust,BRK003,NASDAQ,2024-03-18T16:20:54Z,Rebalancing,Med
TXN000977,ACC-722245,CUST_755,2024.10.30,10-31-2024,WFC,Wells Fargo & Co,BUY,412,$43.3816,"-17,873.22",USD,49.12,0.00,Individual,BRK002,NYSE,2024-10-30T14:22:33Z,,HIGH
TXN000978,ACC-125862,CUST_712,01/11/2024,03/11/2024,AAPL,Apple Inc,SELL,385,$161.28,"62,093.76",USD,32.54,712.32,Retirement,BRK001,NASDAQ,2024-11-01T10:22:58Z,Estate planning,High
TXN000979,ACC-857899,CUST_5,17-Dec-2024,2024.12.18,GLD,SPDR Gold Shares,BUY,191,$188.46,"-35,995.37",USD,21.62,0.00,Joint,BRK001,NYSE ARCA,2024-12-17T16:44:30Z,,MEDIUM
TXN000980,ACC-146616,CUST_726,26-Jan-2024,01-29-2024,ORCL,Oracle Corporation,BUY,193,$102.0151,$-19688.91,USD,35.43,0.00,Retirement,BRK005,NYSE,2024-01-26T11:51:32Z,,HIGH
TXN000981,ACC-638877,CUST_142,27 March 2024,,META,Meta Platforms Inc,BUY,315,$282.6800,"-89,044.19",USD,19.73,0.00,Retirement,BRK002,NASDAQ,2024-03-27T11:03:16Z,,High
TXN000982,ACC-786642,CUST_217,03/08/2024,03-10-2024,MSFT,Microsoft Corporation,SELL,345,384.13,132525.57,USD,11.33,688.56,Individual,BRK002,NASDAQ,2024-03-08T13:59:45Z,Profit taking,Low
TXN000983,ACC-851765,CUST_450,11-Sep-2024,09-12-2024,NFLX,Netflix Inc,BUY,100,$405.9396,"-40,593.96",USD,7.07,0.00,Retirement,BRK005,NASDAQ,2024-09-11T15:21:56Z,,Medium
TXN000984,ACC-815319,CUST_845,30-Jan-2024,,JNJ,Johnson & Johnson,DIVIDEND,898,$2.26,2025.76,USD,27.98,0.00,Trust,BRK005,NYSE,2024-01-30T12:08:49Z,,Medium
TXN000985,ACC-194014,CUST_426,12/15/2024,2024-12-18,EUR/USD,Euro US Dollar,SELL,93425,1.11,$103724.36,USD,34.10,858.06,Individual,BRK003,FOREX,2024-12-15T13:04:39Z,Rebalancing,Very High
TXN000986,ACC-940390,CUST_890,04/13/2024,,BTC-USD,Bitcoin USD,SELL,4.059222,$36955.70,"150,011.39",USD,49.24,1689.92,Trust,BRK004,CRYPTO,2024-04-13T15:14:44Z,Rebalancing,Low
TXN000987,ACC-479637,CUST_371,31-01-2024,02-02-2024,GLD,SPDR Gold Shares,SELL,226,206.241,"46,610.48",USD,53.27,370.33,Corporate,BRK005,NYSE ARCA,2024-01-31T12:36:26Z,Dollar cost averaging,Very High
TXN000988,ACC-275400,CUST_465,07/04/2024,04/09/2024,NFLX,Netflix Inc,BUY,496,363.27,$-180181.40,USD,12.34,0.00,Retirement,BRK004,NASDAQ,2024-04-07T14:41:35Z,Dollar cost averaging,High
TXN000989,ACC-991447,CUST_526,2024-11-21,,BOND_10Y,US Treasury 10 Year,DIVIDEND,658,$4.76,"3,129.99",USD,35.88,0.00,Joint,BRK004,BOND,2024-11-21T12:46:19Z,Year-end selling,High
TXN000990,ACC-310777,CUST_574,06-22-2024,24 June 2024,CRM,Salesforce Inc,BUY,96,277.93,$-26681.15,USD,49.45,0.00,Individual,BRK003,NYSE,2024-06-22T12:14:15Z,,Med
TXN000991,ACC-352586,CUST_80,10-Feb-2024,,NFLX,Netflix Inc,DIVIDEND,465,0.237148,$110.27,USD,54.01,0.00,Corporate,BRK003,NASDAQ,2024-02-10T15:58:44Z,Dollar cost averaging,HIGH
TXN000992,ACC-520873,CUST_601,30-12-2024,,PFE,Pfizer Inc,DIVIDEND,254,1.866,474.07,USD,17.00,0.00,Corporate,BRK005,NYSE,2024-12-30T13:25:24Z,Market timing,HIGH
TXN000993,ACC-166670,CUST_442,16-04-2024,18-Apr-2024,AMZN,Amazon.com Inc,BUY,358,140.88504,-50436.84,USD,50.41,0.00,Joint,BRK003,NASDAQ,2024-04-16T10:52:21Z,,
TXN000994,ACC-489247,CUST_590,2024.07.14,2024-07-15,WFC,Wells Fargo & Co,SELL,142,$44.0640,6257.09,USD,11.84,98.62,Individual,BRK003,NYSE,2024-07-14T15:07:59Z,Long-term investment,High
TXN000995,ACC-359850,CUST_812,2024.03.21,23-03-2024,DIS,The Walt Disney Company,BUY,415,$91.40,$-37932.96,USD,7.79,0.00,Joint,BRK004,NYSE,2024-03-21T16:14:06Z,Quarterly rebalancing,Very High
TXN000996,ACC-819594,CUST_749,03 March 2024,03/04/2024,GBP/USD,British Pound US Dollar,SELL,392672,$1.2579,493957.85,USD,32.45,0.00,Joint,BRK003,FOREX,2024-03-03T11:13:23Z,Quarterly rebalancing,MEDIUM
TXN000997,ACC-630040,CUST_817,23-08-2024,,BAC,Bank of America Corp,DIVIDEND,745,2.54,1892.65,USD,10.62,0.00,Retirement,BRK002,NYSE,2024-08-23T15:50:21Z,,Low
TXN000998,ACC-585280,CUST_464,2024.03.08,,VTI,Vanguard Total Stock Market ETF,DIVIDEND,242,$1.06,$255.41,USD,5.17,0.00,Corporate,BRK001,NYSE ARCA,2024-03-08T14:52:09Z,Risk management,Low
TXN000999,ACC-485338,CUST_334,2024-11-28,30/11/2024,GOOGL,Alphabet Inc Class A,BUY,34,163.769,$-5568.16,USD,20.46,0.00,Corporate,BRK004,NASDAQ,2024-11-28T10:27:01Z,Profit taking,Very High
TXN001000,ACC-328187,CUST_782,07/22/2024,07/23/2024,EUR/USD,Euro US Dollar,BUY,336334,1.06,"-357,815.01",USD,22.29,0.00,Retirement,BRK005,FOREX,2024-07-22T11:58:46Z,,low
